Date,Score,Reviews
"Jan 23, 2014",POSITIVE," It’s a rare phenomenon for a director to remake their own movie, but this year, there are already two instances of filmmakers retrofitting their foreign-language darlings for American audiences. Hans Petter Moland turned his Scandinavian thriller “In Order of Disappearance” into the Liam Neeson revenge flick “Cold Pursuit.” And now, Chilean director Sebastián Lelio remakes his amusing 2013 portrait of feminine middle-age, “Gloria,” into a vehicle for Julianne Moore, “Gloria Bell.” The title isn’t the only thing familiar about the film, which is essentially a shot-for-shot remake of the original, a carbon copy down to the line readings, tone and story beats. Both “Gloria” and “Gloria Bell” are slice-of-life depictions that seem simple on the surface but are remarkable for their singular focus on the experiences of a woman in her late 50s, a character type all too often forgotten or cast aside. But there’s something else about the character of Gloria that makes her different. She lives her life unabashedly, with her heart open, her dancing shoes on. It’s a frankly radical notion, not just for women, but for anyone. Gloria is a divorced mother of two grown children (Michael Cera and Caren Pistorius). She’s also a grandmother and an insurance adjuster. But what makes her so interesting and appealing is that her zest for life won’t be dampened by circumstance. She’s unafraid to hit disco bars alone, attends therapeutic cuddle-puddle giggling sessions and shouts the praises of a friend from the top of a parking structure. She leads with her heart, which makes her seem so alive, so in the moment. But when she encounters an interesting new man on the dance floor, Arnold (John Turturro), a layer of her charming bravado is peeled back — perhaps she would like to love again. In remakes of this nature, one has to search for the moments of dissonance, the elements that make it uniquely Chilean, or uniquely American (or Angeleno, to be exact). The small talk here centers on climate change, 401(k)s and having “work done,” both signifying the place and time, as well as the existential issues with which the film grapples so subtly. Moore is softer and more vulnerable than the brassy and bold Paulina García, who won best actress at the Berlin Film Festival for her performance in this role. But Moore is more relatable, a bit goofy, sometimes unsteady. Her sweet chemistry with Turturro as the fumbling Arnold is genuinely affectionate and sexy in a film that acknowledges the realism of sex and romance beyond your 20s. One does wonder about the purpose of the remake, when it hews so closely to the original, telling the same story. It almost seems that Moore discovered the film and character and decided she had to play Gloria, the way stage actors take on classic roles. Moore’s take brings a new dimension not only to the story but also to her career. Lelio’s approach to writing and directing is to pluck out moments from Gloria’s life with which to weave a tapestry of who she is at this moment, which unfolds before the audience in distinct patterns — Gloria’s signature oversize glasses, her habit of singing along to the radio in the car, her loving but strained relationship with her kids. Highlights and lowlights make up the rest of the image, moments of freedom and abandon anchored by dark nights of the soul. But always, Gloria is behind the wheel of her own destiny, and that is truly refreshing and inspiring."
"Jan 23, 2014",POSITIVE," “Are you always this happy?” Rodolfo asks Gloria, shortly after catching her eye. They are at a nightclub where middle-aged residents of Santiago, Chile, dance and flirt, and where Gloria, in her 50s and long divorced, occasionally goes to attract the attention of a silver-haired Romeo. Rodolfo, who has a kind, crumpled face and a winningly uncertain manner, makes Gloria laugh with this pickup line. No, she says, sometimes in the mornings she is sad, and in the afternoons, too. The great accomplishment of “Gloria,” the Chilean writer-director Sebastián Lelio’s astute, unpretentious and thrillingly humane new film, is that it acknowledges both sides of its heroine’s temperament without judgment or sentimentality. In a North American movie — a fizzy Hollywood comedy of empowerment or a glum indie kitchen-sink melodrama — a woman like Gloria would most likely invite either pity or condescending encouragement. But Gloria, played with dignity and gusto by Paulina García, is too complicated for such treatment. Her life is a familiar jumble of pleasures and frustrations, her personality a weave of moods, foibles and admirable traits. She sometimes drinks too much, smokes more than she should and hovers needily around her two grown children. She endures a dull office job and the late-night ranting of a mentally unstable neighbor, whose hairless cat finds its way into Gloria’s apartment. The more we learn about Rodolfo (Sergio Hernández), the more we might question her taste in men — a judgment confirmed during a family dinner with her ex-husband — but there is no doubting her curiosity or her confidence. She is immune to self-pity and not averse to emotional risk, as her relationship with Rodolfo demonstrates. He is recently divorced but still attached to his ex-wife and their two daughters, who have a habit of calling his cellphone at inconveniently intimate moments. But Gloria likes his company, likes having sex with him and is susceptible to his floridly sincere declarations of love. For all her practical good sense, she has a romantic side, most evident in her habit of singing along with pop songs on the radio. Viewed from one angle, “Gloria” is a cautionary love story, a tale of weary resilience in the face of disappointment and loss. But Mr. Lelio enriches it with a combination of narrative expansiveness and filmmaking discipline. No aspect of Gloria’s experience is off limits for him, and some of the film’s most memorable moments are those a more plot-focused director might have omitted, like the party scene in which she listens to unidentified friends performing Antônio Carlos Jobim’s “Waters of March,” one of the loveliest songs ever written.  Thank you for your patience while we verify access. If you are in Reader mode please exit and log into your Times account, or subscribe for all of The Times."
"Jan 23, 2014",POSITIVE," The Chilean matron at the heart of the wonderfully unsettling comedy Gloria looks like any ordinary woman confronting the familiar dilemmas of late middle age. For other reasons, though, you may feel as though you've met her before. The film's director, Sebastian Lelio, is up to all kinds of mischief, the least of which is Gloria's abundant hairdo and outsized spectacles, which give her a slight but unmistakable resemblance to Dustin Hoffman in Sydney Pollack's beloved 1982 comedy, Tootsie. The movie puts her through hell, but make no mistake: Gloria is a celebration. Like Tootsie's Dorothy Michaels, Gloria is cheerful, gifted with goodwill and common sense, and supportive to a fault. True, there's a little telltale sadness about her eyes. Like many women of her age, Gloria has reached a stage in her life when the losses are incremental and the future seems lonely and scary. Her children have their own lives; work is just for making a living; after 10 years as a divorcee she still lives alone, visited only by a mad neighbor's homely cat. Gloria is close to her family, but she's clinging to the edge of a world of which she was once the center. For a while we see her only in confined spaces: Even at the dance club where she goes to have fun and hunt for love, she seems hemmed in. Until, that is, she locks eyes with Rodolfo (Sergio Hernandez), a handsome, age-appropriate man with whom she feels such immediate rapport that they end up in bed that night. Their naked lovemaking is candidly shot and as avid as it is awkward. Rodolfo has the soft features, doe eyes and attentive manner of a sensitive soul. Look again: No, he's not a serial killer, but he's all kinds of trouble. Here Lelio begins to have some fun feeding audience expectations, then confounding them. The revelation that Rodolfo is a retired marine may raise Chilean hackles — the 1973 military coup that plunged the country into dictatorship was set in motion by naval officers — but the director veers away from the political-commentary path, unless you attach significance to the fact that Rodolfo's current combat of choice, and his living, is paintball. On an early date at Rodolfo's amusement park, the congenitally game Gloria finds herself trussed, bundled up and swung like a pendulum high above the ground. In another kind of movie, this might function as a cheap foreshadowing metaphor for helplessness; here, it also signals Gloria's openness to a wild ride. That she will get — which gives actress Paulina Garcia a golden role in which to explore a multitude of moods. Gloria is told entirely from its leading lady's point of view, and her mobile features, shot from every possible angle, register pain, amusement, exasperation and a kind of befuddled ecstasy. This is a woman who might smoke her first joint, exhort a weak lover to ""grow a pair,"" and finally seek a unique form of retributive justice with, shall we say, the tools at hand. Rodolfo, you see, will turn out to be only a slightly exaggerated version of the emotionally draining screw-up many survivors of the dating circuit will recognize with a wince. Yet both he and Gloria are both bewildered casualties of a radically modernized Chile in which the demand for individual rights has displaced a more traditional emphasis on obligations."
"Jan 23, 2014",NEGATIVE," By providing your information, you agree to our Terms of Use and our Privacy Policy.
				We use vendors that may also process your information to help provide our services. This site is protected by reCAPTCHA Enterprise and the Google Privacy Policy and Terms of Service apply. Produced by rising Chilean force-to-be-reckoned-with Pablo Larraín (“Post Mortem,” “No“), Sebastián Lelio‘s fourth feature, “Gloria,” proved to be one of the most pleasant surprises at last year’s Berlin Film Festival. While films focusing on female protagonists have not been in short supply during this and previous Berlinales, many of them featuring strong central performances and a realist style, Santiago-set “Gloria” is marked by two key differences that set it apart from, and above, many surface-similar films.  
	Firstly, the rigor of the approach—lead actress Paulina Garcia is not only in every scene, she’s in every single shot. And having a divorced mother of grown children, in her late 50s, be the subject of such an obsessive approach is nothing short of transgressive in how it makes central the kind of character who is so often invisible, or at best relegated to background importance. Secondly, and perhaps most surprisingly, Gloria is smart and kind and fundamentally a happy person, and it’s hard to remember the last time we saw a drama about one of those. It sounds like faint praise, but it really isn’t: Gloria is as real and true and interesting a character as we’ve ever seen, but she is neither stupid nor desperate nor haunted by a terrible past nor battling some dreadful addiction or affliction. Gloria is a normal, ordinary woman, and like most normal ordinary women, she has moments when she’s completely extraordinary and weird. As she goes through the tribulations of a love affair, suffers the departure of her daughter and fends off the advances of a neighbor’s hairless cat, things go right and things go wrong, but Gloria responds in her own unique yet utterly relatable way. By the end, her humor and resilience, and her unwillingness to take herself too seriously, means our initial liking for her blossoms into a kind of love.  
58 and sporting thick glasses, a la Dustin Hoffmann in “Tootsie,” Gloria lives alone, having divorced the father of her two grown children more than ten years prior. She works in an office during the week, stays in touch and on good terms with her son and daughter, and goes dancing by herself regularly, though she doesn’t always return alone. She is perhaps a little lonely, but it’s nothing she can’t handle, and it’s clear from the outset she does not regard herself as some sort of tragic heroine. Actually, she trusts herself most of the time, blames herself when she does something blameworthy, and then forgives herself and moves on. She doesn’t cast herself as a victim, even when she may actually be one—she has agency. We can’t stress enough how refreshing and unusual it is to have a complex, rounded character shown on screen who doesn’t hold some deep reserve of self-hatred or worthlessness—it’s little short of revelatory.  
And it’s a sensibility that extends to the whole film: just as Gloria doesn’t need some glaring fatal flaw or some manic pixie stylings to keep our interest, the film rarely resorts to melodrama or exaggeration to keep us engaged in the story. Gloria meets Rodolfo (Sergio Hernández), a paintball park owner and recent gastric bypass recipient (that comes across less screwball in the film, honest), at the dancehall and starts a relationship with him, but his tendency to walk to the heel of his dependent daughters frustrates her. Her pregnant daughter decides to leave the country, her son celebrates a birthday, she reconciles with Rodolfo for a holiday to Vina del Mar that goes awry… we’re aware this doesn’t sound like the stuff of great drama. However, these encounters and interactions play out with such truth and feeling that the narrative feels rich with incident and full of compassionate wisdom. And Lelio doesn’t shy away from physical details either—there are several instances of full-frontal nudity and some fairly explicit sex scenes that are not just “adult” but grown-up in how non-judgmentally they are presented.  By providing your information, you agree to our Terms of Use and our Privacy Policy.
				We use vendors that may also process your information to help provide our services. This site is protected by reCAPTCHA Enterprise and the Google Privacy Policy and Terms of Service apply. By providing your information, you agree to our Terms of Use and our Privacy Policy.
				We use vendors that may also process your information to help provide our services. This site is protected by reCAPTCHA Enterprise and the Google Privacy Policy and Terms of Service apply."
"Jan 23, 2014",POSITIVE," Movies about middle-aged women are so rare that it’s tempting to praise them on that basis alone. Thankfully, the Chilean drama Gloria, which won Paulina García the Best Actress prize at last year’s Berlin International Film Festival, doesn’t require much critical mitigation. Neither mocking nor quite celebrating its title character, who’s at once adorable and exasperating, the film asserts—even in the face of grim box-office realities—that menopause isn’t the end of sex or love. At the same time, though, it’s utterly realistic about the challenges of looking for love in an age group consisting almost entirely of people who’ve failed, in one form or another, at creating a viable long-term partnership. First seen practicing both her dance moves and her awkward seduction technique in a crowded disco, Gloria (García) puts a great deal of effort into her appearance without really understanding what’s attractive, resulting in a look that seems dowdier than she must have intended. Determined not to be some sad cat lady—though a neighbor’s cat apparently has other ideas—she eventually locates a kindred spirit in Rodolfo (Sergio Hernández), a courtly gentleman her own age who dotes on her… most of the time. Problem is, he still has strong ties to his troubled ex-wife, continually interrupting dates and vacations with Gloria to take phone calls from her, or from his adult children on her behalf. Whether his behavior indicates conscientiousness or rudeness is in the eye of the beholder; Gloria’s eyes, however, framed behind her giant, unflattering glasses, increasingly narrow. It’s to both García’s and Sebastián Lelio’s credit that festival audiences have been sharply divided on whether Gloria is admirable or pitiable, and on whether her perception of Rodolfo’s solicitude toward a former spouse is accurate or delusional. Either way, Gloria is a beautifully judged portrait of loneliness and resilience, equally effective whether seen as “you go girl” triumphalism or the willful obliviousness of someone for whom the truth would be too painful to endure. (A climactic sequence set to a Spanish version of  “Gloria”—as made famous in the U.S. by Laura Branigan—fits either interpretation.) García commits fully to this willful, indomitable, thoroughly odd woman, making her distinctive and memorable enough to earn the movie’s use of her name as its title. Who knows—maybe the film’s modest achievement would seem less impressive if more fiftysomething women were at the center of movies on a regular basis. Fact is, they aren’t."
"Jan 22, 2014",POSITIVE,"The leads give subtle, poignant performances that stick with you."
"Jan 22, 2014",POSITIVE," Paulina Garcia has the face of a real-life woman in late middle age, one with facial muscles that move all the way up to the hairline and skin that is starting to slacken. Her body (which you get to know well) is quite a bit better than average, but it bears the obvious marks of a long-ago pregnancy. Of course none of this is exotic in real life, but in movies it’s pretty rare, and Chilean director Sebastián Lelio stalks his heroine around Santiago with the enthusiasm of a man who’s discovered a new wildlife species in remote Madagascar. The long-divorced Gloria (Garcia) hangs in singles bars catering to her age group (theme song: “I Feel Love”) until one day she meets what seems to be a catch: a divorced, slightly older man (Sergio Hernández), with a healthy sex drive and a strong attraction to her. The emphasis, alas, turns out to be on “seems.” Gloria must decide whether her dissatisfactions — inattentive adult kids, mopey ex-husband, suspicious new boyfriend — are going to keep her off the dance floor. It is all tied to the disconnected feelings of post-Pinochet Chileans, in a way that a foreigner can’t miss, but may be unable to fully comprehend. Fortunately, Garcia — singing along with pop songs or indulging in a flashy act of revenge — is always worth paying attention to."
"Jan 21, 2014",POSITIVE," BERLIN – Hardly the most richly served of moviegoing demographics, smart middle-aged women will give a warm embrace to Gloria, making it a seemingly surefire contender for significant art house acceptance. But it’s hard to imagine anyone with a heart and a brain not responding to the quiet delights and stunning intimacy of Chilean director Sebastian Lelio’s account of the personal evolution of a 58-year-old divorcee, played with scrupulous honesty and intelligence by the wonderful Paulina Garcia. A large part of the cumulative joy of this movie is considering all the ways in which the story might have been mishandled. Midlife sexual desire, second-chance romance, the hunger for companionship, the challenging path toward self-reliance — these are all potential minefields ready to set off explosions of mawkish cliché. But Gloria is a work of maturity, depth and emotional insight. There’s not a single false note here to push the uplifting empowerment or resilience angles, or the conclusion that having a man is not a requirement in order to feel complete. Yet those nonstrident feminist themes emerge organically, without the need to be articulated. The title character is first glimpsed at a Santiago dance club populated by similarly middle-class mid-lifers. She gets pleasantly tipsy and flirty with an old acquaintance, yet fails to seal the deal. Gloria shuffles home alone not only to endure the screaming rants of the bipolar stoner living upstairs, audible through the ceiling, but also to find his whiny hairless cat in her apartment. In one of many touches of sly humor, this ugly animal appears to have decided that Gloria’s best option is to become a lonely cat lady. Still attractive and well put-together, but in a way that suggests a lack of vanity or the standard terror of aging, Gloria holds down a decent job and invariably is the one to make the effort to see her grown children. Her son Pedro (Diego Fontecilla) is a single father of a kid whose mother is out of the picture, while her daughter Ana (Fabiola Zamora) teaches a yoga class and has a budding relationship with a Swedish ski enthusiast. Divorced more than a decade ago, Gloria is much too level-headed to sit around moping in self-pity, but clearly something is missing. That threatens to change when she meets Rodolfo (Sergio Hernandez), a soft-spoken gent with a puppy-dog air, whose marriage ended more recently. The owner of a small funpark offering paint-gun battles and bungee jumps, he is in the process of restarting his life after gastric bypass surgery and dramatic weight loss. There’s a pleasing economy of means throughout the film, but particularly in Lelio’s way of chronicling their fast-blooming romance. This is complemented by the candor with which cinematographer Benjamin Echazarreta covers the sex scenes, observing their aging bodies with neither judgment nor embarrassment. Gloria is reinvigorated by the relationship yet is not the type to get all girly and airborne, even as Rodolfo reads her love poems in bed. She’s aware that he comes with baggage, and even the vintage ringtone of his cell phone is a hint of his ties to the past. The two needy grown daughters he supports financially are a noose around his neck but also evidence of his own dependence; he drops everything to run whenever they call. He also declines to “complicate” things by telling them about Gloria. But Rodolfo’s weakness becomes impossible to ignore when, feeling shut out of family reminiscences during Pablo’s birthday dinner, he reacts by slipping away silently, humiliating Gloria. Much of the movie’s second half is given over to Gloria resolving to cut her losses and shut the door on the sweet but spineless man who keeps begging for a second chance. When she relents, and agrees to a resort weekend, the look of helplessness on his face even as he tries to ignore a freshly arisen crisis back home is both touching and pathetic. A lot of women put through the deflating situations Gloria experiences would crumble. But in Lelio and Gonzalo Maza’s perceptive script, the character retains dignity and behavioral credibility even through the messy episodes that signpost her quiet catharsis. Onscreen for the duration in a story seen entirely from Gloria’s perspective, Garcia is remarkable, not least for the rigorous unshowiness and integrity of her self-possessed performance. She sets the tone for a gently humorous melodrama that’s refreshingly grownup, which is a rare thing. The realness of the central character extends to her relationships with friends and family, particularly in the subtle signs of friction softened by love with Ana. And while Gloria’s ex (Alejandro Goic) obviously had his shortcomings as a husband and father, this is not a movie that condescends to its protagonist or to its female audience by making sweeping generalizations that men are weak and women are the emotionally heroic ones. Chilean social context is sketched in with just a few brief verbal or visual nods to government disillusionment, popular unrest, corruption and the escalating cost of living. But the personal world depicted here is a universal one. In addition to Echazarreta’s close camerawork and the fluid editing of Lelio and Soledad Salfate, this gorgeous character study is aided immeasurably by well-considered music choices. Watching Gloria sing along to sentimental Latin pop while driving is an especially lovely touch in a movie notable for its absence of silly sentimentality. And her generation is neatly defined by songs that bookend the film, with Donna Summer’s disco classic “I Feel Love” near the start, and at the end — what else? — Umberto Tozzi’s ecstatic late-‘70s Italian evergreen, “Gloria.” As a concluding note, it’s perfection."
"Jan 21, 2014",POSITIVE,"A divorced woman in her late 50s recaptures her life in Sebastian Lelio's pitch-perfect, terrifically written Gloria."
