Date,Score,Reviews
"Oct 20, 2019",NEUTRAL,"very slow paced, but very good character builder for The Joker."
"Oct 20, 2019",POSITIVE,"Amazing, all of it just wow!"
"Oct 20, 2019",NEGATIVE,"Not my kind of movie.  I shouldn't have watched it.  If you like disturbing egregious graphic violence, go see it."
"Oct 20, 2019",NEGATIVE,"Decent movie portraying a very different take on the genesis of a very well-known character. It feels like this movie would have been much better if had not attempted to disguise itself as a comic book movie. As it stands, the most dull and unappealing part of the film were the parts where it tried to present connections to the Batman/Bruce Wayne character."
"Oct 20, 2019",POSITIVE,"Very emotional..dark..well written, great acting. For mature audience."
"Oct 20, 2019",POSITIVE,"Amazing film!!! From the setting details, to the development of the iconic villain. Acting was breath taking, instantly drawn to every emotion the character went through. I have witnessed one of DCs greatest film of all time!! I couldnt have imagined this outcome. Loved the movie, the story, and the emotional rollercoaster ride!"
"Oct 20, 2019",POSITIVE,Amazing movie. Builds and builds until the climax. Worth seeing twice in theaters.
"Oct 20, 2019",NEGATIVE,Played out the mental illness way too long to where it got boring
"Oct 20, 2019",POSITIVE,"Joaquin Phoenix was amazing. I’ll be shocked if he doesn’t win the Oscar for his performance. Personally, I wasn’t prepared for the reality of the mental health crisis that is happening in every community in this country. Not sure this was the best portrayal the mental health crisis in this country."
"Oct 20, 2019",POSITIVE,Such an amazing movie! Oscars for everyone involved!
"Oct 20, 2019",POSITIVE,The movie was amazing.
"Oct 20, 2019",POSITIVE,Can’t wait to see him do more jokers
"Oct 20, 2019",NEUTRAL,"It's not a superhero movie Good character development, with well executed roles."
"Oct 19, 2019",POSITIVE,Great twists good ending. An interesting tale of a crazy person snapping.
"Oct 19, 2019",POSITIVE,The acting was SUPERB!!!!
"Oct 19, 2019",NEGATIVE,Too depressing and psychological. Ugh waste of my money.
"Oct 19, 2019",POSITIVE,Loved it! Joaquin Phoenix was awesome as the Joker!
"Oct 19, 2019",POSITIVE,Movie was great along with bringing awareness to mental health.
"Oct 19, 2019",POSITIVE,"I went to the movies with my son, an avid comics fan, with low expectations due to what the ""tomatometer"" critics were writing.

I WILL NEVER BELIEVE THE TOMATOMETER AGAIN!

This was a phenomenal reintroduction to a prominent villain from DC.  They did such a great job with character development that I am waiting for more from DC with great anticipation.  

It takes a great villain to make a greater super hero.  The connection between the Joker and Bruce Wayne will be a never ending, twisted, and endearing struggle from here on out.

Though I felt it had a slow start; I loved every minute of the movie once he found himself.  I was even caught by surprise (blindsided) by plot twists.

I am going to buy this one for the collection, and possibly go see it again at the theater "
"Oct 19, 2019",POSITIVE,Joaquin Phoenix did a great job portraying the Joker. Somewhat disappointed by the rumors that the sequel will involve Batman and the Riddler.
"Oct 19, 2019",POSITIVE,Loved it!!! A real good reason to become the joker...
"Oct 19, 2019",POSITIVE,I loved how they tied everything up at the end but it took a long time to get there.
"Oct 19, 2019",POSITIVE,Amazing amazing amazing
"Oct 19, 2019",POSITIVE,This is one of the most poignant and beautifully disturbing films you will ever see.
"Oct 19, 2019",POSITIVE,This was one of the best movies I have seen.  Joaquin Phoenix was amazing.
"Oct 19, 2019",POSITIVE,A disturbing tale of DCs most disturbing villains.  I hope Todd Phillips does other DC Black Label projects.
"Oct 19, 2019",POSITIVE,Every second was worth the watch
"Oct 19, 2019",POSITIVE,Excellent Movie from beginning to end
"Oct 19, 2019",POSITIVE,Best movie of the year!
"Oct 19, 2019",POSITIVE,Joaquin Phoenix was excellent.
"Oct 19, 2019",POSITIVE,Great movie . Starts out slow but finishes strong.  Definitely a very dark movie... no Superheroes here!
"Oct 19, 2019",POSITIVE,Phoenix is amazing in this dark and powerful movie.  I was sad a lot more than I expected and delighted with the finish.
"Oct 19, 2019",POSITIVE,"Very well acted and very well don. Beautiful, dark and tragic yet also has some dark comedic elements too but is gritty and real. Very thought provoking too very intense though. but a great movie overall"
"Oct 15, 2019",POSITIVE,"The story is great, gets you feeling for the character as a person but really goes into how he eventually becomes the joker which in a way is crazy because you root for this but also feel like am I the crazy one for rooting for it. It puts you in a dilemma where you think would I follow joker or be against him."
"Oct 15, 2019",POSITIVE,Great movie. I loved the different take on the story and the acting was amazing. Just be prepared it is super dark.
"Oct 15, 2019",POSITIVE,This is the best movie ive seen this year .
"Oct 15, 2019",POSITIVE,Amazing.  Joaquin Phoenix performance was spectacular
"Oct 15, 2019",POSITIVE,Definitely rated R. Not recommended for children. Good movie tho
"Oct 15, 2019",NEGATIVE,Too much setup for not enough payoff.
"Oct 15, 2019",POSITIVE,Joaquin Phoenix  was amazing!!
"Oct 15, 2019",POSITIVE,"Phoenix was amazing, crazy good. The movie was deep and dark. Looking forward to a Joker sequel and/or a Batman/Joker movie."
"Oct 15, 2019",POSITIVE,The movie was phenomenal. if you are looking for a happy go lucky movie with a redeeming quality this is not for you. The movie at time was disturbing and it's not for the faint of heart.
"Oct 15, 2019",POSITIVE,"Just when I was thinking I might get bored, a nice twist came in and it finished strong!"
"Oct 15, 2019",POSITIVE,"A piece of art.. really portrays Jokers story... also the fragility of mental illness and causes the audience to think about how societal treatment affects others, amongst other factors that lead Joker to his breaking point."
"Oct 15, 2019",NEGATIVE,"While he puts in a good performance , the film is a badly made homage to Taxi Driver and The King Of Comedy .
Its running time is just over two hours and it felt like I was watching this film for four hours . 
Do yourself a favor and wait for Netflix"
"Oct 15, 2019",POSITIVE,Such an amazing film! Beautifully tragic and unjustifiable yet understood. Faithful to the meaning of the character through and through.
"Oct 15, 2019",POSITIVE,A lot of symbolism that people won't understand.
"Oct 15, 2019",NEGATIVE,Very disturbing movie. Was expecting violence but not such a psychologically disturbing movie.
"Oct 15, 2019",POSITIVE,"Beautiful performances all around. Kinda hard to watch some parts, as a lot of the movie deals with mental illness, and its difficult to watch someone spiral out of control. But the purpose of art is to make you feel, so Id say Joker did its job."
"Oct 15, 2019",POSITIVE,Joaquin Phoenix was brilliant in this role
"Oct 15, 2019",POSITIVE,I think the joker was very intense. The actual story disturb me. I do think the main character was extremely artistic and talented. But it was a very disturbing movie — and sad
"Oct 15, 2019",NEUTRAL,Very slow start. Not sure what the big deal the media and law enforcement made? Natural Born Killers was way more violent and gruesome!
"Oct 15, 2019",POSITIVE,One of the darkes and most magnificent films ever made.
"Oct 14, 2019",POSITIVE,Amazing story relevant to todays social issues.
"Oct 14, 2019",NEGATIVE,Very slow and borderline boring.  joaquin phoenix Played the character well though
"Oct 14, 2019",POSITIVE,Captivating.  Joaquin should get best actor!   Great movie!
"Oct 14, 2019",POSITIVE,Joaquin Phoenix does it again....
"Oct 14, 2019",POSITIVE,"Knock, knock,
Who's there?
Academy award winner Joaquin Pheonix!
Stellar performance"
"Oct 14, 2019",NEUTRAL,"Everything about this movie should have made it 5 stars - great acting, great storyline - but for some reason I left underwhelmed and even got bored at times.  Worth seeing but overall disappointing."
"Oct 14, 2019",POSITIVE,"Great acting, great movie!"
"Oct 14, 2019",POSITIVE,The best movie I seen this year
"Oct 14, 2019",NEGATIVE,It was extremely long and drawn out.  It was very dark and erie.
"Oct 14, 2019",POSITIVE,Good job by Joaquin Phoenix great movie but moved a little slow
"Oct 14, 2019",POSITIVE,If you want a comic book movie..skip this one
"Oct 14, 2019",POSITIVE,"Intense and violent, but well acted and an interesting back story about Joker and how he fits into the Batman story. Great job by Joaquin Phoenix."
"Oct 14, 2019",POSITIVE,It was an absolute masterpiece...
"Oct 14, 2019",POSITIVE,Great movie it actually got me to go watch batman i haven't really watched any before
"Oct 14, 2019",POSITIVE,Great movie!! Pretty dark but it was a masterpiece!!
"Oct 14, 2019",NEUTRAL,"Ugly, tragic, occasionally beautiful. This works best if you pretend you've never heard of Batman or his arch-nemesis."
"Oct 14, 2019",POSITIVE,"Most villains are comically bad caricatures, mustache-twirling monsters whose only purpose is to be defeated by the heroes. Not here: writing a believable villain that makes the audience understand why he is the way he is, in other words, how he's human is hard and the film nails that. Absolute must see character study. "
"Oct 14, 2019",POSITIVE,"I'ts not the DC Joker everyone was running to the theater expecting to see, but do not let that deter you from seeing this movie.  I found it extremely entertaining as well as educational. Never underestimate the seriousness of mental health issues.  Additionally, it pays to be nice to those who are different from us.  It can literally save your life!"
"Oct 14, 2019",POSITIVE,The movie was spectacular! It really drew me in and kept me on my toes. It was a fun and thrilling adventure through a mind falling apart...on a character I remember well from my comic book days.
"Oct 14, 2019",POSITIVE,Perfection - in every shape and form. Phoenix deserves an Oscar.
"Oct 14, 2019",NEGATIVE,Skip it. Didn’t know it was a dance movie. Heath Ledger is a much better joker
"Oct 14, 2019",POSITIVE,"Short and Sweet: Even if you despise the genre, Joaquin Phoenix's performance is Superb, and that may be an understatement. Point being if you appreciate stellar acting, I'd highly recommend you go see this film."
"Oct 14, 2019",POSITIVE,It is very violent and disturbing but also very good.  It's worth seeing just for Joaquin Phoenix' performance.
"Oct 14, 2019",POSITIVE,sick movie definitely worth a watch!
"Oct 14, 2019",POSITIVE,"One of the best storylines, one of the funniest movies in awhile (didn't expect that), an absolutely wonderful acting by Joaquin Phoenix, just enough violence, and an exact mirror of today's society. I never write reviews, I do rate movies, but this one was way and far above my expectations."
"Oct 14, 2019",POSITIVE,"Feels so real you are swept away while watching Joker. What an intense, disturbing and captivating journey it is. You'll leave the theater saying ""I need time to process this, but damn it was good!"""
"Oct 14, 2019",NEUTRAL,Joaquin Phoenix's acting was awesome. The movie gave the joker a more realistic and darker touch.
"Oct 14, 2019",POSITIVE,Saw this twice the week it opened. REALLY enjoyed it. Joaquin was terrific. 
"Oct 14, 2019",POSITIVE,Love it !!! Amazing !!!
"Oct 14, 2019",NEGATIVE,Did not live up to the hype
"Oct 14, 2019",POSITIVE,I loved it. Anyone saying its to violent never saw the movie. 
"Oct 14, 2019",NEUTRAL,"The acting is brilliant, yet the plot so dark...it didn't develop any characters except the Joker.  I think he deserves an Oscar nomination, but the movie is just ok.."
"Oct 14, 2019",POSITIVE,"“Jokers”, character was brought out after all these years in Gotham City. Who would have thought he was abused as a child, as well as his stepmother. This is the epitomy of mental illness carried from childhood to adulthood. Although “The Jokers” illness was controlled through medication, once removed from meds, his only alternative was to strike back to those who abused him in adulthood."
"Oct 14, 2019",NEUTRAL,Slow in the beginning
"Oct 14, 2019",POSITIVE,Great film great content
"Oct 14, 2019",POSITIVE,"Great movie! Definitely deserve another watch. Joaquin Phoenix performance was incredibly amazing. From Arthur Fleck ticks and mannerisms also some subtle details are stellar. From how he hurt himself from his laughing disorder to limp when he walks really makes Arthur sympathetic. Nevertheless, a psychopathic maniac with a nihilistic perception of the world. AGAIN, GREAT MOVIE."
"Oct 14, 2019",POSITIVE,"this movie was awsome, one of the best acted movies ive seen. the new joker is amaizing."
"Oct 14, 2019",POSITIVE,Joaquin Phoenix was phenomenal.
"Oct 14, 2019",POSITIVE,I loved it! It was not predicting at all to me so it was just all types of insanely good.
"Oct 14, 2019",POSITIVE,Great movie. Great actor. Great story.
"Oct 14, 2019",POSITIVE,"Joker is a film about a man's transformation from the mentally ill loner Arthur Fleck to the widely-known villain Joker. This seems straightforward enough, but there are much deeper messages in this movie that apply not just to this fictional universe, but to our real world. 
Arthur is a man who has been beaten down by not just society but fate itself time and time again. He has been dealt, for lack of a better term, a shit hand and no one in his life seems to truly want to help him. He is a man that truly is alone in society, learning throughout the film how true that statement really is. 
While the actions committed by him are definitely wrong, we understand him and can even somewhat empathize with him (hopefully we can, I may just be weird). Unlike how some people like to suggest, this movie doesn't glorify the violence that Arthur causes. This movie shows how horrible people can be created by the environment they are living in. We are living in a time where we like to blame the violence around us on the insane people who start it. Shootings are happening more than ever, and the insane gunman is responsible for it. 
Of course, it cannot be denied that the gunman is at fault. There is clearly something wrong with the people who do these things. However, much too few people think, ""Why is this happening?"", ""Why are these people doing the things they do, and how can we stop them from doing this?"" We see the result of what happens when an at risk individual doesn't get the help he needs in this movie. What we need is a system that can actually help these people. 
The movie Joker differs from other comic book movies because it is not only grounded in reality, but it's messages can be directly applied to our world. People like Arthur Fleck, people who have been brutally beaten by life at every turn need a way to be helped. The rich and successful don't care about these people. These people are viewed as threats instead of who they really are: humans, just like everyone else. We need to create an outlet where these individuals can get the actual support they need, not stuff them with medication and let specialists with their own agendas pretend to care about them. 
Another argument I've seen about this movie is that it has no reason for existing. It shows violence and shows a unique portrayal of a popular character but it has no substance to it. As you can probably tell, I strongly disagree with anyone who believes this, and I truly believe anyone who thinks this completely missed the point of the entire movie.
In conclusion, this movie definitely has substance and doesn't glorify violence in the slightest. This movie brings up an issue in our society that we have been neglecting for far too long. There's a stigma about mentally ill people that we have to get over. People who have been neglected and have nothing left to lose are the most dangerous type of people, and the problem with our society is that we allow people to feel as if they have nothing left to lose. Arthur Fleck is just a person who never got any sign at all that he was needed or loved by society, or anyone for that matter. He is truly, as cliche as this may sound, a product of his environment. You can criticize this movie for being too dark but by doing so you're just dismissing the reality we live in.
"
"Oct 14, 2019",POSITIVE,Great movie and message. It may offend sensibilities for some but I was pleased with the outcome. A must see.
"Oct 14, 2019",POSITIVE,Joaquin Phoenix was incredible!  Movie was a bit slow. The scenes with him laughing over and over were a bit overplayed.
"Oct 14, 2019",POSITIVE,"An amazing movie in a disturbing, thought provoking way.
Did it make me want to go out and hurt people?  The exact opposite, it made me want to be more empathetic and not be callous to others."
"Oct 14, 2019",POSITIVE,"Amazing acting, soundtrack, and cinematography. I know the character and storyline are controversial but personally I think that it was a very honest, raw portrayal of mental illness. Its a very creepy, emotional movie hat has some gory scenes, but to be clear - I dont think that it condones violence at all, simply seeks to dig into the problems that we as a society have yet to face and shows how bad the outcome can be. Aside from the controversy, everything about this film is a masterpiece. The music, the lighting. Joaquin Phoenix. I would definitely see it again."
"Oct 14, 2019",POSITIVE,"Good acting, good music, maintains interest throughout and an interesting ending to ponder - just goes a bit sideways at times."
"Oct 14, 2019",POSITIVE,Dark but beautiful movie. Definitely on the Oscar list
"Oct 14, 2019",POSITIVE,"Joker was utterly brilliant. If Phoenix doesn’t win the academy award for Best Actor, I’ll lose faith in humanity. "
"Oct 14, 2019",POSITIVE,Best movie Ive seen in quite some time!
"Oct 14, 2019",POSITIVE,"So human, the ignorance about mental illness in so many people and instead of helping somehow we make everything worse diminishing and making fun or talking insulting towards them"
"Oct 14, 2019",POSITIVE,"Great movie, interesting story and explanation of Jokers history. Phoenix acting was award winning as well."
"Oct 14, 2019",POSITIVE,Amazing look at the unstable mind and why people crack.  A must see movie!! You Do Not Need to be a Batman enthusiast to thoroughly enjoy this film.Joaquin Phoenix gives an exceptional performance! If you only pick 1 movie to see this fall.. Joker should be it
"Oct 14, 2019",POSITIVE,Phoenix's performance is legendary.
"Oct 14, 2019",POSITIVE,Absolutely amazing!!!!
"Oct 14, 2019",POSITIVE,Movie was absolutely brilliant
"Oct 14, 2019",POSITIVE,"I absolutely loved this movie. The way they portrayed the joker was phenomenal. Mental health is a running theme throughout the film, showing just how difficult times were and how our system views mental illness."
"Oct 14, 2019",POSITIVE,Definitely unique for the comic book/anti-hero genre. This movie makes you feel emotionally invested in a character that you have known for a long time but now have to re-analyze and rediscover how you viewed him previously. Very engaging movie and awesome acting by Joaquin Phoenix!
"Oct 14, 2019",POSITIVE,Amazing film.  Not ur usual. But had so many important messages.
"Oct 14, 2019",POSITIVE,Depicts the story of Joker very well. It’s what you least expect and I love it! Beautiful performance
"Oct 14, 2019",POSITIVE,I stan comrade Joker!
"Oct 14, 2019",NEGATIVE,"A film acclaimed by internet film gurus that I genuinely do not get the hype for. I walked out wondering if they saw a different film than me. Todd Phillips mishandles one of comic book's most legendary characters and gives us a dreadful two hour, downright repetitive film. You really feel the directors struggle trying to compel us with the same scenes over and over. I lost count of the times the filmed stopped to show a slow motion, overly-dramatic scene of Arthur dancing or him maniacally laughing. Is that the extent of his filmmaking craft? Is there not a better story they could conjure up to give the character some meaningful development other than just beating him up for ninety-minutes? Apparently not. "
"Oct 14, 2019",POSITIVE,Greatest movie Ive seen in theaters in a long time. A must see.
"Oct 14, 2019",POSITIVE,Amazing performance by Joaquin
"Oct 14, 2019",POSITIVE,Phenomenal acting.  Movie really makes you feel and think.
"Oct 14, 2019",NEGATIVE,Cool movie but took to long for him to become the JOKER!!!!
"Oct 14, 2019",POSITIVE,Joaquin Phoenix gives one of the best performances I have ever seen. His ability to project the vulnerability and rage of the character is phenomenal. It is by far the best origin story ever!
"Oct 14, 2019",POSITIVE,Absolutely Beyond Incredible!!!!!!!! The Best Joker Ever!!!!!! A Must See!!!! Joaquin Phoenix was Exuberant in his performance!!!!!
"Oct 14, 2019",NEUTRAL,"Loved Joaquin-- as always a powerful actor. Disliked deviation from the sociopathic, unfeeling Joker of the comics."
"Oct 14, 2019",POSITIVE,"Amazing
Brutal
Suspense"
"Oct 14, 2019",POSITIVE,Beginning was fantastic all the way till the end
"Oct 14, 2019",POSITIVE,It was intense.  Joaquin Phoenix was superb.
"Oct 14, 2019",POSITIVE,Absolutely phenomenal... was on the fence about it especially after the late great Heath Ledgers performance but I actually liked Joaquin Phoenix better.
"Oct 14, 2019",POSITIVE,The acting was award winning
"Oct 14, 2019",POSITIVE,Do not believe the critics and media! It was awesome!
"Oct 14, 2019",POSITIVE,"great acting,  great shots and the drama was intense and very current with what is going on in society."
"Oct 14, 2019",NEUTRAL,"mental illness sad,  in the case very dark and deadly. great acting, well done"
"Oct 14, 2019",POSITIVE,"The entire movie was a master piece, a must watch for ALL."
"Oct 14, 2019",POSITIVE,Joaquin Phoenix was phenomenal as Joker!! Definitely an Oscar award winning role and performance!!!
"Oct 14, 2019",POSITIVE,A detailed and dark story on how Arthur became Joker! First movie to leave me speechless! It is also a look into how important it is to be aware of mental illness and how it can have an effect in someones life!
"Oct 14, 2019",POSITIVE,"Really enjoyed this movie! Great storyline. Oddly enough, was cheering for Joker the whole time haha"
"Oct 14, 2019",POSITIVE,"This movie was brilliant. Keep in mind, this is a Joker origin movie of sorts, not the Wayne’s or Bruce, although they do play a part in the movie, especially Thomas Wayne. You get to witness what made him into the Joker we all love. Joaquin Phoenix IS our Joker now, in my opinion. He put on a spectacular show. Arguably the best in his career."
"Oct 14, 2019",POSITIVE,wow. i’m speechless. i would rate this a 6/5 if i could. joaquin phoenix’s portrayal of the joker is INSANE. i haven’t seen a movie this good in so long. i would definitely recommend watching.
"Oct 14, 2019",POSITIVE,"One thing you should know about this movie is that it’s raw. It makes you feel like it’s real. You see a man slowly decline into madness from a world that’s very reminiscent of the one we live in now. Joaquin Phoenix fully engulfed himself in this role and it shows, he took The Joker and made it his own. Very good and original movie."
"Oct 14, 2019",POSITIVE,Absolutely incredible. Best movie of 2019.
"Oct 14, 2019",NEGATIVE,Very bizarre movie. Not quite sure what to say other than that.
"Oct 14, 2019",POSITIVE,great movie...DEEP!!
"Oct 14, 2019",POSITIVE,Phenomenal acting!!!
"Oct 14, 2019",NEGATIVE,"I was expecting more to the story line, more action or something. The movie just dragged."
"Oct 14, 2019",POSITIVE,Turned out to be a pretty sad movie when you think about it but Joaquin Phoenix did an AMAZINGj job.
"Oct 14, 2019",NEGATIVE,"Not much action, suspense, drama, or anything at all remarkable. It painted a logical psychological prequel to the Batman movies, but was wholly boring throughout."
"Oct 14, 2019",POSITIVE,"Not your typical DC/Marvel movie because it isn't one.. Amazing character development. A little morbid/violent that might turn some people off. Strong messages around themes of privilege and mental health. DC, take notes."
"Oct 14, 2019",POSITIVE,Movie was an excellent and a refreshingly gritty new take on the most notorious villain.
"Oct 14, 2019",POSITIVE,"Deserves numerous Oscar for the score, Juaqin's performencs, and the amazing cinimetography. Every scene was truly a masterpiece."
"Oct 14, 2019",POSITIVE,Acting in this movie is superb by Joaquin Phoenix. I was captivated from the start watching Arthur trying to fit in in an unforgiven world. His struggle with mental illness and yet a duty to work and take care of his responsibilities while contributing to society is intriguing. It is a shame that the everyday pressures of coping in this world finally breaks something in him that can't be put back together. Also the way the film switches from reality to his delusions forces you to pay attention to all the cues. Although this is a tough subject matter I do hope Arthur or better yet Joker can be further developed into a sequel.
"Oct 14, 2019",POSITIVE,"Slow start, but great build up to how the madness all began"
"Oct 14, 2019",POSITIVE,best rates R movie I have ever seen 
"Oct 14, 2019",POSITIVE,"Loved Everything, it followed the killing joke storyline. The ending was the best part when he was on the hood of the car. I will for sure see it again."
"Oct 14, 2019",POSITIVE,Best movie I have seen in years. Absolutely love this Joker.
"Oct 14, 2019",POSITIVE,loved everyyyyyyything kinda slow but i thought it was worth it
"Oct 14, 2019",POSITIVE,Best Actor Oscar favorite
