Date,Score,Reviews
"Apr 13, 2024",POSITIVE,Who knew a movie made me sympathetic towards the Joker?
"Apr 13, 2024",POSITIVE,'Joker' is a masterpiece of comic-book cinema.
"Apr 13, 2024",POSITIVE,SUCH A MASTER PIECE ITS SHOWS US DIFFERENT ASPECTS OF DAILY LIFE AND WHAT ITS LIKE TO BE THE OTHER PERSON
"Apr 12, 2024",POSITIVE,"I loved this movie, Phoenix nailed as the joker"
"Apr 11, 2024",POSITIVE,"A masterpiece showing what would happen if a mentally ill would make his worst ideas real, most stunningly depicted by Joaquin Phoenix. He definitely earned his Oscar.
To me it's the best film so far taking place in the universe of an American superhero franchise. An absolute must-watch."
"Apr 10, 2024",NEGATIVE,"Excellent acting and cinematography, but of the 1000's of movies I've seen, there are only 2 that I would call disturbingly irresponsible pieces of art.  This is one.  Don't waste your time, it's 2 hours you'll never get back."
"Apr 10, 2024",POSITIVE,"Well mental illness and struggles are hard to define from person to person ...I am over 60 ..in pain with arthritis and loosing hearing plus anxiety & depression as conjoined twins .. which I never thought I would get to at this stage ...but finding anyone putting these awful issues of trauma ...hurt ..despise ...vengeful thoughts ?? I came out of the cinema pretty shaken and first words were ...' what the hell did I just see' ...I was put on the spot of my own issues of hate or seething..misunderstanding and just wearing life with a smile.
I have watched many a DC and Marvel commentary on the big screen ..some with 'pow' ...'zap' and gotcha ...to some nonsense 3 hour slog of bum.numness..which has beat me...what Todd gave us was not refreshing but a mirror to society of our current understanding that mental illness and struggle are too hard to deal with or comprehend (plus violence)  ..how to work it out ..so we going to visit part 2 and I stayed alive thus far to make it to part 2 ...however ...one day ...it will count for so much more than comic books or  madness ...mayhem please see further than the end of popcorn stuffed noses and cheese stuffed nachos ...and endless pepsi refills."
"Apr 10, 2024",NEGATIVE,One of the most unwatchable movies I have ever had the displeasure of viewing.
"Apr 10, 2024",NEUTRAL,"An okay movie. Worth a watch. 
My two biggest problems are:
1. Why did this need to be a batman movie? If you took the exact same plot, set it in Chicago, took out Thomas Wayne and replaced him with some other billionaire, and instead of calling himself joker at the end, he called himself something else, would it actually change the story? I don't think so.
2. The story's themes had been done better in other movies decades ago. For the modern generation of superhero fans who've never seen films like Taxi driver, King of comedy or Falling down, the film might seem groundbreaking, but those films did the same thing and they did them much better. 
It's basically a Taxi driver, King of comedy mashup with a hint of Falling down with a Batman coat of paint slapped on it."
"Apr 4, 2024",POSITIVE,joker joker joker joker
"Apr 4, 2024",NEGATIVE,Acknowledging that you're ripping something off (King of Comedy) doesn't make it okay.
"Apr 3, 2024",NEUTRAL,It was a good story of a person turning psycho.
"Mar 29, 2024",POSITIVE,"Was going into this film with low expectations, and boy did it surpass them! A very gritty and dark realism take on the Joker Character. Makes you see the world from his eyes and at points makes you feel a sense of dread just as the story's protagonist does. Nearly a flawless film in my opinion. Only main gripe is that this feels like a psychological horror film with Batman elements thrown in. But this is definitely a must watch for any movie goer."
"Mar 29, 2024",POSITIVE,"Son unas de las mejores representaciones del origen del conocido personaje Joker, su oscuro pasado le da un toque al personaje dando más explicación sobre su personalidad demente."
"Mar 27, 2024",POSITIVE,Such an incredible movie! Excited for the sequel!
"Mar 23, 2024",POSITIVE,"This movie feels like it doesn't belong in any sort of DC movie, and that's why it did well."
"Mar 20, 2024",POSITIVE,really like the vibes
"Mar 14, 2024",POSITIVE,10/10 I be dun needz the sequese ripe meow!!!!
"Mar 13, 2024",POSITIVE,this  is my second favorite movie
"Mar 12, 2024",POSITIVE,"Una maravillosa pelicula, sin entrar en spoilers es una genial critica a la tirania y al poco cuidado de la clase obrera por parte de la gente con mayor poder politico. Una pelicula de culto."
"Mar 8, 2024",NEGATIVE,"Meh.  Underwhelming, mostly very boring Joker origin story."
"Mar 3, 2024",POSITIVE,"Pretty descent movie,I like how they showed his progression from being abused and how mental illness affects people."
"Mar 1, 2024",POSITIVE,Interesting take on mental illness and the control capitalism has on us but especially the vulnerable. Beautiful and sad and sort of scary at times while still feeling sympathetic.
"Feb 29, 2024",POSITIVE,"In my Opinion it doesn't deserve a 69% and Joaquin Phoenix is the best Joker I've ever seen. Go watch the Movie, is pretty good."
"Feb 28, 2024",POSITIVE,"Muito bom esse filme! Recomendo assistir.
Apesar de não parecer estar vinculado a um filme de Super herói, o filme entrega muita qualidade. O Ator mandou muito bem no personagem principal."
"Feb 24, 2024",POSITIVE,"I didn't expect to enjoy the movie, but was surprised to discover it was much deeper than expected, and very satisfying."
"Feb 24, 2024",POSITIVE,"I usually steer clear of films that consist of such disturbing themes but Joker was a brilliant exposition of the dispossessed and alienated in our society. I doubt anyone except Joaquin Phoenix could have carried the story the way he did, thoroughly deserving his Oscar."
"Feb 23, 2024",NEUTRAL,"So, if you asked me to describe Joker, I'd tell you it's an art film first and foremost. This is deconstructing the Joker mythos and applying it to a grittier Gotham backdrop for the sake of relatability and sympathy. I'm all for a sympathetic villain, but this was almost excessive. If it weren't an art film. Art films get a pass on heavy-handed social commentary, to me, because the ideas are meant to be impressionable. Very slow moving, kind of boring, but overall a decent film. Wouldn't watch again."
"Feb 20, 2024",POSITIVE,"How excelent of an actor do you have to be, for the viewer to forget the world around him and feel the pain the main character goes trough"
"Feb 19, 2024",NEGATIVE,Was extremely boring.
"Feb 18, 2024",POSITIVE,"Joker is a fantastic film, and a compelling origin for Joker. The whole film was enjoyable, though I would say that the second half is far better than the first half, and it's not particularly close. If the whole movie was as good as the second half, it would probably be a five-star. That's not to say the first half wasn't compelling or good, but it just couldn't really match the second half. Joaquin Phoenix's acting is nothing short of amazing, with his near-perfect portrayal of Arthur's descent into madness, which is a great time to watch. The overarching plot is also very well written, witch kept my eyes glued to the screen for nearly the entire runtime. This film was also really lacking in side characters, with almost all of them being very forgettable and uninteresting, which really left only one good character (albeit one very good character) carrying its entire 122 minute runtime. Besides these flaws though, Joker is a fantastic origin story for one of the greatest villains in media, and a great film. I can't wait to see what's coming next in the sequel."
"Feb 17, 2024",NEGATIVE,"It's pretty stupid, really.  It's like going to hear a rock band and the guitar player solos almost the entire time. There's nothing real in it.  A total wank that's been done before and alot better."
"Feb 16, 2024",POSITIVE,Very god the realism the final
"Feb 15, 2024",POSITIVE,The build up origins of batman and joker at same time at the end was nuts the cast 10/10 soundtrack 10/10 the story was crazy humor 10/10
"Feb 15, 2024",POSITIVE,By far and away the greatest film that I do not ever want to watch again.
"Feb 11, 2024",POSITIVE,"Yet another captivating performance per Joaquin Phoenix. Joker heavily touches on the outside influences society has on those with mental illness, as well as how society treats those with mental illness. Oh, and just what mental illness can look like from the perspective of the maniacal. For those thinking Joker has depression.... touch up on your crazy, they don't all come with blues. Some appear in shades of vibrant red and yellow."
"Feb 10, 2024",NEGATIVE,Feels less like a comic based movie and more like an unhelpful telling of mental illness.
"Feb 9, 2024",NEGATIVE,"A real POC, don't waste your time.  The high audience rating must  have come from a prison audience."
"Feb 8, 2024",NEGATIVE,"So dissapointed. I wish I had never seen or heard of this movie so I can go back to thinking to joker was an amazing villain. This movie unequivocally ruined the character, his original reasonings, and his original motivations. Wondering why joker could possibly be the way he is, is unfathomably better than this being why he is how he is. There is nothing wrong with mental illness, but insanity was the every foundation of the joker to me and that's gone now. I do not wish to spoil to the movie for you if you insist on seeing it, but I'll make a comparison to help convey what you will experience. Imagine Batman was actually Batman because he used to be a baseball player and wanted to make a pun, and he has a medical condition that causes his voice to go deeper. Also he actually refuses to kill anyone because he stopped seeing his imaginary friend when he was little, and doesn't want to see anyone else he meets disappear. That's the impeccable storytelling you're in for folks"
"Feb 6, 2024",NEGATIVE,"This is the most unpleasant movie experience I've had since the first IT movie a couple years ago. My hopes were high considering the awards attention it got - culminating in a Best Actor Oscar for Phoenix. But this is an empty, superficial movie that doesn't offer any context about violence beyond what the average viewer would bring to it. I can't begin to understand the adulation this received. I won't fault Phoenix's work here - he is as committed as ever. But this is yet another case of a brilliant actor being rewarded for the wrong film. This is an ugly movie, both aesthetically and beneath the surface. Comparisons to TAXI DRIVER were made upon its release; and while I think TAXI DRIVER is a bit overrated, it is miles ahead of this movie, and I didn't find any similarities beyond a disgruntled protagonist. If you want to see a movie about the destruction of a man due to the world around him, please check out Jake Gyllenhaal in NIGHTCRAWLER instead. De Niro appears very uncomfortable in a supporting role that obviously will be compared to Jerry Lewis in THE KING OF COMEDY. This is bleak, unremitting and ultimately predictable. A crushing disappointment!"
"Jan 29, 2024",POSITIVE,"Phoenix has his well deserved Oscar winning performance. 
Scary enough to make you feel sorry for his evilness, yet not so evil as simply proving a point of how humanities ignorance brings out the worst in us all."
"Jan 25, 2024",POSITIVE,"This has become one of my favorite movies of all time! The acting, the story, the music and directing, it's all well thought out and presented perfectly. It's also a moral story, warning of what would happen should the rich keep getting richer, while the rest of us wallow in despair. And it also warns of what happens when those who need help most are left alone, backs turned in a callous mega city, becoming monsters made by man. And just like Godzilla was sent to punish man, Joker is sent to make everyone pay, a monster unable to be anything else, and a chilling source of pure evil."
"Jan 24, 2024",NEGATIVE,"Garbage...it's best feature is it helped me to further appreciate Tim Burton's Batman, which is far superior. Phoenix and DeNiro's talents are totally wasted here, with a story that is not just poor but downright offensive, whether intended or not."
"Jan 24, 2024",POSITIVE,Wonderful portrayl of a broken man whose the society makes him this way
"Jan 21, 2024",POSITIVE,Es la mejor actuación de Joaquin Phoenix de su carrera y una excelente interpretación del Joker la película te mantiene siempre esperando la siguiente escena por lo que merece una secuela Joker 2
"Jan 17, 2024",POSITIVE,Absolutely gorgeous and fantastic
"Jan 17, 2024",NEGATIVE,"I really like Joaquin Phoenix, but this movie doesn't add anything to his repertoire. It's too goofy for a serious drama, and too depressing for a superhero (supervillain?) movie. The entire premise begs the question, so the entertainment value is doomed to the perversity of voyeurism.

It's a good thing this is a standalone story because if this were where the Joker persona is headed, I would stop watching Batman productions altogether."
"Jan 16, 2024",NEUTRAL,i actually liked it. not that bad! i fuckim love watching embarrassing shiz
"Jan 15, 2024",NEGATIVE,"A completely value inverted world, where the low-life loser is depicted as a hero. That's what makes it completely unrealistic, bordering on fantasy... A fantasy of nihilism."
"Jan 15, 2024",POSITIVE,Great movie.  It is one of the few comic based movies that is truly great.
"Jan 14, 2024",POSITIVE,"In my opinion better than suicide squad joker. This one gets to the development the reality of how someone like joker can come to be. It's more closely related to reality, on top of it this joker reminds me of my childhood joker from the cartoon batman. The laugh is on point, his hysteria, I love that the fact how they woven his joker personality not because of a chemical accident but because of a psychopathology. Suicide squad joker, was the average bad guy joker. Joaquin Phoenix is the 2nd best up to Heath Ledger's joker."
"Jan 13, 2024",POSITIVE,It was a good movie but also one of the saddest and depressing movies.
"Jan 13, 2024",POSITIVE,A dizzying contradiction of a film. The ideas that 'Joker' forces you to evaluate make this much more unique and worthwhile than your average comic fare.
"Jan 13, 2024",NEGATIVE,The movie has no action. I thought the joker was a maniacle violent clown going on a killing spree and blowing things up. Heath Ledger was better. Phoenix is boring the worst joker. The movie is taking too long to show the violent side of joker.
"Jan 10, 2024",POSITIVE,"I really love this film, this film is one of my favorites, everything about this film is very perfect, the soundtrack, the characters, etc..."
"Jan 9, 2024",POSITIVE,"Absolutely loved it! It depicts just how wrong the mental health facilities are and what happens when those who need it don't get help. It's ""beautifully sad"". Would and have recommended this movie! If you haven't seen it, do it. Just don't expect too much ""Batman"" there are easter eggs here and there but it's mainly a movie about why Joker/Arthur is the way he is."
"Jan 9, 2024",NEGATIVE,"This is a movie made by people who definitely have seen ""Taxi Driver"" and ""The King of Comedy"" several times but didn't really understand either movie. This results in a tiresome spectacle of it appearing to say something profound but can't manage any meaningful observations besides ""Wow, society sure sucks."" I'm not opposed to darker comic book adaptations for adults but I really don't want this uninspired nihilism to become the norm."
"Jan 7, 2024",POSITIVE,"A powerful movie, very interesting would definitely watch again"
"Jan 7, 2024",POSITIVE,"85/100 - Fantastic film. Joaqiun pheonix did an exceptional job playing this troubled character. My only complaint is that if you watch this film and the batman films related to it, the story is incoherent as each one tries to make you sympathize with the main character. The wayne family is portrayed as cruel upper class elitist, whereas in the batman films they were portrayed as loving parents taken too soon. I just wish that the continuity of the stories blended better, but as an independent story its very good."
"Jan 7, 2024",POSITIVE,"I was quite surprised by how much I enjoyed this movie. It was a lot more serious and complex than I thought it would be, but I think they succeeded in everything they were trying to do. Great movie, really enjoyed how mature it was."
"Jan 7, 2024",NEGATIVE,"You couldn't offer me $1,000,000 to sit through this garbage again. Movies are meant to be entertaining, not disturbing; I fear young people may want to view this with high expectations, only to be subjected to violence."
"Jan 7, 2024",POSITIVE,I love the joker so much dressed up as it for Halloween killed it and Joaguin just killed this part. He sacrificed a lot to get this part too it payed off can't wait for the second one with Lady Gaga!!!.
"Jan 6, 2024",NEUTRAL,"I thought this movie was well written, and well acted, I just thought that it was very disturbing and it was very uncomfortable to watch, especially someone who used to have mental health problems

And this movie touches on mental health, illness, from a villain standpoint of a superhero movie, so at the end of the day he's supposed to be a clown. He's supposed to be silly and funny and goofy and a villain, but he was a serial killer and a lunatic, which we know from the comics

But we are not putting in that position as children to see that on a big screen, we see him as Jack Nicholson, or as someone that delivers more of that I'm a Batman, villain. Batman has the best villains of all time, but this movie made him a complete sociopath.

And it literally made it extremely uncomfortable after the film watching it. I definitely wouldn't let my kids watch it."
"Jan 5, 2024",POSITIVE,Top Film mit brillanter Performance von Joaquin Phoenix.
"Jan 5, 2024",POSITIVE,"You have never seen the joker like this, very original, i liked overall"
"Jan 5, 2024",POSITIVE,It was excellent. I was not sure what to expect but it was good.
"Jan 3, 2024",POSITIVE,Brilliant dive into the dark and brutal dystopian society that differs very little from our own. Phoenix is amazing!
"Jan 1, 2024",POSITIVE,Phoenix is mesmerising
"Jan 1, 2024",NEGATIVE,Slow and stupid. Trying to hard to be some sort of lame statement and not hard enough to be thrilling and entertaining. I really don't care about his feelings. Those of us who achieve more see those who don't as clowns.
"Jan 1, 2024",POSITIVE,By far the best Batman movie
"Dec 31, 2023",POSITIVE,This movie is just a cinematic masterpiece.  If I could give 10 stars I would
"Dec 30, 2023",POSITIVE,Joaquin did an excellent job making me feel uncomfortable while watching his decent into madness as the Joker. 
"Dec 27, 2023",POSITIVE,An amazing story about the struggles of mental illness. A creative and deep backstory to an iconic character
"Dec 26, 2023",POSITIVE,A movie that managed to make a well-known antagonist impactful among audiences.
"Dec 24, 2023",POSITIVE,laughing man became the furry green goblin
"Dec 22, 2023",POSITIVE,I DON'T KNOW WHY THIS MOVIE GOT 69% OF ROTTEN TOMATOES IT JUST WRONG BROTHER
"Dec 18, 2023",POSITIVE,No words need. This is masterpiece
"Dec 18, 2023",POSITIVE,pretty good! and wow— the critic reviews are so pretentious..
"Dec 12, 2023",POSITIVE,"My favorite movie is him
Joker is a GOOD MOVIE, Joaquin Phoenix is amazing and powerful in his role, same for Robert De Niro, Todd Phillips managed to make the most evil psychopathic character in the world."
"Dec 12, 2023",POSITIVE,Well established plot with interesting characters and outcomes.
"Dec 8, 2023",POSITIVE,this is cinema.......
"Dec 5, 2023",POSITIVE,"When Joaquin is gone, he will be remembered for this portrayal. Great film, great acting and direction."
"Dec 5, 2023",POSITIVE,"An absolute masterpiece, both produced and filmed with an authentic perspective. Media representation at its peak projection."
"Dec 5, 2023",POSITIVE,So good in the most yikes kinda way.
"Dec 5, 2023",POSITIVE,"As usual, not a single ""professional reviewer"" understood this movie."
"Dec 5, 2023",POSITIVE,"Amazing acting from Joaquin Phoenix, who plays a sympathetic character. Kudos for making bold choices in the filmmaking and acting."
"Dec 3, 2023",NEGATIVE,Didn't hate but it didn't hit me in the same way it did everyone else. It's a comic book character. I just didn't take it as seriously.
"Nov 25, 2023",POSITIVE,"An origin story for the clown-prince of crime has never been so dreary and realistic! Joaquin portrays the tragedy and comedy of Arthur Fleck, a struggling comedian who soon adapts a more twisted sense of humor. With violence and guts galore, this film is not for one who doesn't have a sense of humor!"
"Nov 24, 2023",POSITIVE,Joaquin Phoenix's Joker can be considered just as good as Heath Ledger's Joker.
"Nov 23, 2023",POSITIVE,"as kids, we love the heroes. as adults, we understand the villains."
"Nov 20, 2023",POSITIVE,"Between BRIGHTBURN and BATMAN BEGINS - a reinvention of character-building

While DC branched out with an evil version of Superman in Brightburn, it also built the sympathetically good side of Joker with Joaquin Phoenix. Played as a study of psychology in motion, this was one of the best superhero-based movies to be released on the big screen, even though it was all about the supervillain. Phoenix's performance is gut-grippingly good, and the supporting actors deliver perfectly on-point performances. The flexible and ambidextrous abilities of DC are amazing; feeding off human nature and building characters whose stories are a presence beyond the capabilities of most screenwriting. Joker's struggles are brought to light even while we (the community of comic readers) know that his infliction is venomous and unhealable. Truly a multilayered story, Joker is one of the best movies to come out in the 21st century, thus far."
"Nov 15, 2023",POSITIVE,"Joquin Phoenix performance is stellar and the soundtrack is really good.
Robert DeNiro has a fantastic performance in this movie and the ambientation is perfect.
This shows how to make comic inaccurate things but doing that well,not like M-she u movies."
"Nov 13, 2023",POSITIVE,A must watch for anyone
"Nov 12, 2023",POSITIVE,Amazing actor JP really made it his own character and the director did a great job and the writing was great the costumes were good the background actors were good .
"Nov 9, 2023",POSITIVE,"Joker is just one of those movies, that resinate with me in a way no other movie ever has. The music itself plays so much emotion, Joaquin Phoenix's performance is outstanding, and the movie is just so beautiful in itself."
"Nov 7, 2023",POSITIVE,"This movie is amazing. I had hoped that more directors would take their cues from this but it seems that the comics moviemakers have decided to go in the other, predictable direction. The Joker is a tour de force that captures the spirit of the character and makes you truly feel for his situation and what made him the monster. Phoenix is a masterful actor in this. Jared Leto should be ashamed of himself after what he had done to the character in Suicide Squad. I wrote off this movie until my Mom just about forced me to watch it. Then I did and at the end I was breathless. Thank you, Mr. Phoenix, for proving that the tired ""superhero genre"" still has life in it.

So why didn't more directors follow suit? I cannot understand. But perhaps that's what makes The Joker all the more special…"
"Nov 7, 2023",POSITIVE,"This dives into what it takes to break a person. Childhood trauma....mental health....and the cancer that's the general public.  

Think it also speaks to the jokers inept ability to keep us guessing.  Is this the real version he doesn't tell? Or just another manipulation from a psychotic mind justifying his actions."
"Nov 5, 2023",POSITIVE,very dark movie well acted reminded me of the film taxi driver. cool supervillian origin story kinda like the film Split but way darker joquin phonixs performance is worth watching dark and gritty film id say its worth a watch if u can handle hard r rated films definetly not for kids.
