Date,Score,Reviews
/profiles/kODIdbuqmIJnFoNSbOixATQvhDq,NEUTRAL,"The scene where Eddie kisses the demon is priceless.
The scene where the demon starts meditating and walls collapses from inside out is priceless.
The scene where Eddie plays disc jockey in the temple is priceless.
Why doesn't anyone wanna see this?
Lamers, I'm gonna give this 4 and a half star because of it."
/profiles/KKJIkLuKMh6Oug4H81H9aukMI4R,NEUTRAL,Not Murphy's best...kind of gay
/profiles/WYJI8euDzhGJf9rTW6s8riRwuG2,NEUTRAL,"Surely Eddie Murphy at his finest, it even has it's own special day with ceremonies."
/profiles/qAkIOPup4hlwiRJhz0i9xskmSzp,NEUTRAL,"only a man whose ass is narrow can get down these steps. And if mine's is such an ass, then I shall have it."
/profiles/qAkIOPup9flosRJhz1h90SkmSzw,NEUTRAL,"Just because ""Beverly Hills Cop"" was a huge success does not mean that this movie will be anything near the same."
/profiles/0xpImWuAmiZOTnMFpLf6ji4rheR,NEUTRAL,"""I wa-uh-wa-uh-want the knife!""
""Chunky asses?!?!""
nuff said."
/profiles/9XwIBNuM6f1LFwvhqaHGgsbdT8X,NEUTRAL,A totally mis-cast Eddie Murphy makes the best of it by some half decent one liners.
/profiles/m8AID6ubWuaof8nTdZHQ2TBLsVp,NEUTRAL,Fantastic movie. Theres no floor? THERES NO FLOOR! haha.
/profiles/KKJIkeTKks6YigeI8Lu9Xikdh4g,NEUTRAL,This is my movie right here
/profiles/KKJIkLuKnT6zHgns8lI9vFkBu4e,NEUTRAL,Eddie could do no wrong  back in the 80's. Another great movie.
/profiles/lxMTYdHgVIqbfvySj2h8JHPv,NEUTRAL,Eddie is so freakin' funny in this movie.
/profiles/wL6I6gFmeSxeFLwsMRhvxioOSVX,NEUTRAL,i love this movie. really funny
/profiles/bJ4faLilYHMQSBPfGYfvrT0yTbY,NEUTRAL,eddie back in the day when he was fast talking and foul mouthed although he wasnt in thsi film
/profiles/yr2IYpujPuKNizBHPGIqPTA0hjR,NEUTRAL,"<br><b><a
href=""http://www.myspace.com/manurmine""target=""_blank"">MY MYSPACE HERE!!!</a></b>"
/profiles/RkwIJvulmTYMIn8u4euQzsBYfAK,NEUTRAL,"Again, guilty pleasure. Stands the test of time for me. Eddie Murphy vs. a Winged Demon trying to save a kid who turns to butterflies later ... brilliant!"
/profiles/bJXIaYul0sMoIBKHGyIvBS02Hba,NEUTRAL,Eddie is a private eye who has to find a kidnapped child.
/profiles/2dvIWouZgunxf9yieWIgoH1NixN,NEUTRAL,i love this movie. my favorite eddie murphy movie ever. no real reason. it's just so funny and he's the hero!
/profiles/AlqI60FGqfkwSpoi6AFY8SKbHa6,NEUTRAL,"not that good, eddie murphy comedy also trying to be kinda dark, just isnt good"
/profiles/BQJIK0ue1SgehrXF9rhAOF1NTVK,NEUTRAL,"What a goofy movie, and that's not a compliment. Neat concept that falls flat ultimately."
/profiles/dQgIelumquLAHzqhDzIkefXoSKw,NEUTRAL,one of Eddie's best horrible films
/profiles/GPdI04sK1fenF8rfwDiMpSKmueR,NEUTRAL,oh this brings me back
/profiles/orRIDduJjf9DfN1feXTaKFZqH61,NEUTRAL,"""I want the knife....PPPLEEEEEAASSEEE!"""
/profiles/wL6I6gFmdsxaILYhMRhvpuo0HVG,NEUTRAL,I've never even seen Beverly Hills Cop.
/profiles/9XwIBNuMyI1PtweHqgSGrfbKH8d,NEUTRAL,I I I I Want the Knife!
/profiles/KKJIkLuKou6zHgeI80T9rTkgi4R,NEUTRAL,Typical 80s movie yet I still liked it anyway.
/profiles/9XwIBNuMzu1rSweHqysG0IbdT8r,NEUTRAL,I think I liked this years ago.
/profiles/ejzIyDuGYTxdSq0IGmSgDSw2iXW,NEUTRAL,I don't eat oats because of this movie.
/profiles/RkwIJvulyiYRhn9f4RfQkTB8FA4,NEUTRAL,Classic Eddie Murphy.
/profiles/qAkIOPupzSlvuR0SzxS9LfkmSzk,NEUTRAL,Weird plot but I liked it.
/profiles/yr2IYpujoiKYsz4fPmFqZhAgujy,NEUTRAL,"I said I said, I want the knife.... Pleeeaaase."
/profiles/RkwIJvulxuY2Hn2i4jhQxhBGIAv,NEUTRAL,This actor always is great in what ever movie he is in
/profiles/JBJIqduveu4WHVwHKGi4QHADfbD,NEUTRAL,sardo noomsie..makes an appearence..
/profiles/AlqI60FGDukQHpzI64iY8SKmSaQ,NEUTRAL,You see a butt naked dude run thru here witha 100 dolla bill?
/profiles/YkMfGbi91I20Hg8fPLTDJI1Qu64,NEUTRAL,Murphy at his wise cracking best!
/profiles/BQJIK0ueoIgaFr6h9mTAoI1lhVy,NEUTRAL,Murphy vs a bat-winged demon while protecting a bald kid who can make butterflies come back to life. Cheestastic. Oh and it's pretty funny.
/profiles/dQgIelumYfLrIzJIDjfkZuX1hKJ,NEUTRAL,Ohhh the kid and his oatmeal
/profiles/kODIdbuqmIJKuoNSbnhxKfQbIDq,NEUTRAL,"this movie i watched like 35x, its fing awesome, its great, its miraculous, and eddie murphy is hillarious."
/profiles/KKJIkLuKaI6kIgjf8Lu9rTkDH4e,NEUTRAL,Good and funny. Some action and good effects. Worth seeing.
/profiles/BQJIK0ueqTgOIrgu9auAlf1NTVX,NEUTRAL,Good vs Evil in a cool place and Eddie Murphy...totally funny.
/profiles/0xpImWuAyIZLunpipvF6Ds4aTeB,NEUTRAL,"""I, uh, I I... want... the kniiiffeee."""
/profiles/WYJI8euDzhG9T9MhWdF8riRDsGN,NEUTRAL,"Watched it 57+ times. i lost count, it never got old or stale 4 me"
/profiles/BQJIK0ueoIgwur6h96IAoI10iVl,NEUTRAL,I said a I I I I I I I I want the knife!
/profiles/kODIdbuqQhJ0ToxFbOixmhQLFDb,NEUTRAL,"How about, Golden Shower, followed by a blow torch?"
/profiles/dQgIelumAiLpSzgFDjfkJFXOfK2,NEUTRAL,freaking love this movie
/profiles/GPdI04sKjSeQf8NTwGsM9uKmuek,NEUTRAL,"What's that stench? Oh, another Eddie Murphy film."
/profiles/YkpiGOI91I21fgzTPAfDqi1vi64,NEUTRAL,""" I uh I uh I uh I want the kniffffffffffe"" Classic Eddie Murphy at his best"
/profiles/ap6IrPuyMIKYHrysJgszPiPkT2b,NEUTRAL,"Let me start by saying, Eddie Murphy is really only funny when he does stand-up. That being said, this is the only Eddie Murphy movie in which he is funny. Ridiculous, though it may be, Eddie drops some classic lines."
/profiles/GPdI04sKjSenF8ziwnTMpSKZheD,NEUTRAL,Did you see a little naked guy with a hundred dolla bill runnin around?
/profiles/2dvIWouZRInxf9yie0ig2f1VFxJ,NEUTRAL,ha haa..and some purpose..and some love..what else is there?
/profiles/qAkIOPupWHlwiRgHzrI9LfkxIzl,NEUTRAL,This movie used to scare the CRAP out of me!
/profiles/BQJIK0ueoIgPfrXF9rhAoI1WSV9,NEUTRAL,Why do I gotta get chose to go to Tibet?  It's cold in Tibet.  Why can't I get chose to go to the Bahamas?
/profiles/orRIDduJDh9ySN6seAIaKFZ1S64,NEUTRAL,classic eddie at his best..
/profiles/yr2IYpujKTKLuzXTPBsq0FABTjY,NEUTRAL,"I,I,I want the kniiife....Pleeez! This has 2 b 1 uv the funniest movies ever made. ""Ur jus gonna wipe that on ur shirt, huh?...U'd better b carefull; have that freeze n cut urself.""
Eddie Murphy in his prime u kno...b4 the ""Transvestite Scandal"" n Daddy Daycare"
/profiles/DGRfBYun2T2aFDRhzVSvJSjJHLa,NEUTRAL,An enjoyable fantasy/action film with a good dose of humour.
/profiles/wL6I6gFmjTxbsLZTMqsvpuojsVL,NEUTRAL,"Classic. You never see it on anywhere now. Such a good film.
""I want the knife"""
/profiles/ejzIyDuGWhxYHqmuG8fgyhwpfXg,NEUTRAL,Just ok for me..  Don't really feel I would of missed out if I hadn't  watched.. *shrugs* In my opinion this was Eddie's worst
/profiles/orRIDduJZH9YhNOFeAIavTZqH64,NEUTRAL,What lovely classic action adventure horror. *sigh* Murphy at his peak of verbal snottiness and articulating characteristics. Does not hold to day but darn there is plenty of good moments.
/profiles/X6yFYQuAyIBgi1gFe8F8ouAOhRe,NEUTRAL,Another 80s action movie that rocked!
/profiles/qAkIOPup4hlpfRATzOf9DikLHzl,NEUTRAL,One of Eddie's worst films.
/profiles/wL6I6gFm0IxRfLwsMlfvafo1hVJ,NEUTRAL,eddie's weirdest movie but still good
/profiles/2dvIWouZoSn0T9XIerSgOT14TxN,NEUTRAL,"""I-I-I-I-I want the knife."""
/profiles/2dvIWouZYinMi9MseWIgNs1xIxG,NEUTRAL,I know somebody's head that looks just like the bloody oatmeal! Really nasty!
/profiles/ejzIyDuG0HxbTqZTGmSgyhwrsXL,NEUTRAL,I like it very much...
/profiles/ap6IrPuyLsKYHrxHJnFzxhPaH28,NEUTRAL,"I, I, I want the knife......... Only Eddie Murphy would crack jokes on a quest as the one. I laughed my head off at that."
/profiles/nxyIDeupLIG6fwLiaGHoyudeiAv,NEUTRAL,really bad graphics but eddie is funny.
/profiles/orRIDduJDh9YhNqHeAIarsZ1S6e,NEUTRAL,Eddie is just Eddie.  i've been loving Eddie since I had to sneak to hear what he was saying in RAW.
/profiles/LrJIxkul1hP9HYruJQuNXIoPuvM,NEUTRAL,"As a kid, I loved Eddie Murphy. This brings back some memories. My brothers and I used to say,"" I I I I I want the knife...Pleeease"" whenever we wanted something."
/profiles/m8AID6ubmsaZh8nTdxiQbsB0TVp,NEUTRAL,"A comedy, wieth no funny lines."
/profiles/m8AID6ubyhaQH8JfdKIQzfBdiV4,NEUTRAL,Eddie Murphy when he was still funny
/profiles/9XwIBNuMJT1afwGfqVTGoibdT8B,NEUTRAL,I want the knife...please...
/profiles/YkRIGKu9Ds2OcgBIPMHD4s1mS6k,NEUTRAL,not the worst eddie murphy movie i've ever seen... but certainly not his best.
/profiles/wL6I6gFmlfxRfLeHMDuvafoaIVX,NEUTRAL,Golden Child? You mean Eddie's kiddie with Scary Spice? Truth is stranger than fiction sometimes....
/profiles/orRIDduJMI9eHN1fewsavTZJI61,NEUTRAL,"""Bring me the kniiiife...pleease"""
/profiles/80qsl1uwDhNRhM2T6ruzdTdMFex,NEUTRAL,I-I-I-I want the kniiiiffee.
/profiles/kODIdbuqaSJpHorIbzuxmhQLFD1,NEUTRAL,"Dreadful. ""Let's let Murphy do whatever he wants!"" said a producer. Bad idea."
/profiles/YkVsGRF9wh2mSgGSPMHDph1mS6K,NEUTRAL,excellent. a classic.
/profiles/dQgIelumAiLrIzgFDvSkaIXRHKR,NEUTRAL,"Special effects are very dated, but Eddie Murphy is classic"
/profiles/AlqI60FGNSkQHpYF6lSYnFKmSar,NEUTRAL,"A classic Eddie Murphy adventure-comedy. Very funny, some of his best.  Comparing it to his new work its sad to see how different they are and its not getting better."
/profiles/qAkIOPupwTlwiRoIzBs9xskaszk,NEUTRAL,"This had a lot going for it.  The concept was really interesting and Eddie Murphy is a comedic genius.  However, something was off here.  It had a real mean streak running though it that marred the whole thing.  When I was a little kid I had the hugest crush on Charlotte Lewis, who plays Kee Nang."
/profiles/1KaIeAuxnhp2SxlI6NTdVT20hQn,NEUTRAL,"any real eddie murphy fan appreciates any movie not named pluto nash...and a few other bombs. not his best work, but very entertaining still. its in your collection if you know like i do that eddie was the king of the 80's as far as comdey movies go..."
/profiles/0xpImWuAWhZmFnAspjS6mI4rheR,NEUTRAL,I-I-I want the knife...
/profiles/zW2I4xCRLSjei6piJ1HWMuNpsm4,NEUTRAL,"What lovely classic action adventure horror. *sigh* Murphy at his peak of verbal snottiness and articulating characteristics. Does not hold to day but darn there is plenty of good moments. "" I, I,I,I,I,I,I,I,I Want the knife. Pleeeease!"""
/profiles/ejzIymIGesxdSqLhG4Igyhw2iXY,NEUTRAL,Okay.  I just like the fighting.
/profiles/OyqIdvug6hrdHwvhlauB4IMWFkA,NEUTRAL,very funny. it's not exactly the strongest of storylines but it's not meant to be
/profiles/AlqI60FGyTkQHpvT6lSYXiKjsa8,NEUTRAL,"It's hardly Beverly Hills Cop, but it does feature a dancing Pepsi can and a bald child who lives on leaves. 
""I said I-I I-I I I I want the kniiife..."""
/profiles/GPlS09HK1femu8ZHwehMaTKNFe9,NEUTRAL,"The Golden Child directed by Michael Ritchie is a film with a simple narrative to follow. Fairly enjoyable to laugh at but not with, the jokes are obvious and simple, the story is left lacking. A cringe-worthy performance by Eddie Murphy. One-watcher."
/profiles/9XwIBNuMRS1AuwjFq9fGgsbjs8X,NEUTRAL,"haha, this movie is funny."
/profiles/YkVsGOI9qf2XigVuPKSDph1Ls6n,NEUTRAL,"""i-i-i want the knife"""
/profiles/KKJIkLuKMh6bhgxh8lI91Ikgi4k,NEUTRAL,Eddie Murphey at his best.
/profiles/YkZSGzs9rT20HgJFPWFDRf1vi68,NEUTRAL,channel ten love playing this one at least twice a year!
/profiles/yr2IYpujNHKNizlIPmFq0FAMsjR,NEUTRAL,"i,i,i want the knife"
/profiles/LrJIxkulJiP8FYQFJnHNaTo4hvY,NEUTRAL,Hilarious despite crappy 80's graphics
/profiles/2dvIWouZpfnDI9XIe4fg2f1YSxR,NEUTRAL,The royal penis is clean!
/profiles/ejzIyDuGRSxKIq6iGvigoswXuXg,NEUTRAL,This is another one of Eddie Murphy's classics definitely very funny!
/profiles/BQJIK0ueXfgwuryS9rhAOF1lhV9,NEUTRAL,"I loved this as a kid, but it's aged poorly."
/profiles/m8AID6ubMiamu89SdXfQzfBASVp,NEUTRAL,Not for everyone but I really enjoyed it.
/profiles/kODIdbuqAiJyhoNSbzux4uQXuDJ,NEUTRAL,Not a very good movie.
/profiles/wL6I6gFmjTx8HLnfM2IvnsokiVD,NEUTRAL,Sweet brother Nunsey
/profiles/GPdI04sKjSe2T8rfwehMAHKNFe9,NEUTRAL,Not his greatest piece...
/profiles/bJLSaLilZIMoIBAiGYfvzs0Xfbn,NEUTRAL,LOL!!! SO DAMM WEIRD!!!
/profiles/wL6I6gFmeSx8HLBFMDuvDFojsVz,NEUTRAL,"Murphy's charisma, oriental fantasy and the back drop of the eighties. Great!"
/profiles/GeBI0WtKJH92f8KuwVfMliKbieeCXNuDdiVjijZiRRCzRi1BfkKsvOFllCxgFe0TjMTZpfYYCDYINrCg2IGVFjKF9WHxziZRsYaC86TvrFYq,NEUTRAL,"The Golden Child is an awesome fantasy action movie. Great opening scene of the child being kidnapped with some rockin' 80's music. Eddie Murphy's character I was totally with throughout. He let his trademark humour come through in a funny non-vulgar manner. I loved his gripings through each part of his mission. The villains are weird and wild eastern mythological characters. I loved the scene when the child amused the beast-man with a dancing cola-can. The fights and creatures were wonderful. I could get into this more than ""Big Trouble in Little China"", a similar film."
/profiles/GPdI04sKxheji84IwDiMmIK0seR,NEUTRAL,"I forgot they had some stop-motion animation on this flick! It was, of course, funnier back in the days though. Even my favorite parts weren't funny anymore like when Eddie Murphy scratched on the Chinese prayer pillar like turntables, ""I...I..I-I..I-I want the knife!"" And even the part I actually memorized as a kid when Eddie did his  adaptation of the lyrics of the Tibetan-type music while on the airplane headphones, ""Awulawaneelwacowluelemos. Aneesanicoolimanticoleloy..."" hahahaa"
/profiles/2dvIWouZNhnMi9YueVHgku14TxA,NEUTRAL,I don't know what it is about this movie. I like it watch it everytime it's on TV.
/profiles/wL6I6gFmeSxbsLZTMvFvxio0HVL,NEUTRAL,"I watched this movie something like 50 times. It's not actually good, but somehow inspired obsession in 12-year-old me."
/profiles/qAkIOPupzSlZHRLszxS9qhknhzy,NEUTRAL,can i-i-i have the kniiffe.
/profiles/9XVhBJhM4F1AuwZTqgSGYhbKH8r,NEUTRAL,This is a classic from Eddie murphy.I want the kni- knife!Charles Dance is also excellent as the demonic villian. Charlotte Lewis i used to fancy like hell! An absolute blast with Murphey on a race against time to save the golden child. A fun classic in my eyes.
/profiles/YkeTGOI9qf2MsgJFPMHDlS1mS6o,NEUTRAL,hilarity! fuckin murphy child! darkness bros!
/profiles/qAkIOPup9flZHR0Sz0i9yIkPfzk,NEUTRAL,I love this movie!!!! Awesome Flick.
/profiles/YkeTGOI9KH2OcgGSPvuDlS1vi64,NEUTRAL,One of eddie muphy's good movies.
/profiles/9XwIBNuMJT1DUwvhqaHGZSbKH80,NEUTRAL,En kul film egentlig..
/profiles/2dvIWouZNhnds9vfeWIgAi1NixR,NEUTRAL,"Eddie in the 80's, what more do you need to say?"
/profiles/9X9TBxfM6f1VcwvhqliGmTbdT8P,NEUTRAL,A bed is that a bed?
/profiles/zWoS41iReHjgh6OHJquWzTNlHmz,NEUTRAL,It has it's funny moment & for the most part was interesting to watch!
/profiles/X6dCYwsAkfRYu12iGMf8qsADiRRCbVt6qHoeuebc11CPYiYpIxwfykCooCnDuLkH4NizLiOOCmJInJHlZHpQhbGHkpFk6Sm2fxZiOeTzqfl6,NEUTRAL,Strange movie but preferable to any of the movies that Eddie Murphy has made in the last few years.
/profiles/m8AID6ubZfaXT8NHdNSQxFB9HVw,NEUTRAL,I said I I I I I I want the knifeeee.
/profiles/NX2IW0ukOTmxFoeFZXIdvhqPFbV,NEUTRAL,"What a great film! And Eddie Murphy is actually wholesome. Oh, and the kid rocks!"
/profiles/RkwIJvulmTYwSn9f4euQBiBruA4,NEUTRAL,one of my favorite classic murphy films
/profiles/DGJIBYun2T2YiDgHzOHvnIjJHL9,NEUTRAL,"It's Like a coss between Beverly Hills Cop, Indiana Jones and Big trouble In Little China except without the goodness."
/profiles/GPdI04sKjSedS8ZHwpuMaTKbie8,NEUTRAL,"Dull, effects heavy, given a comedy makeover at the last minute... unsuccessfully"
/profiles/9XwIBNuMJT1DUw8iqaHGmTbKH8r,NEUTRAL,cant beat the classics
/profiles/m8AID6ubMiabS8NHdkFQzfBMfVB,NEUTRAL,I'm sure Eddie Murphy goes to every single affiliate in the country and forces them at gunpoint to show this movie in syndication.
/profiles/WYJI8euDPSGps9MhW4I8quRPSG0,NEUTRAL,This movie - I quoate ALL THE TIME!  It's an inside joke with my fam!!!
/profiles/1KaIeAuxVTpvuxPF6NTdjf2ySQw,NEUTRAL,"Eddie Murphy classic, no doubt..."
/profiles/dQgIelumAiLxhzgFD0FkefXrsKA,NEUTRAL,One of the many movies that you have to watch.
/profiles/KKJIkLuKnT6bhg1u80T94HkVf4g,NEUTRAL,"I like the humor in this movie, silly stuff"
/profiles/ejzIyDuGRSxluqDHGYTgBHw8TXZ,NEUTRAL,I said i..i..i..want the knife. Please.
/profiles/BQJIK0uezigOIrXF96IAgu1euVw,NEUTRAL,not great by any means.
/profiles/ejzIyDuGofxJiqPFGNHgOiweHXZ,NEUTRAL,classic eddie murphy what happened to you?
/profiles/m8AID6ubLSabS86hdZHQxFBLsVD,NEUTRAL,"for some reason, my brother always gets sick when he watches this movie... but i like it"
/profiles/0xpImWuA9HZmFnxupgh64S4aTe1,NEUTRAL,I I I Want the kniiiiiiife
/profiles/ejzIyDuGYTx2fq6iGBFgosw2iXg,NEUTRAL,"""I want the knife!"" this movie killed me when i was little"
/profiles/KKJIkLuKeS6kIgAi8Gf9vFkVf42,NEUTRAL,this is the best Eddie Murphy movie!!
/profiles/wL6I6gFmeSxguL0uMdHvwSoJuVG,NEUTRAL,Eddie Murphy at his best! Long before he went PG13 with shit like Dr Dolittle.
/profiles/WYJI8euDPSGeH9wiW4I8nfRgIGe,NEUTRAL,Eddie Murphy classic - must see 80's movie.
/profiles/nxyIDeupMSGkswRSaJFoOsd2IAz,NEUTRAL,"Eddie murphy should have missed this one, highlight was the dancing coke can"
/profiles/GPdI04sKqTe6h8eswGsMdhKRIeW,NEUTRAL,hilarious! some really funny scenes in this one.
/profiles/m8AID6ubMia0i89SdNSQVhB0TV4,NEUTRAL,One of my favorites as a child.
/profiles/nxyIDeupziGzhwRSazioOsdeiAX,NEUTRAL,IIIII want the KNIIIIIIFE!
/profiles/wL6I6gFmwixbsLeHMRhvQIoOSVD,NEUTRAL,"Ha, straight to dvd movie."
/profiles/wL6I6gFmwixguLnfMeTvnsoOSVJ,NEUTRAL,"o_o Terrible, but Eddie had a few good lines."
/profiles/zW2I4xCRDTjei6asJgSW6SNlHm2,NEUTRAL,Remember when Eddie didnt do family movies? This got huge with my brother's and I on beta back in the day.
/profiles/BQJIK0ueqTgNsrxf9auAOF1DFV1,NEUTRAL,"Off beat action film, that's well done by Eddie Murphy."
/profiles/804UleIwRHNLIMbF6AFzwIdXIer,NEUTRAL,Eddie Murphy good...not his best....or averafe....Liked the concept..
/profiles/DGJIBxsn6h2aFDnFz8fvYfjJHLj,NEUTRAL,"i love it when he goes, ""i,i, i, want the knife, Pleeease"""
/profiles/DGJIBYun2T2YiD9Tz0sv6HjJHLg,NEUTRAL,"who doesn't love the OLD Eddie Murphy....mmm 80's Leather pant suits.
I so tried to bend a spoun with my mind"
/profiles/2dvIWouZpfnMi9yie0igku14TxP,NEUTRAL,*chime* iiiii waaaantt thaaa kniiiiife.
/profiles/x9XIVzuO4fNLTrdSyAHwQHWxSjq,NEUTRAL,eddie murphy back in the day is hilarious!!!
/profiles/9XwIBNuMRS1gHwvhqnIGvubPS8B,NEUTRAL,"Synopsis said this was a ""clunker"". Bollocks! The dancing pepsi can is ace!"
/profiles/zWPi4psRDTjpF6zIJ1HWzTNpsmd,NEUTRAL,all hope on one head
/profiles/zW2I4xCRvsjyf6asJYIWXhNpsm4,NEUTRAL,i i i i i want the knnnnnnnnnnniiiiiiiiiiiiffffffffeeeeee
/profiles/qAkIOPup9flASRATzku9xsknhzJ,NEUTRAL,"I said, I I I I I I I I want the knife!!!!  Awesome!"
/profiles/KKJIkLuKks6DugAi84F9rTkqs4R,NEUTRAL,Eddie Murphy never could say no to a job offer. This is one time he should have.
/profiles/qAkIOPup9flzIRauz1h9GHkaszJ,NEUTRAL,"""I-I-I-I wwwaaannnttt the Kniiifffeee!!!""
Classic Eddie."
/profiles/1KaIeAuxVTp2SxZT6zId9h20hQn,NEUTRAL,Classic movie. Don`t think Eddie been better in anything else.
/profiles/wL6I6gFmwixdiLMiMRhvwSopTVZ,NEUTRAL,another great movie! go CG!
/profiles/WYJI8euDxfG9T9XFWXh8nfRPSGW,NEUTRAL,"oh eddie murphy, thank you for making me laugh. ""I-I-I-I-I-I want the knife..."""
/profiles/OyqIdvug2irVSwQIlqIBahMWFk2,NEUTRAL,This is one of eddie murphy's classics before he got into playing in movies like the clumps or whatever...i love this movie because its hilarious and at the same time actually has a plot! such a great concept!!!
/profiles/yr2IYpujwsKzFzduP9TqZhAvfjg,NEUTRAL,"Awesome.  ""I-I-I-I-I-I-IIIII want the knife"""
/profiles/zW2I4xCRDTjbH6qTJ1HW6SN1Tmd,NEUTRAL,"""I-I-I-I-I WANT THE KNIFE..........PLEASEEEEE"""
/profiles/ejeSymIG6uxAFqQsGYTgPTw2iXg,NEUTRAL,When Eddie Murphy was good...
/profiles/nxyIDeupvfGzhwRSaPToOsd2IAM,NEUTRAL,"Perhaps the greatest quote of any movie, nay, any man, is in this movie. ""I just want some chips"" The set-up of that line is timeless. A black man with a gun jumps in on a BBQ."
/profiles/ejzIyDuGvix6hqafGvigBHwRFXg,NEUTRAL,"this movie is campy for sure, but it holds a certain charm.  in the opening scenes a march through the snowy slopes of tibet with 80's guitar in the background.  need a say more?  ok.  one last thing: eddie murphy is definitely funny."
/profiles/orRIDduJjf9DfNkTerhanHZVT6e,NEUTRAL,i i i i i i want the kniiiiife LMAO
/profiles/yr2IYpujoiK0SzduPdSq0FAvfjO,NEUTRAL,I have been quoting this film for 15 years+
/profiles/zWgh41iRDTjxs6asJquWKfN4fma,NEUTRAL,"In the same mediocrity as Best Defense or any of Eddie's movies in the last ten years.  Actually, wait, I'll take this one over his last ten years put together.  Dr. Doolittle?  Daddy Day Care?  Eddie, you are getting old!"
/profiles/zW2I4xCRLSjxs6RSJYIWNsNkimd,NEUTRAL,the only thing nice about this is Eddie Murphy and his cracks
/profiles/1KaIeAuxLip2Sxbi6zIdXI2diQm,NEUTRAL,top classic right here
/profiles/1KaIeAuxLipmhxZT6qFdjf2diQn,NEUTRAL,I want the Knife!!! Please!!!!
/profiles/yr2IYpujwsKzFz4fPmFqgIAPijY,NEUTRAL,"Wicked fantasy, Murphey was the only man this film would have worked with"
/profiles/nxyIDeupMSGkswmFaPToyudQHAr,NEUTRAL,eddie murphy at his funniest.
/profiles/nxyIDeupziGzhwOTazioOsdZTAr,NEUTRAL,"I LOVE this film. I love the mix, it's a weird one for sure...adventure, romance, myth and little pinch of horror (well, that devil aint pretty!), it deserves a video genre shelf all of its own!"
/profiles/KKJIkLuKeS6Dugxh8Os91IkVf42,NEUTRAL,"Eddie knows how to be the funniest man alive in this film- ""Anyone seen a naked man runnin round with a hundred dollar bill?"""
/profiles/wL6I6gFmlfxAhLwsMeTvpuo0HVJ,NEUTRAL,Eddie let us all down in the 80s with this one.
/profiles/nxyIDeupMSG1uwVHaPTopfdBhAM,NEUTRAL,"I've seen this film so many times since I was a kid, I can quote the film VERBATIM."
/profiles/1KaIeAuxLipAixQf6Qhd9h2mIQA,NEUTRAL,One of the funniest movies I've ever seen.
/profiles/ejzIyDuGofx2fqDHGvigDSwnhXx,NEUTRAL,Eddie's best movie ever!!! He is funny as hell in this movie.
/profiles/dQgIelumGSLVFz8sDzIkaIXoSKY,NEUTRAL,My only question is how the hell a walk to remember is like this in any way?
/profiles/WYJI81fDGsGJf9MhWXh8eIRBFG2,NEUTRAL,classic   cheesy 80's flick
/profiles/yr2IYpujoiK0SzPhPwuqPTA0hjy,NEUTRAL,"The movie wasn't amazing, but Eddie brought it somewhere near there - right from the opening scene with Teddy the 80 year old turtle, LOL!"
/profiles/ejzIyDuGvix4sq6iG8fgoswPIXZ,NEUTRAL,"fuck the plot, fuck the special effects... Eddie was funny as hell in this movie, and thats all that matters"
/profiles/wL6I6gFmlfx0TLBFMRhvwSo0HVZ,NEUTRAL,Those who don't get it are retarded. Sure its pointless and the plot is retarded but Murphy is so hilarious in this everything else just doesn't matter.
/profiles/orRIDduJYS9wIN1ferhaDiZJI6K,NEUTRAL,I was laughing the entire movie and its not a comedy
/profiles/JBJIqduvoS4lTVLfKQT4ASADfb6,NEUTRAL,"CAN I HAVE THE KNIIIIIIIFFE???...PLEEEAAASE???

Lol. Funny Eddie Classic People. Hot movie."
/profiles/AlqI60FGeikQHpOh6qhY2HKmSaO,NEUTRAL,"""...I want the Knife...pleeease"""
/profiles/GPdI04sK1feDI8rfwDiMpSKZhe9,NEUTRAL,"dis iz a feckin' bad ass movie, cnt touch eddie murphy in dis"
/profiles/DGJIBYun4f2AHDZfzbFvYfjwsLd,NEUTRAL,I love this movie. The chick in it with Eddie was absolutely gorgeous as well.
/profiles/kODIdbuqwfJKuorIbpFxeSQvhD4,NEUTRAL,i...i...i...i want the knife.
/profiles/nxMiDnhpMSG1uwLialSoyudGFAZ,NEUTRAL,A load of nonsensical crud.
/profiles/nxyIDeupvfGpTwafaxsoATdXfAg,NEUTRAL,"Maybe Eddie isn't at his best and maybe the cheesy graphics and sub par acting turn people away, but I still enjoy this movie."
/profiles/kOLfdwsqrHJXsodsb0SxLiQe,NEUTRAL,ah ah ah ah want the knife....pleese...
/profiles/RkwIJvulAfYXunyT40IQBiBruA8,NEUTRAL,"Apparently this movie is somewhat like ""A Walk to Remember"". Absolutely wrong. Even for the eighties, the plot was overly simple, and yet confusing at the same time. It must have been the stagflation at the time. Anyways, the special effects are just comical this time, and if the golden child is supposedly so powerful/valuable, why does this asian kid need an American social worker to protect him? Doesn't the American system already have enough trouble caring for its own. Try working with some urban youth instead of some crazy bald kid Eddie."
/profiles/JBJIqduvZf4vFVwHKMH4jIADfbZ,NEUTRAL,classic....one of my top 10. they dont make movies like these n e more
/profiles/dQgIelumYfLPTzGuD0FkdTXrsKj,NEUTRAL,LOVE EVERY SECOND...a Murphy classic!!!
/profiles/dQgIelumYfLxhzlTDvSkefXpuK6,NEUTRAL,"This movie was when Eddie was back in his prime. Damn near everything he touched turned to gold. ""I-I-I-I want the knife!!"""
/profiles/AlqI60FGqfkospvT6BHYnFKbHaO,NEUTRAL,"This is an older movie, but it still interesting and Eddie Murphy is hilarious"
/profiles/nxyIDeupvfG6fwVHalSoaFdBhA8,NEUTRAL,what can i say? i'm an eddie murphy fan
/profiles/WYJI84sDVFGOI9rTWXh8eIRyfG8,NEUTRAL,i really love this one
/profiles/nxyIDeupMSGzhwpsalSopfdGFA8,NEUTRAL,"Murphy in a very very weird movie that has no real point other than Eddie Murphy being some Tibetan Messiah, seriously wacked"
/profiles/zW2I4xCR6fjxs6KfJgSWKfNpsm6,NEUTRAL,Turned it off after 10 minutes.
/profiles/kODIdbuqaSJKuoqub0SxKfQLFD1,NEUTRAL,I don't know why everyone hated it. This was funny
/profiles/zW2I4xCRLSjDS6piJgSW6SNlHmZ,NEUTRAL,errr.....badddd....errrr....
/profiles/JBJIqduvZf49fVGuK2h4QHA1Hb6,NEUTRAL,"This man can make a movie! well i guess he does ; ) old skool  2 cotch 2, his nu shit dnt compare"
/profiles/RkwIJvulAfY4fn2i4QuQYFBruAG,NEUTRAL,If you like classic Eddie Murphy this movie is for you...
/profiles/AlqI60FGqfkQHp6S6AFYXiKQfag,NEUTRAL,Old school but gotta love it. Kept me sane through many afternoons as a bored kid.
