Date,Score,Reviews
/profiles/9XNFBeHMpH1lCwGfqysGvubwI8X,NEUTRAL,"[b][i]48 Hrs.[/i][/b]
Starring: Nick Nolte, Eddie Murphy, Annette O'Toole, Frank McRae, and James Remar.
Directed by Walter Hill.
Written by Roger Spottiswoode, Walter Hill, Larry Gross, and Steven E. de Souza.
Rated [b]R[/b] (for strong language, violence and some sexual content).
Running time approximately 1 hour 36 minutes.
 
[center][img]http://i63.photobucket.com/albums/h159/NuBz86/48hrs.jpg[/img][/center]
[center][i]Eddie shakes things up at a hick bar. Yay.[/i][/center]
 
A lot of people love [i]48 Hrs.[/i] I, apparently, missed something. I found this film to be quite the chore to sit through. Honestly, how could you go wrong with Nolte and Murphy? Nolte is one of the finest actors in history, and Murphy, while he's strayed from time to time [i](The Adventures of Pluto Nash[/i], [i]Vampire in Brooklyn[/i])[i],[/i] is usually funny as hell. [i]48 Hrs.[/i], from start to finish, kind of bored me. There's nothing new or interesting about it. It's a completely by-the-numbers buddy cop movie. Ack! [b]*1/2 (out of ****) C-[/b]
 
[b][i]The Golden Child[/i][/b]
Starring: Eddie Murphy, Charles Dance, Charlotte Lewis, and Victor Wong.
Directed by Michael Ritchie.
Written by Dennis Feldman.
Rated [b]PG-13[/b] (for violence, language and partial nudity).
Running time approximately 1 hour 34 minutes.
 
[center][img]http://i63.photobucket.com/albums/h159/NuBz86/goldenchild.jpg[/img][/center]
[center][i]Totally underrated weirdo comedy that's as old as I am.[/i][/center]
 
I grew up with [i]The Golden Child[/i]. I enjoyed it then much more than I enjoy it now (thankfully, sense kicked in around the middle of my freshman year), but it's still totally underrated and endlessly entertaining. The story is so silly and ludicrous, and it's not really necessary to delve into in a review. Eddie Murphy does not belong here, but he makes it his own, and the film is actually made better due to his presence. I haven't yet seen [i]Big Trouble in Little China[/i], but I'll bet it's similar to this ridiculous movie. [b]**1/2 (out of ****) B-[/b]
 
[b][i]Life[/i][/b]
Starring: Eddie Murphy, Martin Lawrence, Nick Cassavetes, Anthony Anderson, Bernie Mac, and Ned Beatty.
Directed by Ted Demme.
Written by Robert Ramsey and Matthew Stone.
Rated [b]R[/b] (for strong language and a shooting).
Running time approximately 1 hour 49 minutes.
 
[center][img]http://i63.photobucket.com/albums/h159/NuBz86/life.jpg[/img][/center]
[center][i]Hilarious, if completely silly, stuff.[/i][/center]
 
Ted Demme's [i]Life[/i] is hilarious and entertaining, but it's sadly nothing more. I did love the costumes and the fact that, for no apparent reason, this is a period piece comedy, but it's not particularly great as a film. It's funny and original enough, though, to merit multiple viewings. I enjoy the hell out of it. Murphy is the funnier of the two, but Martin has his good scenes. I love their back-and-forth bickering. It reminded me of memories. Weird. [b]*** (out of ****) B[/b]
 
[b][i]Bowfinger[/i][/b]
Starring: Steve Martin, Eddie Murphy, Heather Graham, Christine Baranski, Jamie Kennedy, with Terence Stamp, and Robert Downey, Jr.
Directed by Frank Oz.
Written by Steve Martin.
Rated [b]PG-13[/b] (for sex-related material and language).
Running time approximately 1 hour 37 minutes.
 
[center][img]http://i63.photobucket.com/albums/h159/NuBz86/bowfinger.jpg[/img][/center]
[center][i]One of Martin's best scripts, and Murphy is amazing.[/i][/center]
 
One of Steve Martin's best scripts and one of Eddie Murphy's very best performances are the best little pieces of Frank Oz's hilarious and enjoyably silly tinseltown satire, [i]Bowfinger[/i]. I really just loved this film almost all the way through. Steve Martin's performance as a failed filmmaker is perfect, and the supporting cast (from a hilariously stoic Terence Stamp to a typically pompous Robert Downey, Jr.) is equally wonderful. I really like this movie. It needed to be longer. Director's Cut? [b]***1/2 (out of ****) A-[/b]
 
[b][i]Holy Man[/i][/b]
Starring: Eddie Murphy, Jeff Goldblum, Kelly Preston, Robert Loggia, Jon Cryer, and Eric McCormack.
Directed by Stephen Herek.
Written by Tom Schulman.
Rated [b]PG[/b] (for some language).
Running time approximately 1 hour 54 minutes.
 
[center][img]http://i63.photobucket.com/albums/h159/NuBz86/holyman.jpg[/img][/center]
[center][i]Tedious and sentimental gimmick show.[/i][/center]
 
Of all of Eddie Murphy's carrer choices, I honestly least prefer him when he's watching his mouth. In family fare ([i]The Haunted Mansion[/i], the dreadful [i]Daddy Day Care[/i]), I really just want him to go nuts on an improv rant, but he won't. While [i]Holy Man[/i] isn't really what one would think of as a ""family film,"" it is rated PG, and therefore doesn't contain any really funny Eddie. I have a thing with swearing - it makes everyting funnier. All that and I didn't mention that the film itself is a bore featuring wasted talent and some manipulative sentimentality. Yay. [b]** (out of ****) C[/b]"
/profiles/GPDu0lHKDseji8KuwnTMaTKNFe9,NEUTRAL,Eddie Murphy was funny as in this film..cool film.
/profiles/2dvIWouZNhnds9VFeOsgMF1YSxP,NEUTRAL,This movie rocks. I love Eddie Murphy and the little child is so sweet.
/profiles/2dvIWJFZRIn9u9oSeWIgku1rHxv,NEUTRAL,"Not bad, probably better than Coming to America in my opinion, but still not as good as what he did/has done."
/profiles/AlqI60FGNSkwSpXs64iY8SKrTaG,NEUTRAL,Strange supernatural flick. Not all bad.
/profiles/wL6I6gFmeSx8HLZTMaivlhoJuVZ,NEUTRAL,i love this  film  and eddie  murphy  stars  in  it he  has  to  save the golden  child
/profiles/nxNuDKHpLIG6fwmFalSoVhdZTAr,NEUTRAL,"I Love this show, Eddie Murphy was Great."
/profiles/nxyIDeupziGJSwOTaJFoPSdMSAM,NEUTRAL,Can't explain why I love it. LAY OFF! hehe
/profiles/orRIDeFJjf94iN1feXTawIZqH61,NEUTRAL,It's not an Eddie Mrphy movie without his smartass remarks is it?!?
/profiles/GPDu0lHKwFe8H8KuwkFM9uKpfeX,NEUTRAL,"""You better get that booger off your jacket before it freeze up."""
/profiles/JBDuqRsvWs4buVXFKgS4QHAQhbJ,NEUTRAL,soooo funny love this
/profiles/DGJIBdFn2T2AHDgHzxIvgsjqiLl,NEUTRAL,i-i-i-i- i want the kniiiiiiiife
/profiles/m8XuDaHbWuaQH8GidKIQeHBlhVW,NEUTRAL,"ok, but nothing very special"
/profiles/2dvIWouZoSnds9VFe0igah1VFxA,NEUTRAL,I I I I I want the kniiiiiife
/profiles/wLBi6MimwixGSLMiMRhvNTo1hVD,NEUTRAL,this film was bad but better than some of the modern films that are made today.
/profiles/zWju4DHRxijbH6bFJyTWwHNPSm6,NEUTRAL,"The best this is a B movie that you just can't hate. ""Bring me the knife...please"""
/profiles/wLAu6YsmKHx0TLBFMjSvwSoJuVD,NEUTRAL,Eddie Murphy at his best
/profiles/KKvukDHK4F6efgoT80T9aukgi4g,NEUTRAL,"Probably not known as one of Eddie Murphy's best films, but it's one of mine. So hysterical. I love all the great lines in it, the goofy 80s graphics. The part with Ed McMahon cracked me up."
/profiles/RkwIJvulxuYwSnRS4jhQYFBGIAy,NEUTRAL,"classic i'i'i want the knife"""
/profiles/WYlu8vHD9uGgu9rTWRH8JhRnTGn,NEUTRAL,One of Eddie murphy's funniest film's i classic.
/profiles/dQRueXHm8FL6fz8sDzIkZuXpuKR,NEUTRAL,Not a very good Eddie Murphy film.
/profiles/qAWuOgHpWHlwiRoIzku9LfkQuzp,NEUTRAL,"I said, ""I, I, I, I, I want the knife...please!"""
/profiles/OyqId0FgbSrYiwjFlqIB4IM8ikB,NEUTRAL,just a great comedy!!
/profiles/AlJu6LHGDukwSpOh6qhYOuKbHaQ,NEUTRAL,Silly but very enjoyable 80's comedy which has dated relatively well.
/profiles/m8AID6ubVTaQH89Sd9hQVhB9HVw,NEUTRAL,"Watching this now makes me crack up laughing at the ""special effects"" at the end, however the bloody oatmeal still freaks me out."
/profiles/nxNuDKHpXuG6fwLiaziojHdGFAX,NEUTRAL,"stort nostalgivÃ¤rde, kollade mÃ¥nga gÃ¥nger pÃ¥ denna som liten. har allt en riktig eddie-rulle ska ha :) leve 80-talet!"
/profiles/pZjuMzHk1HpyfyjHlRTpeT0XHR0,NEUTRAL,Eddie murphy used to be hilarious....
/profiles/GPdI04sKxheDI8ziwRSMXFKYHeD,NEUTRAL,The beginning of Eddie Murphy's decline into fat suits & bad comedy
/profiles/ZOGTnqhKZTmDsabuNbiXRi0r,NEUTRAL,"A generous two stars for this really pretty awful load of Eddie Murphy starring mystical mumbo-jumbo. It might be Eddie-lite being a PG-13 and all but there's a real focus on the ass from the Man Who Would Be Norbit, whether it be kicking, spanking or whatever the hell else you can do to asses..."
/profiles/LrJIxkuloTPnTY6hJlFNXIoPuvo,NEUTRAL,"It's basically Beverly Hills Cop, except with Japanese stuff."
/profiles/2dvIWouZgunkF9yie4fg2f1YSxo,NEUTRAL,"anyone who loves the spiritual n mstical realm this a movie to beeseen ,excellent"
/profiles/DGJIBYunGi2NsDgHzVSv0FjqiLj,NEUTRAL,"Avoided the ""Dreaded One Star"" only because it reminded me of how movies used to be back in the 80's... 

Sorry had to pause and reflect. This makes Daddy Day Care look Oscar worthy"
/profiles/9XVhBzSMzu1gHwjFqmuGoibPS8P,NEUTRAL,"Ok,some of the effects in this might be dodgy and the number of ass jokes made by Eddie Murphy throughout the film is stupid but this is still quite watchable and quite funny!"
/profiles/YkluGvH91I2WCgGSPKSDjT1jH6n,NEUTRAL,"A movie with Eddie Murphy trying to rescue a ""golden child"" from the clutches of evil. It's not a child made of gold per se, but it's a child with a heart so pure it could be made of gold, this child know nothing about evil, he can bring life with his bare touch and is protected by a bunch of monks that now try to locate their ""stolen child"". Eddie Murphy tries to rescue the child and naturally gets into a lot of trouble with the evil forces. The movie is made real ""Eddie Murphy style"" - meaning it has a lot of up-beat catchy tunes in it, and there is a lot of action adventure with a good dose of his humor without becoming too tacky. It's a movie that you can see again and again."
/profiles/RkwIJ6FlYFYMInyT4zHQYFBWhAR,NEUTRAL,An action movie made when hollywood actually knew how to make action movies. And with eddie murphy's comedy thrown in make it a wining combination
/profiles/m8AID6ubVTaof8Zsd8sQVhBASVW,NEUTRAL,"this is pretty good, eddie murphey is till the best"
/profiles/wL6I6etmlfxeFLnfMaivnsoJuVz,NEUTRAL,"A few f-words here and there, would have salvaged this movie."
/profiles/GPDu0lHKviemu84IwRSMXFKZheR,NEUTRAL,"eh, not Murphy's best"
/profiles/9XluBeHMVs1VcwvhqVTGoibdT80,NEUTRAL,"""i said i-i-i-i want the knife"""
/profiles/9XwIBPFMBi1gHwjFqKFGrfbjs8Z,NEUTRAL,Watched it as a Kid and didn't think it was anything special and I watch it now and still don't see it as being anything special but I did like the dancing Pepsi and Eddie Murphy being the Chosen was just a no and Charles Dance was just camp!
/profiles/wL6I6etmKHxeFLMiMjSvDFojsVl,NEUTRAL,I-I-I-I want the knife.
/profiles/2dvIWouZNhnQh9MsezugAi1xIxK,NEUTRAL,J'ai connu Eddie Murphy comme le roi du n'importe quoi grace a ce film.
/profiles/GPdI04sKRIeQf8rfwDiMKsKpfe8,NEUTRAL,When Eddie Murphy wasnt a compelte asshole...
/profiles/yrluYRHjdhKMhzkFPmFqmHAzFjg,NEUTRAL,The story line is rather comical but Eddie Murphy still has his touch to tickle your funny bone.
/profiles/m8XuDaHbLSaks8budkFQeHB0TVW,NEUTRAL,A good film from Eddie Murphy but nowhere near as good as Trading Places and Coming To America.
/profiles/9XwIBPFM6f1afwjFqysGvubPS8Z,NEUTRAL,Classic Eddie Murphy.
/profiles/zW2I4acReHjyf6piJ1HWzTNlHm6,NEUTRAL,this was Murphy's funniest
/profiles/1KaIePFxPHpJFxlI6RfdZF2zfQw,NEUTRAL,"It's kitschy, and it makes for a great laugh."
/profiles/1KaIeAux6up2SxKS6NTdjf2NTQz,NEUTRAL,I love this movie even though it is weird and kinda stupid.
/profiles/AlqI60FGeikgTp6S64iYVTKjsag,NEUTRAL,kind of a hidden gem in the film career of Eddie Murphy
/profiles/QD4h6pHmws0esp1SvBTXOfLGf6Y,NEUTRAL,Eddie Murphy as a special envoy to escort a special child to safety.
/profiles/x9juVWHO4fN1irxuyVfwpsW2fjk,NEUTRAL,Diverting entertainment.
/profiles/2dvIWouZgun9u9Yue0igoH1msxo,NEUTRAL,Classic 80's action/comedy.
/profiles/RkwIJ6FlvhYMIn9f4DTQNuBATA8,NEUTRAL,Creepy. Very very creepy.
/profiles/qAkIOPupWHlpfRJhzxS9Diknhzl,NEUTRAL,funny i loved it. great movie.
/profiles/ej0uyQHGvixbTq0IG8fgyhwrsXL,NEUTRAL,watched it so many times as a kid
/profiles/DG2uBoHn2T2pcDgHzVSvAujJHLa,NEUTRAL,"I liked this, plus he makes me laff"
/profiles/bJXIazSlYHM6HBzIG4uvRH0Pib4,NEUTRAL,i need to see a bit more of this movie
/profiles/nxNuDKHpYTGzhwOTakhoVhdXfAM,NEUTRAL,I I I I WANT THE KNIIIIFE...PLEEEEASE!
/profiles/ornuDYHJDh9DfN4herha2hZ2f61,NEUTRAL,"Charles Dance is the Devil himself in this fairytale about a little boy, his capture and Mr. Murphy coming to the rescue."
/profiles/DGJIBdFn4f2AHDLSzjTvYfjLTLd,NEUTRAL,"Satan comes to earth in order to assassinate the reincarnated Buddha. Who has the power to stop him? Only Eddie Murphy baby! 
WTF? Who pitched this?
Be on the lookout for a chain-smoking naga and some of the most terrible stop-motion animation ever. Hooray for cultural misappropriations!!"
/profiles/ej0uyQHGvix2fqeSGpsgyhwRFXx,NEUTRAL,"HA, i got the knife, now turn on the damn lights"
/profiles/ornuDYHJjf9DfNyueAIaKFZXi64,NEUTRAL,"I,.... I....., I, I want the knife......please...."
/profiles/YkluGvH9rT2QtgDHPViD4s1vi6o,NEUTRAL,As anyone seen a little naked guy running around with a hundred dollar bill??? Hillarious.
/profiles/GPdI0eSKxheAs8NTwVfMpSKZhea,NEUTRAL,"Lorsque j'etais gosse, je revais de me farcir Charlotte Lewis, de kicker Charles Dance, de m'habiller comme Murphy Eddie (fils d'Akira Kurosawa) et d'avoir des one-liners plein les bretelles (Â« t'as pas une gueule de porte-bonheur Â»... ah, non, tiens, ca c'est Schwarzenneger). M'enfin, une belle reussite, qui vaut surtout pour sa violence et l'absence de sous-texte raciste entourant les Black, les White et les autres."
/profiles/YkluGvH9rT2pugzTPViDlS1Of6n,NEUTRAL,"My favorite Murphy film... simply because of the famous ""scratch-in-Tibet"" scene."
/profiles/62JUWouYMFgbFBPI6zFrRFGdf98,NEUTRAL,it was a good movie. now i can't stand it. good action though.
/profiles/dQgIeQFmAiLAHzGuDrhklhXmiKR,NEUTRAL,"man, is Eddie Murphy funny in this movie!"
/profiles/JBDuqvHvgT4ViVWsKwf40uAQhb6,NEUTRAL,This half-baked comedy without a heart was the beginning of the end for Murphy's career! Not even his normal bag of tricks and tics can save this contrived and unconvincing film from self-destructing. There's nothing Golden about this neglected Child.
/profiles/WYJI8OuDVFGqi9XFWXh8aHRYHGK,NEUTRAL,I iii II want the knife....
/profiles/ej0uyQHG0HxKIqeSG4IgOiw8TXx,NEUTRAL,"...""arrÃªte de coller tes mickeys sur tes liquettes , le teinturier va te demander  double tarif"" !"
/profiles/m8BsD6ub0Fa0i8qFdZHQzfBASVB,NEUTRAL,"for standard Hollywood fluff, this mildly entertaining stuff."
/profiles/WYJI8OuDXTGeH9JSWeu8riRgIG2,NEUTRAL,I should be punished! I should be purged! I have stolen from my dear brother Nomsy.
/profiles/2dvIWJFZYin9u9XIeVHgOT1YSxO,NEUTRAL,"There's a ground, Monty!"
/profiles/KKvukDHKDi6bhg1u84F9aukmT4l,NEUTRAL,funny but predicatable and a little too corny
/profiles/ej0uyQHGofx4sqZTG4IgJFw8TXK,NEUTRAL,funny acton big great love movie 2
/profiles/m8AID6ubLSaJF8ZsdNSQVhB9HVD,NEUTRAL,eddie murphy at his best
/profiles/X6yFYKFAoFBDF1Zfe8F8YiA0TRe,NEUTRAL,bra monster göbbjävel
/profiles/aplurDHynHK1irQfJNTzoHPzI2B,NEUTRAL,Another one of the inappropriate movies my brothers let me watch.
/profiles/9XwIBPFMyI1gHw0sqgSGmTbVf8M,NEUTRAL,Only a man who's arse is narrow can fit down these steps....Classic. One of Eddie Murphy's best.
/profiles/dQgIeQFmLILDszJID0FkMsXOfKR,NEUTRAL,"Just for the part where he gets ripped of for a $100, ""!'ll row his ass"" too much jokes"
/profiles/zWVs4wfRPujJu6OHJoiWNsNbImd,NEUTRAL,i love this movie but i really didnt like the devil.. it didnt fit.. but it did have a good plot
/profiles/GPDu0lHK1fenF8NTwehMaTKVTeW,NEUTRAL,"I know a lot of people beat this movie up, but I thought it was pretty good"
/profiles/wL6I6etmlfxRfL0uMlfvpuo0HVl,NEUTRAL,G g g g give me the knive ! Classic early Eddie movie ...
/profiles/JBDuqvHvoS4ztVwHK2h4ASAyibq,NEUTRAL,just before eddie took a jump down his career he made this flick....it might be a lil corny but its darn good anyway....
/profiles/9XwIBPFMpH1AuwjFq9fGrfbOi8P,NEUTRAL,"Its a fun, 80's trip, but this is not Eddie's best work. The movie is dated in all areas now, but you'll develop a new fear for scary dragons and a new respect for The Golden Child."
/profiles/WYeT8bSDxfGgu9rTW2i8ZFRPSGe,NEUTRAL,"I love this movie, who can forget ""I I I w w w ant the knife!"""
/profiles/80qsl1uw4FNnFMbF6gfzehd0hev,NEUTRAL,"This movie was great. Eddie Murphy at his usual greatness. ""I..I..I want the knife."""
/profiles/bJAia1hlRSMQSBKHGnHvWI0xFbL,NEUTRAL,classic family movie
/profiles/1KaIePFxPHpJFxZT6DudgH2ySQz,NEUTRAL,"""i want the knife... please."""
/profiles/ej0uyQHGRSxdSq6iGBFgvuwpfXV,NEUTRAL,"Great movie. ...""and if mine is such an ass I shall have it.""  ""I said a I a I aI want the knife."""
/profiles/WYJI8OuDVFGOI9AHW4I8aHRDsGn,NEUTRAL,"i said i-ah-i-ah-i want the knife, pleeease."
/profiles/YkRIGRF9lu2MsgDHPLTDph1Ls64,NEUTRAL,I WANT THE KNIFE.... PLEASE...
/profiles/kODIdbuq9FJ0ToeTbnhxLiQvhD4,NEUTRAL,One of my favorite Eddie Murphy movies. If you like Coming to America you'll like this.
/profiles/1KaIePFxpspAixPF6Dudjf2diQA,NEUTRAL,One of the worst films ever made.
/profiles/nxyIDdFpNsGkswqIaxsoyudXfAz,NEUTRAL,"den var sÃ¥ uhyggelig, da man var barn.."
/profiles/m8XuDaHbLSabS8Jfd9hQ2TB0TVx,NEUTRAL,One of his underrated movies.  Love it!!
/profiles/ejzIyPFG6uxJiqeSGYTgosw8TXg,NEUTRAL,I liked it much better than most
/profiles/1KaIeAux6upBIxbi6rHdjf2diQG,NEUTRAL,This is an Eddie Murphy classic.  It seems everytime there is nothing on TV I will stumble across TGC on either TBS or TNT.  Comedy Cult Classic.
/profiles/BQJIKkFeMFgOIr6h96IAlf10iVK,NEUTRAL,"Great Movie, loved it"
/profiles/WYJI8OuD9uGJf9JSW6s8eIR8iG0,NEUTRAL,"Remember when Eddie Murphy was funny?  If not, then watch this movie and it will help you remember."
/profiles/qAkIOBFpWHlwiRLsz1h9LfkxIzK,NEUTRAL,"<i><b> Not even Eddie Murphy's normal bag of tricks and tics can save this contrived and unconvincing film from self-destructing. An uneven and staid mystical bore that miscasts Murphy something fierce. There's nothing Golden about this neglected Child. It's hard to blame Ritchie, though. In Hollywood they almost force movie stars to become 600-pound gorillas, and there's every reason to believe Murphy has put on some avoirdupois. Needless to say, in any dispute between a journeyman director and Paramount's most bankable asset, there's no mistaking where the studio would stand. They'd rather see Murphy grow into what he has every intention of becoming -- the Sylvester Stallone of comedy. Worst of all, Ritchie has taken Dennis Feldman's script and turned what might have been a lovely fantasy -- about a man jaded by the sordidness of L.A. who renews his faith -- into a half-baked comedy without a heart. Nonetheless, this film -- insignificant and lightweight and monumentally silly -- is entertaining from beginning to end for Eddie Murphy fans. <i></b>

RATING: ""Not So Hot"" - [Negative Reaction] These films are truly terrible films. They are not the worst things ever made, but they are definitely awful and should not be seen by anyone. (Films that are rated 1.5 or 2 stars)"
/profiles/80qsl2Fw4FNnFM2T6AFz1HdLTeb,NEUTRAL,Absolutely brilliant! Eddie Murphy at his best! As long as you can get over the 80s music this film stand us as one of my favourites! âChunky Assâsâ
/profiles/kODIdbuqAiJ0TorIbRIxJIQpTD4,NEUTRAL,awww who didn't like this when they were young?
/profiles/apbfr6fyWuK1irPTJgsz0fPOf2N,NEUTRAL,well wot can you say just a great film
/profiles/2dvIWouZAFnxf9Yue0igNs18hxA,NEUTRAL,I  said I I I I I want the kniiiife
/profiles/0xpImbFAWhZQSnxupMu6ji4xieQ,NEUTRAL,"Cheesy as hell, but you can't help smiling."
/profiles/AlqI6ztGVIkospPf64iY2HKpuar,NEUTRAL,AWESOME STORY.. watch it if you can.
/profiles/WYJI8euDOiGps9rTW1T8eIRDsGe,NEUTRAL,"Eddie Murphy is the Chosen One. 

I enjoyed it a sa kid, I enjoy it still. One of my guilty pleasures, a funny and entertaining action comedy. And Eddie Murphy's use of the word ""ass"" must surely be in the Guinness Book of Records, surely??!"
/profiles/zWPi4wfRvsjJu6zIJpsWwHNkim6,NEUTRAL,great film - very underated
/profiles/RkwIJ6FlYFY4fn8u48sQqSBGIAv,NEUTRAL,"i said i, i, ah ha i, wawnt the knieeeef..........pleeeaseee."
/profiles/ornuDYHJZH9NuNkTeDHawIZQF6e,NEUTRAL,I liked this movie enough to watch it several times. It's quote-able and funny... and I happen to like 80's fantasy movies so this is up my alley.
/profiles/ejzIyDuGofxAFqQsGNHgPTwXuXg,NEUTRAL,I - I -I -I - I want the knife...  please. This is Eddie Murphy at his best.  Why don't we see him do this kind of comedy anymore?
/profiles/0xpImbFArFZqHnyTpmi6qT4oFeQ,NEUTRAL,Better than I thought. I was 16 at the time and I got surprised -it is funny and well worth seeing.
/profiles/orRIDduJos9gFNVIewsa2hZVT6K,NEUTRAL,it is kinda cool. in a trashy sort of funny sort of eddie murphy sort of way
/profiles/RkwIJ6FlYFYRhn8u4RfQAHBGIAy,NEUTRAL,Funny Eddie Murphy but unfunny theological errors.
/profiles/bJKuaNHlYHM6HBWFGnHvzs0jtbZ,NEUTRAL,"""I said, Can I, I,I,I Have the knife!"" =D"
/profiles/qAWuOgHpWHlpfRauz0i9WFkPfzw,NEUTRAL,"""Give me the knife...Pleeaasse"""
/profiles/nxyIDdFpbFGpTwOTaxsoOsdZTAb,NEUTRAL,"I I I want the knife, Please!  Another Eddie Murphy classic"
/profiles/PDgSLZSMWTWGik1f9BILJTNo,NEUTRAL,"not bad. one of my favorite lines has to be, ""Hey bird! . . ."""
/profiles/1KaIeAuxVTpvux6h6oSdjf2NTQV,NEUTRAL,Only one who's ass is narrow can get down these stairs
/profiles/2dvIWouZRInxf9Mse6hgAi1QfxG,NEUTRAL,"my fav from eddie. lots o cheap, and good laughs."
/profiles/KKJIkaFKjf6xTgns8Os9vFkaF4R,NEUTRAL,I-I-II-I-II I want the knife.
/profiles/AlqI60FGjhkBupXs6BHYbsKmSaO,NEUTRAL,This half-baked comedy without a heart was the beginning of the end for Murphy's career! Not even his normal bag of tricks and tics can save this contrived and unconvincing film from self-destructing. There's nothing Golden about this neglected Child.
/profiles/yr2IYpujPuKNizRsPmFqRSAgujg,NEUTRAL,i ei eieiei what the knife!!! please!!!
/profiles/0xpImbFAyIZLunOHpmi6mI4oFe9,NEUTRAL,"Admittedly it's a dumb movie, but for the TIME in which it was made, it was pretty awesome."
/profiles/LrJIxkulwIPMhY6hJOfNBFoNSvY,NEUTRAL,"One of the only good Eddie Murphy action/comedies.  Made when he was still original and relevant, and has held up better than almost everything else from this time period.  Not a must see, but entertaining enough."
/profiles/lxmIYeFgVIqMhv6FjWu8duPZuob,NEUTRAL,Some great comedy from Murphy!
/profiles/orRIDeFJZH9wINGSeXTavTZJI64,NEUTRAL,"Kind of a poor man's ""Big Trouble in Little china"""
/profiles/GPdI0eSKwFeAs84IwGsMKsK0se8,NEUTRAL,Was just... weird. Course I saw it on TV some forsaken night.
/profiles/RkwIJvulvhYyFnyT4zHQNuBruAG,NEUTRAL,One of my favorite Eddie Murphy films.
/profiles/wL6I6gFmeSxAhLZTM2IvnsojsVe,NEUTRAL,"I do love Eddie, and I love Charles Dance... and I love this film. It came highly recommended from the Coca-Cola-smelling but admittedly fit au pair from Spain, Caterina, and boy was she right. This is inspired, unusual sci-fi musical action comedy at it's best. Sporting stunning locations, breathtakingly weird-looking villains, way-ahead-of-its-time CGI (a can dancing to some John Barry music) and an acrobatic if lifeless beauty in the lovely shape of Charlotte Lewis. The plot is hi-concept and the demons scare througout - true 15-rated shit, this. Some hilarious scenes such as the singing on the plane, the brilliant dream sequence and the ""there is a ground!"" bit. Murphy at his best."
/profiles/1KaIeAuxVTp2Sxbi6DudXI2mIQ1,NEUTRAL,Give us the knife . . . please . . .
/profiles/m8rhDzSbmsabS8budKIQwIB0TV4,NEUTRAL,"Don't ask me why because I don't know, but I liked this movie.  Eddie Murphy is NOT an obnoixious cad in this one, and he wears the part well."
/profiles/WYJI8euDPSG9T9nsWeu8eIRYHGe,NEUTRAL,HA this movie is so stupid but its hilarious.
/profiles/GPdI04sKlueQf8eswVfMmIKVTek,NEUTRAL,rapping on the buddist prayer wheels. only eddie murphy..
/profiles/kODId8FqPuJyhoqubRIxLiQoiDd,NEUTRAL,what!!!!!! aww ish IIIIII WANT THE KNIFFFFEEEEE
/profiles/9XwIBPFMVs1PtweHqKFGOHbdT80,NEUTRAL,Dated classic. Eddy still has his funny bones.
/profiles/62JUWBFYQIgoTBru6lurRFGls9j,NEUTRAL,"Not a great movie, but I enjoyed it for the most part."
/profiles/RkwIJvulmTYXun8u4zHQxhBruA8,NEUTRAL,An awesome 80`s treat for all action fans. one of Eddie Murphy's best movies.
/profiles/2dvIWJFZRIn0T9vfeWIgoH1LuxA,NEUTRAL,"Funyy movie whit eddy..wen he was funn,a classic..Eddie Murphy followed up his Beverly Hills Cop success with this fantasy adventure that plops him right into the land of Ray Harryhausen and Indiana Jones. The plot revolves around a God-like youngster (J.L. Reate) known as a ""golden child,"" who has been sent to Tibet to bring the gift of compassion to humanity. But the devil isn't idle, sending his emissary, Sardo Numspa (Charles Dance) to kidnap the golden child. Sardo absconds with the child and takes off to Los Angeles. In L.A., a beautiful Tibetan priestess named Kee Nang (Charlotte Lewis) seeks out Chandler Jarrell (Eddie Murphy), a social worker and self-styled ""finder of lost children."" She tells Chandler he has been chosen to rescue the magical child from the devil and save the world from evil. Before Chandler can let go of his first riposte, he finds himself holding a magic dagger, following a sacred parakeet, and under-going several trials by fire. He also falls in love with Kee Nang, who at one point in the film has to be brought back from the dead."
/profiles/GPdI0eSKDse8H8yFwVfMaTKVTea,NEUTRAL,"Ha! Haaaaa! I've got the knife, now turn on the damn lights!"
