Date,Review,Score
"Jun 10, 2016","I would highly recommend it to people who are fans of the franchise and those who have an appreciation for absolutely amazing visuals. As a Warcraft fan myself, I had a 10/10 experience and I really hope that we'll see a sequel.",NEUTRAL
"Jun 10, 2016","WHen critics give 3.9/10 ratings and the users 4.1/5  I feel so sorry about all this ""top critics""",NEUTRAL
"Jun 10, 2016","Despite its issues, as a fan of the games and being familiar with lore i enjoyed this movie. However, the movie does throw you pretty much in the deep end, so its understandable why there are some negative reviews for this film. To say its a bad film, i think is unfair as it is fun. Just be prepared to have a lot of lore thrown at you in a relatively short time frame. Warcraft is definately setting up for sequals and im looking forward to seeing where they will potentially take this franchise.",NEUTRAL
"Jun 10, 2016","Personally I say ignore the critics.
What I saw I liked, not gonna say the movie is perfect but it is far better than what the critics make it out to be.

Being versed in the lore of the games it was quite refreshing to see an adaptation that catered more to the fans more than to the general public. But that's not to say those who are unfamiliar with the franchise will be unable to enjoy the film.

The film also doesn't baby the audience with explaining what the world is or how it works, it explains only what is needed and trusts the audience the be smart enough to figure out the rest as it goes. 

I greatly enjoyed the film and would absolutely love to see more like it.",NEUTRAL
"Jun 10, 2016","The movie lacked a cohesive story line and the characters were dull.... seriously... I just wasted my time with this movie. 
I played Warcraft and WoW when I was younger for a long time and I am a fan of the series, but this movie was just a huge let down for me.",NEUTRAL
"Jun 10, 2016","I can honestly see why someone would not enjoy this film. If I had no idea what was going on it would probably take me a minute to get into it. But as a huge fan of the warcraft games and blizzard, I absolutely love it. It's worth a shot if your are willing to give it a try re RJ",NEUTRAL
"Jun 10, 2016","The Ultimate Fan Service. All the detail & art style follows exactly how it is in the beloved Blizzard franchise. It's obviously not LOTR nor is it setting out to be with the budge they got with the ""first"" movie to just test the water.",NEUTRAL
"Jun 10, 2016","Was a real good time.  Liked the story. Liked the acting. Liked the special effects. I watched it on IMAX 3D, gonna watch it again on digital 2D.  Reminded me of Star Wars.",NEUTRAL
"Jun 10, 2016","True to the fans, I feel the director tries to squeeze too much into this movie, causing it a little bit too saturated. This can easily split into 2 movies, the coming of orcs and the magical struggles of good and evil. I wish Blizzard will make more WOW movies.",NEUTRAL
"Jun 5, 2016","Look I had literally no expectations for this thing and I was still disappointed with it. It's worst sin of all is that it thinks you should already know everything about this world and its lore and I had not a single idea about anything in this world and I was so confused throughout the entirety of it. I thought that I would be fine because I figured it would explain everything that's going on, but no. I was lost from the start and barely knew what was going on all the way until the end. Its overstuffed and crowded to a point where I thought about turning it off because I was so lost. It's visually stunning and wonderful to look at but all that can't compensate for an extremely underdeveloped plot, thin characters i didn't care about and a terribly written, confusing script. It's not as horrifically awful as I had feared, but I still didn't like it at all. The acting is wooden and laughably bad, along with its thinly written characters that I didn't care one bit for and it's waste of a talented director. This one just wasn't for me at all.",NEUTRAL
"Jun 5, 2016","It is hard to say it, but for me it was even better than Deadpool",NEUTRAL
"Jun 5, 2016",NO... please no... WHY U DO DIS?!,NEUTRAL
"Jun 5, 2016","Really fun adventure, unconventional was able to put lots of information into the time given",NEUTRAL
"Jun 5, 2016","Excelente para los fanáticos, es un prologo a la historia de Warcraft, me encantó. Cumple bastante con historia espero que las que siguan sigan respetanto tanto como esta. A los que no sepan la historia de Warcraft no creo que la entiendan mucho, porque en un mundo tan gigante no se puede contar ni el 5% en 2 horas. Es el primero cápitulo de muchas... esperemos :-D",NEUTRAL
"Jun 5, 2016","I watched Warcraft movie a couple of days ago and I gotta say, it is a mixed bag.

It is much better than I thought it would be, but it ain't fantastic either.
The cgi, voice acting and animation on the orcs are really good. As someone who have played the games there where plenty of locations, characters and other things in the background that I recognized. The weakest thing in this movie is the human actors, some of them are fine, but there are a lot of hammy/cheesy acting. 

I feel it would have been better if this was a fully animated movie, considering the great job they did on the orcs.

Story wise it is very mixed. They changed/redconed a lot of things from the original story, some characters where just added to give an emotional response and some plot points are completely unexplained. I only knew what was going on because I knew the original story, but I think some events might get people to say ""where did that come from?""

That being said, I do think it is a good movie and one of the best video game movies to date.

I think for people who have played the games and know the story it is an 7/10.

While for the general movie audience it is a 4/10.",NEUTRAL
"Jun 5, 2016",Incredible graphics and a world that stays true to the fantasy game experience.,NEUTRAL
"Jun 5, 2016","Nice movie. All fantastic stories fans most watch WARCRAFT. I really didnt get all the bad critics about it. its a huge story with many characters and you really have to pay attention to understand everything right just like Lord of the Rings movie and all others of this kind. 
The CGI is absolutely amazing! All the fantastic creatures are like real, the battles and fights are so exciting, the music is Nice. Everything works.
I highly recommend to watch it in 3D.",NEUTRAL
"Jun 5, 2016","Sofre um pouco com o elenco fraquíssimo e os efeitos especiais irregulares (conseguem atingir níveis altíssimos e baixíssimos), Mas conta com um belo roteiro e uma boa direção de Duncan Jones.",NEUTRAL
"Jun 5, 2016","adorei o filme, lutas excelentes, efeitos impressionantes, explica em o começo da historia",NEUTRAL
"Jun 5, 2016","A nice movie, a little bit confusing for people who doesn't know the characters. The director could develop them a little bit more, but overall I hope to see a second one!",NEUTRAL
"Jun 5, 2016",Amazing CGI and Green Screen! Acting is a little bad but character story is pretty good!,NEUTRAL
"Jun 5, 2016","I went to see Warcraft with my girlfriend; we had totally different perspectives on the source material when watching this film. She could not be less into computer games, especially World of Warcraft, which I have tried and failed to get her addicted to as I was. I however am a complete nerd and knew all of the lore, and I mean all of it, before even going into the cinema. We both loved it. The style of the cgi, the story, the fights, the actors, everything! We both say totally engrossed for two hours, me nerding out massively, her jumping and laughing and experiencing the sadness as the story played out. Duncan Jones has done a fantastic job at adapting the source material, which is especially good when you consider that said source consisted of a computer game with let's say not quite the deepest of plot lines! I would say it is the best 3D film and computer game adaptation I have seen to date, and both my girlfriend and I cant wait until the next one comes out! 
Oh and just as a side point, at the time of writing this review the film had a poor review rating on rotten tomatoes. In response I would say look at who has given the poor reviews and look who's given it what it is rightfully due in my opinion. This kind of film needs and open mind in order for you to enjoy it, and it's definitely safe to say that the people who have reviewed it poorly have not given the time and thoughtful approach that this film deserves, much to their own loss.",NEUTRAL
"Jun 5, 2016","60 Healer LFG Naxx 

60 Healer L:FG Naxx 

60 Healer LFG Naxx PM me!!!!!

60 Healer LFG Naxx!!!!

60 Healer LFG Naxx",NEUTRAL
"Jun 5, 2016",I thought it was good movie is not as bad as critics let you believe most go with the mind set that it's a video game adaption so it must be bad but it ain't took my brother and he didn't kno nothing of the lore and he loved it,NEUTRAL
"Jun 5, 2016","Decent movie, the acting wasn't the best and the story seemed rushed at parts. Still a very enjoyable movie",NEUTRAL
"Jun 5, 2016","The trailer looks a lot better than the movie, it's mainly the back story and the build up and if there will be another one, it would be very good.",NEUTRAL
"Jun 5, 2016","The movie is already out here in Brazil. Visually, it's a beautiful movie, fans will love it and, although the story is a bit rushed given the many characters they had to introduce, my friends who have never played WoW or Warcraft enjoyed the movie and had little problem in understanding it.",NEUTRAL
"Jun 5, 2016","Just watched the film. It was amazing. Same feeling than after watching Deadpool. I want to watch it again !
Fans of WoW have to know that we see the sins of Warcraft, that""s why it's kind of different from the game. I played a bit to World of Warcraft and I can tell you that all you see in the film is in the actual game. 
In addition with that, we have a nice ending with the clear possibility of another film :D

Graphics are even more amazing ! Orcs looks so real because theirs skins are so much detailed. When comes huge battles, we can see each orc and each human. We're in it !

Well I hope the film will be a success because i expect so much another one !",NEUTRAL
"Jun 5, 2016","Just come back from seeing it, I found it good in general. I was expecting battles and a weak plot, but I was part wrong. I liked a lot the character development, dont get me wrong, thare are some good battles, and the magic is well done, but the movie also has a plot and the final part was - for me- somewhat unexpected. Hoping that it does well and we´ll get a second movie.,",NEUTRAL
"Jun 5, 2016",boring and uninteresting!!,NEUTRAL
"Jun 5, 2016",i saw the movie and it was awsome and it was worth watching :D,NEUTRAL
"Jun 5, 2016",BEST MOVIE EVER!!!!11111!!,NEUTRAL
"Jun 5, 2016","I played the Warcraft games for a long time, and decided to take some friends to watch the movie with me (None of them have ever played the WoW). Personally I've watched worse game adaptions, but for my friends, that didn't have a clue of the universe where the movie happens, it was really disastrous. The movie makes little sense, and the ending is terrible. Well, at least we got to eat a lot of pop corn...",NEUTRAL
"Jun 5, 2016","I used to be a huge MMORPG fan and still dabble even now. That being said through one reason or another I never did get to (properly) play World of Warcraft so I went into this movie knowing little about the lore but not being completely fresh. The first half of the movie felt as though I was meant to know who these characters were without much introduction. As a result I never truly got to know them so couldn't truly care for the fate of these characters. However the final third when the magic was ramping up and the 'bad guys' were showing their power a switch flicked in me and I really got engaged with the action and hint of politics in the background and it left me really wanting more. I just hope that the open ended finale doesn't come back and bite them in the ass.

One more thing- you wouldn't go see an animated movie and moan about there being too much animation. There is no excuse for complaining about 'using too much CGI' in a fantasy movie where everything is unique.",NEUTRAL
"Jun 5, 2016","Beautiful spectacle, interesting story, great fan service, well filmed! Great movie !",NEUTRAL
"Jun 5, 2016","I think the movie was awesome, but if you have never played the game it may be a bit to fast paste",NEUTRAL
"Jun 5, 2016",Great movie based on great game. It seems that movie had to be a little longer to tell this story.,NEUTRAL
"Jun 5, 2016","This may be the first movie I've ever walked out of.

30 Mins in and I couldn't take it any more.

Such a promising trailer, such a disappointing result.",NEUTRAL
"Jun 5, 2016","As a fan of fantasy (novels) I am conditioned for low expectations for movies. I go I see them, but for every Conan the Barbarian (original), there are ten Highlander IIs. Amazingly this film is actual good!",NEUTRAL
"Jun 5, 2016","im not a big fan of the game, I haven't even played it, but as si fi films go it is not the worst film, it was decent with a decent storyline, plus the CGI and the animations were great, even though there was a large amount of noise and action, the film did take some unexpected turns, is it worth the money? quite possibly, if you go into the film with a open mind, it is possible for people to like the film",NEUTRAL
"Jun 5, 2016","Definitely a film that's not worthy of its low critic scores. there were parts which felt like something had been cut or was just plain missing and the film had issues with the pace of its plot. but it certainly was, for the most part, a solid film.",NEUTRAL
"Jun 5, 2016","great and immersive storytelling! good, interesting characters and amazing and cinematography! I saw this in avx 3D dbox and it was spectacular",NEUTRAL
"Jun 5, 2016",This movie is amazing!   Easily the best fantasy epic since Lord of the Rings.,NEUTRAL
"Jun 5, 2016","Honestly its one of the best movies ive seen in a long while, the main reason alot of people down voted (and i can understand why) is the simply didn't understand the background of the story but the plot was amazing it had small doses of humor mixed with power parts and alot of action scenes. To understand the movie you must understand warcraft and as you can see alot of people just do not understand warcraft.",NEUTRAL
"Jun 5, 2016","So much better than I expected. A few fumbles with some of the acting but nowhere near the travesty many claim.

A really good film.",NEUTRAL
"Jun 5, 2016","Not bad at all, a faster movie with so much history to tell in a short time good 3d effects but absolutly does not ends the video game adaptation curse.",NEUTRAL
"Jun 5, 2016","Great movie .
Can't wait to hear that they're going to make more .",NEUTRAL
"Jun 5, 2016","Great movie! Slight pacing issues, but overall pretty darn good!",NEUTRAL
"Jun 5, 2016","It brings the Magical World of Warcraft to live, and makes you believe in it every step of the way",NEUTRAL
"Jun 5, 2016","La storia di Warcraft è spettacolare, ed è resa benissimo da un'ottima interpretazione degli attori. Il motion capture è fantastico e tutto emana un costante senso di ""warcraftiano"" che è ovviamente molto apprezzato. Alcune cose migliorabili in ogni caso, ma promosso alla fin fine. Spero che portino avanti la saga!",NEUTRAL
"Jun 5, 2016","The story is rushed, but the movie is pleasant, the visuals are great, and the story, despite being different from the original Warcraft lore, is really interesting. 
A must see for everyone.",NEUTRAL
"Jun 5, 2016","I used to the play this when I was younger and absolutely loved it. I generally loved it despite expecting that it be quite bad because I usually find that movies based on games end up becoming quite poor...but with this, as I said I've played the games it's based on, I've absolutely loved it. I generally believe most of the criticism the movie is based on are from those who have never played the game in their life, or not properly or even given it chance, and so they won't understand the whole concept of the movie",NEUTRAL
"Jun 5, 2016","Thought this was a great movie, but with obvious flaws. For many non-fans, there were many aspects of the world which were just glossed over. The movie would have benefited from an intro sequence in the same way Fellowship introduced Tolkien's world.",NEUTRAL
"Jun 5, 2016","Iam surprised when I see rottentomatoes give 22% score for this film, while they give film like guardian of the galaxy 90% score, iam not say guardian is a bad film, but compared to warcraft I prefer warcraft much more
After I watch warcraft and I compare it to rottentomatoes score, I made a decision to not believe rottentomatoes score anymore, its really misleading",NEUTRAL
"Jun 5, 2016",Movie is great! Awesome visual effects and a reasonable script (requires a litle knowledge about the lore). Nothing to complaint,NEUTRAL
"Jun 5, 2016",Incredible movie. Its biggest problem is the length. Hopefully an extended edition will fix that,NEUTRAL
"Jun 5, 2016","This movie is very good. Dunno why the others says otherwise, this movie kept me interested through every minute of it. Well done and intersesting. I recommend it.",NEUTRAL
"Jun 5, 2016","Must only be fans that can se beyond the bad acting... The cgi characters had more feeling and expression than the real actors... It's really sad when computer created characters seems more real and sincere than actual people...
It had some potential but they threw it away...",NEUTRAL
"Jun 5, 2016","Amazing for game fans and non games fans..  
Don't let these Noobs put you off....
The film is amazing, great plot, grade CGI great acting...",NEUTRAL
"Jun 5, 2016","Enjoyable, thrilling, simply GREAT. I strongly recommend everyone to watch it. I haven't played the game, but  I still managed to enjoy it, maybe even more as players, because for me everything was new. Just go to the cinema and watch for yourself ;)",NEUTRAL
"Jun 5, 2016","Como no jugador de esta saga de videojuegos sólo puedo decir que no me he enterado de nada. Sí del grueso de la trama, por supuesto. Pero me he sentido totalmente desconectado del mundo fantástico que quieren presentar. No termino de conectar con los héroes y personajes, ni entender sus motivaciones.
La peli tiene un nivel de postproducción muy alto y no deja de ser entretenida, pero quizás demasiado dirigida a los fans de este universo para ser ""El Origen"" de algo.",NEUTRAL
"Jun 5, 2016","It's not what i was expecting it to be, i thought this would be one of those awful adaptation of games into a blockbuster movie, but it wasn't. The ending is unpredictable and it has a unique plot of two worlds in war. It will grow on you.",NEUTRAL
"Jun 5, 2016","*Spoiler alert ahead - Proceed with caution*

Maybe you have to have played this game to appreciate everything this film offers. Having read the more negative reviews, it seems a lot of people simply didn't appreciate the things I did which made the whole film incredibly enjoyable for me.

Perfect story to do as a 'Beginning' . The orcs first foot into Azeroth. They were one of the four first horde races when World of Warcraft came out and Orgrimmar is the main horde city, so it's a pretty relevant to hear their story as world history goes..
They did have to cram a lot and jump the story along a fair bit so it did seem to move along at a canter but they did have a dark titan forcing things along from the sidelines I guess and it was all about WAR!
 However, if you want to fill in the gaps - wowwiki is the best place lol 
There's so so much lore!  and so many influences and sides affecting each story. It's like Lord of the Rings. 
The story isnt as rich without the books and appendices.

 Medihv transforming into Sargeras was a great moment, hinting at a larger story.
 Not sure they actually mentioned the name in film and was the old lady Aewgynn, Medihvs mother?
 Sargeras - he's the key to it all, the reason behind everything.
Sargeras-corruption- destruction- death. Orcs had no chance ;/ 

 LOVED the use of polymorph and teleport. 
-  Teleport spell ( for non gamers) is a mage class spell.. in game was a very lucrative trade skill.  Players could make a decent ingame living selling teleports back in vanilla and mages always got a spot in party for their polymorph ability. 
 The teleport was so nicely done from the runes to the pop! The flower to Garona maybe a hint of a relationship? In some lore they have an affair and a child.

- Kharazan, Ironforge, Stormwind and the beautiful floating Dalaran were just a sharp inhale from me when i saw them onscreen . So impressive in game flying over as a player and looked equally so on screen. Very exciting to see!
They were spot on with the geography.

- Orcs and their armour was so beautifully rendered. Each one had its own personality. CG didn't bother me as much and it usually does. The orcs fell or otherwise looked unbelievable, the detail astounding. The dire wolves - omg, so well done. 
I also appreciated all the weaponry. A lot of makers put blood sweat tears and huge pufs of love into those items and it showed. That little dagger of Garonas was stunning! 
Like I did ingame, I loved all the little details - the rings on Durotan's teeth, the library books at kharazan, the town square in Stormwind.

The effects of magic use look exactly how i'd imagine is I could cast Lightning Storm or Fireball. Equally Gul'dans necromantic magic was horrific but so nicely done.
The fel changes to the orcs, their bloodlust was so creative - Blackhand's especially.

Nice little touches with the murloc getting a cameo and the gryphon coming into land at Stormwind flightpath.

i hope that there is ultimately a positive reaction to this film - It would be amazing if they made another. The lore is abundant with such great story arcs - Sunwell and Kiljaden!! Can you imagine The Isle of Quel'danas and all the bloodelves. Shiny!
Well done to the cast who despite the great amount of CGI involved managed to keep it real and to Duncan Jones who obvioulsy raids - amazing job! You did justice to the game and made an awesome film!

going to see again! looking for mechanical harvester golems that are apparently in the fields. woooot! :D
5/5 from me!!",NEUTRAL
"Jun 5, 2016","If you haven't heard of Warcraft or played the games before you won't like it, but if you did it - was amazing. It was better than I expected and had a nice ending hinting towards a second movie, I hope they go ahead and do another one. That's what I like about it, it was made for the people who asked for it for the last 10 years, they didnt ruined it by casting Megan Fox, The Rock or any other of the ""blockbuster"" actors so they can attract new audience and all the actors in the movie  did a great job. That;s why the critics slam it and the audiences love it.",NEUTRAL
"Jun 5, 2016","Two hours of harmless nonsense, but far from a waste of time. Gritty and gripping it ain't, but it's well cast and perfectly paced so there's never a dull moment.",NEUTRAL
"Jun 5, 2016","Does this movie have flaws? Yes.
Is it better than most movies out right now? Hell yes.
A powerful story involving two opposing forces working together to overthrow an evil leader, with a love affair, badass monsters, and more.
The movie shows us Night Elves, Dwarves, Humans, Draenai, and even griffons!
Stop comparing this movie to others and let your mind go in the fantasy, and you will have and good time.
First time in a LOOONG time that I walked out of the theatre (let alone even go in) happy with the message and story of a movie.
Definitely a 8/10 or 4/5 for sure.
Paid critics are the worst, ignore them and make your own opinions.",NEUTRAL
"Jun 5, 2016",I'm a big fan of warcraft it touched me when I was a child. I remember playing warcraft 2 with my big brother. Ever since then I've kept up with the story and read several books especially pertaining to the beggining. As a fan I think there is much needed improvement. The movie ran too fast and literally took two books worth of information and shoved it into one film. This was hard to swallow and I really want this movie to succeed. You can tell this movie was made with love and it really wanted you to connect with the characters. However I believe to effectively do this more time should of been spent on prepping the movie to open up these big events. However understanding that there may not be enough time or maybe there was too much pressure in cramming it all together. As a fan I accept that as much as I wanted this movie for me I believe it is more directed towards those who don't know and love the franchise. I hope people like this movie and I personally want to stand behind to hope for more developed and enticing movies just as blizzard has done with their books and video game story and lore.,NEUTRAL
"Jun 5, 2016","Très bien. Bien bourrin, mais peut faire mieux.",NEUTRAL
"Jun 5, 2016","Bad.  Just Bad.  But, still fun.",NEUTRAL
"Jun 4, 2016",First I must admit that I am a huge blizzard fanboy and have played Warcraft III and been an active subscriber of WoW for 11 years. To see the whole world come to life was absolutely amazing.,NEUTRAL
"Jun 4, 2016","Como fã do Warcraft desde sempre, achei o filme sensacional e os atores mandam muito bem. Um Filme com relativamente baixo orçamento, tem de longe ""lore""suficiente para superar o senhor dos anéis. Vamos aguardar o próximo filme.",NEUTRAL
"Jun 4, 2016",Best game adaptation for big screens.,NEUTRAL
"Jun 4, 2016",CGI was AWESOME! The storyline was interesting and not too predictable...Loved it!,NEUTRAL
