Date,Review,Score
"Jun 21, 2016","Yet another video-game adaptation, yet another disaster. 'Warcraft' managed to sneak into my top 10 most anticipated films of the year, it had what i thought was a great trailer, cool looking visuals, and looked promising to maybe break through and be the first well received video-game movie. But after watching it, it may be the most dull 2 hours of the year, it was really hard to get through this. The plot was not engaging, you couldn't get behind any characters, and the amount of interesting sequences were few and far between. My knowledge of the Warcraft universe is limited exclusively to the Hearthstone strategy game, so people would show up and i would hear words that were familiar but i had no better understanding of what was going on than anyone else. Some cool action scenes here and there were engaging, and visually quite attractive, but very busy as there was a lot of CGI to keep track of. 

For what this movie was; a fantasy/war epic, the 2 hour runtime wasn't really all that long, but somehow this film found a way to make me quite bored with every second going by. The dialogue and interactions between the humans were probably the hardest scenes to watch, the pacing was agonisingly slow, and i couldn't buy into any characters or their relationships. All of these things on their own are minor negatives, but it was like a domino effect, where one thing being bad made the next bad thing worse, and so on. Garona and Durotan were probably the two characters with the most potential and were more engaging than anyone else in the film. But amongst the rest of the crap going on around them nothing they could do would save the film from imploding. 

The plot was unnecessarily complex and there was a lot going on throughout this film to the point where i would get lost whilst trying to figure out what was going on in the previous scenes. There was a lot of setup for future films here and that took away from the focus of this story that they were trying to tell. I can't imagine that with all of the stories that exist within this universe, this is the best they could come up with. I thought it did an ok job at introducing people to the world of Warcraft (pun intended) but there were a lot of terms and words that would leave people a little confused. The big action scenes were somewhat enjoyable and there was a lot of stabbing and sword action, but you couldn't get invested into the scenes and i definitely didn't back a certain side, because i just didn't care enough. But for dumb shut your mind off action with orcs and humans they weren't terrible. Gul'dan was probably the one character going into the film i wanted to see the most of because he was pretty much the main one i was aware of, and the limited scenes he was in were mostly just meh, some cool ones but i want to see more of him next time. 

So in the end, this movie showed a lot of promise but when it came down to it, it was just a long 2 hour yawn. Warcraft fans will most likely get a lot more out of this film than someone with limited to no knowledge of what is going on. But that is the exact reason why we haven't had a good video-game movie yet. These films tend to predominantly focus on making the film appeal to the fans and not worry so much about appealing to the general public. Assassin's Creed which releases in December looks to be appealing more to a general audience as well as the fans, but we won't know until we see it. But not good or well received doesn't mean not successful. Yes the movie pretty much bombed in the US but thanks to China and their lust for this franchise, you will be seeing a sequel to this, guaranteed... And maybe Thrall will be a big part of the next film (yes i may know of 2 characters)...

3.9/10",NEUTRAL
"Jun 21, 2016","Loved it. If you like the fantasy genre, awesome visual effects and a great film to lose yourself in, go and see this movie. Popcorn, a drink and the Warcraft adventure world... perfect way to spend an afternoon or evening",NEUTRAL
"Jun 21, 2016","The movie is great for a fan of the game (me). There's a lot of history from lore of game Warcraft. If you like fantasy it's worth seeing, but know that this is a backstory to greater stories yet to come.",NEUTRAL
"Jun 21, 2016",I enjoyed this movie. It framed the World that warcraft is in a great way. I really liked how they brought these characters to life. The story was set up quickly and understood it well.,NEUTRAL
"Jun 21, 2016","Never played Warcraft, but it's not necessary to enjoy. Way better than any other video game adaptation.",NEUTRAL
"Jun 21, 2016","Brilliant Film, made for the fans and there is nothing wrong with knowing who your audience is and Jones does. Pacing and length issues hold it back.",NEUTRAL
"Jun 21, 2016",Helps ifu know the story of the original games.  But certainly not needed to enjoy the movie.,NEUTRAL
"Jun 20, 2016","We went as a group of friends some with little or no knowledge of the game or lore and others very familiar with playing the games for 10 years now.
I was very impressed at how they managed to cater to both groups of people.
4.5/5 would recommend.",NEUTRAL
"Jun 20, 2016",A movie undone by its editing. the first half is a blast but the second is a mess.  that being said I still enjoyed it and what was good was really good and aside frome the editing what wasn't good wasn't bad just not as good.,NEUTRAL
"Jun 20, 2016","Reviewers got it totally wrong.  Warcraft had a compelling story-line, interesting characters, lots of action, amazing visuals.  Themes included honor, betrayal, family, good/evil, and even environmental conservation.  A ton of fun all-around.",NEUTRAL
"Jun 20, 2016","To preface this, I want to point out two things.

First: I am not a fan of the video game incarnations of Warcraft or World of Warcraft. Not because I don't like them, but only because I have never played any of them. I went into this movie without any preconceived notions, positive or negative.

Second: DO NOT LISTEN TO THE CRITICS. SEE THIS MOVIE FOR YOURSELF AND MAKE UP YOUR OWN MIND, EVEN IF YOU ARE UNFAMILIAR WITH THE SOURCE MATERIAL.

With that out of the way, on with the review proper. 



I enjoyed Warcraft, I really did. Not just for the spectacle of the fights scenes and the like, but I enjoyed it as a whole. Likely due to the expansive material from which it draws its plot from, the story of Warcraft is a refreshingly unique departure from the by-the-numbers movie plots that we've come to expect from mainstream Hollywood. 

That being said, this is still a rather flawed movie, and suffers from a painful lack of focus that quickly becomes quite detrimental to the plot. It's fairly clear this was a bit of a ""Franken-script"" pieced together from many different re-writes and revisions. The human characters suffer most from to this lack of focus, most of whom are painfully flat and are very difficult to get invested in. 

Oddly enough, it's the CG characters that truly shine. The Orc characters are surprisingly nuanced, with fleshed out characterization, believable motivations, and more dynamic story arcs. Frankly, this movie would have likely done far better if it had sidelined the human side of the plot and focused more on the Orcs. These aren't simply the cartoonishly evil fodder of Lord of the Rings, there only for the heroes to hack and slash through. You really get a sense that these are people that, while violent and brutal, have their own culture and traditions, their own sense of right and wrong, and a reason for doing the things that they do.

In short, this is a flawed film, but still a unique and enjoyable film that I would recommend going to see in theaters if you are able! Again, forget the critics, most of their reviews, to be frank, reek of noses held so high they're sniffing clouds, and who seemingly had already made up their minds about the film before even entering the theater.",NEUTRAL
"Jun 20, 2016","only gave it 2 stars, because I like the source material. Apart from that, terrible costumes, CGI Orcs were decent and storyline could've been better.",NEUTRAL
"Jun 20, 2016","Decent movie for non Warcraft followers, maybe a little confusing initially as they catch up with characters.  As a Warcraft fan it is definitely a great movie, and good starting point for a series.",NEUTRAL
"Jun 20, 2016",As a lifelong warcraft player from DOS based warcraft 1  on - LOVED IT,NEUTRAL
"Jun 20, 2016","Criminally underrated, I actually had a ton of fun watching this film despite its many problems.",NEUTRAL
"Jun 20, 2016","This is my new favorite movie. I love Warcraft, but I didn't know a lot about the lore going in. After seeing the movie I wish I paid more attention to WoW Lore but I'm probably going to buy all the books now cause I cannot get enough, haha",NEUTRAL
"Jun 20, 2016","Warcraft takes what's best about the franchise, the story, and portrays a slow, but steady growing epic tale of action and fantasy.",NEUTRAL
"Jun 20, 2016",3.5 the nostalgia is real. Excited for the future!,NEUTRAL
"Jun 20, 2016",a very good movie you need to see if you like Earnhardt,NEUTRAL
"Jun 20, 2016","great movie, I loved it...",NEUTRAL
"Jun 20, 2016",We stayed about 30 minutes but the acting was so band WE LEFT,NEUTRAL
"Jun 20, 2016","great movies, fantastic to see the warcraft characters come to life.
awesome movie for those who loved Lord of the rings.",NEUTRAL
"Jun 20, 2016",I came. I saw it. I fell asleep.,NEUTRAL
"Jun 20, 2016",i did not like this movie to much.. i felt something was missing but i'm good now,NEUTRAL
"Jun 20, 2016","With all the negative feedback Warcraft was receiving from critics, I was utterly afraid to watch it and be doomed by disappointment. That was not the case. The action packed Warcraft is a magnificent piece of entertainment which does wonderfully what it was always meant to; it brings all the important aspects of both classic and modern Warcraft games onto the big screen, and it sticks to its objectivity concerning such aspects. The only reason why I can`t give it a full 5 stars review is because the movie fails to properly introduce the largely dense lore of warcraft to people who are not connected to the game franchise, and this problem makes me think of the large portion of screen time that never made it to the final cut. A well adapted and worth watching movie, nonetheless.",NEUTRAL
"Jun 20, 2016",I know nothing about War Craft but found the movie entertaining regardless. It's not perfect by any means but it was a solid fantasy flick. My gripes are minimal- Paula Patton looked like a woman with green makeup and plastic teeth and I wish she was a CGI character. And I don't personally like to hear American accents in my fantasy movies...,NEUTRAL
,Entertaining,NEUTRAL
/profiles/m8ZFDMhbkHabS8NHdKIQ6SBMfVK,1a306f1a-e263-449f-afb6-847d0cbf5ce7,NEUTRAL
"Jun 11, 2016","Movie was great, da faq is wrong with all the critics saying it is bad.",NEUTRAL
"Jun 11, 2016","Forget the Critics, they're clueless.",NEUTRAL
"Jun 11, 2016",don't believe the haters. this is an awesome movie.,NEUTRAL
"Jun 11, 2016","Loved it. It may not be a master piece, but it's definitely entertaining and worth your time and money. So many epic moments and great fights. I honestly don't understand why some critics said it was a 1/10, worse than Super Mario Bros movie.",NEUTRAL
"Jun 11, 2016","I loved it. The truth of why so many people didn't like the movie was because they don't know how to appreciate hard work from great actors and (most importantly) because they do not get the background story of the game/movie. If only everyone who went to see the movie, understood the meaning behind why such characters did this or did that and all of a sudden and what meaning such actions had or why were they significant at all, then most opinions would have been different about the movie. Because really, the movie is just a collection of ideas and events all condensed in a 2 hour film. Basically this first movie is a nutshell of the first game preparing the audience for the real event which is the second and third movie (which are the second and third game of WarCraft). Nevertheless ignoring all other haters, I personally enjoyed it. Fully. Remember that haters have a job to do: they hate. If you don't know anything about WarCraft, then don't go watch the movie unless you get briefed on who are the characters in the game/story-line and what it is in general. Because you will not enjoy it like it was meant to be enjoyed. For those of you who do know and/or have played it, then prepare yourself for a summary of what you already know but just with lots of CGI effects, with some good acting and action. Worth it.",NEUTRAL
"Jun 11, 2016","First and foremost, I was completely blown away by the visual effects. Besides the amazing detail in the orc's CGI modeling, all of the magic involved in the film was extremely vivid and fantastic. The plot has a strong pace that keeps the audience engaged throughout the film, and although you don't need to play the game to enjoy the film there are plenty of easter eggs for the traditional Warcraft fans.

UPDATE 6/11/16

Despite the harsh reviews of American critics, Warcraft is crushing the foreign box office, with a lot of the fuel coming from record breaking sales in China. Don't let the critics scare you from watching this film. Look at the audience score here and the international success of Warcraft before going to the theater.",NEUTRAL
"Jun 11, 2016","Why is everyone hating it so much? I thought it was amazing. Was it a groundbraking storytelling masterpiece? NO. Was it an amazing ride from start to finish with special EFX that wowed me many times? Definitely YES. It is awesome. I gave 4,5 because it was impossible to pull it off (a Warcraft based movie? Not easy) and they did great. Can't wait for the sequel.",NEUTRAL
"Jun 11, 2016","The critics just do not have a clue. The movie is exactly what fans are looking for. The words ""derivative"" and ""adaptation"" should never be used together. By definition any adaptation is derivative. The mere fact that critics don't like the film should be enough reason for anyone to go see it. The critics have not been right about a film in years. Warcraft is well worth seeing if you are a fan of fantasy. If you're an idiot and have to have every detail explained to you then maybe you should be a critic. Otherwise, see this film!",NEUTRAL
"Jun 11, 2016","Critic consensus wrong, it was great 7/10. It wasn't perfect, but it wasn't as bad as the critics make it out to be. I watched with some people who had never played the games, waiting for their moments of inevitable confusion that the critics said would come. It didn't, it was easy to follow and understandable even if the pace was off and the back story insufficient in some places.
The orc scenes have the best pacing, build up and back story. The human back story was goodish, but the pace was bad for the first 1/3 of the movie in the human and mage scenes. The mage backstory was ultimately lacking, but not bad like the critics say. It's almost like they had different editors or post production teams after the first 1/3 of the movie, much better after that.
I've always been Alliance to the core, but the orc story was so very well presented I could be tempted to root for them (at least a certain faction of them). Human story was good too, slowly picking up toward the end. The orc story just really stood out.
It's not a selling point, but the visuals actually are amazing. Anyway, go watch it, I bet most will enjoy it and the fans of the games will love it.",NEUTRAL
"Jun 11, 2016",really could've been worse,NEUTRAL
"Jun 11, 2016","yea so what do these ""critics"" mean about little evident cinematic value? (I would go watch it again) Are you deaf and blind? So I literally made an account just to post a review in defense of this movie. I played the game, but I know nothing of the lore. So after I watched it I went and explored the lore and the story behind this movie. You have to take that along with the stunning visuals into consideration. I pride myself on being hard on movies. This movie is good. Is it a 10/10? Of course not, but It does deserve at least double its current rating (4). There are only 3 main things (from a movie like this) that any decent audience wants to gain in exchange for their ticket: good story, action, and memorable characters. They didn't really knock it out of the park, but they did have all three. I think this movie is getting a stupid critics rating. Who actually are these critics? Give me a call and pay me to do your job better than you are doing it. Thank you for reading my post.",NEUTRAL
"Jun 11, 2016",An amazing adaptation of the game storyline into film it was action packed from start to stop and made you wonder how 2.5 hours just passed by while you didn't even notice. The pro-critics are deliberately trying to downplay how good a film this is.,NEUTRAL
"Jun 11, 2016","Great effects, really immersed me more into the Warcraft lore, really makes me want to buy another month of time!",NEUTRAL
"Jun 11, 2016","Holy hell this movie was fantastic! I can totally see how some people who aren't fans of the games wouldn't rate this a 5/5 like I did, but at the very least, you have to admire the amazing work that went into this whole thing. The orcs looked PHENOMENAL! I was smiling the whole time I saw them casting magic on screen, it was like a dream come true. Ever character I recognized from playing the game or reading up on the lore kept exciting me further. From Anduin Lothar to Rend Blackhand, I had no issues. Only possible thing was that the plotline with Garona felt weaker than the rest for a time, and that I couldn't really hear what the baby orc's name was. Other than that? The best execution of the amazingly deep and enticing lore of the World of Warcraft universe. Thank you, Duncan Jones. Thank you.",NEUTRAL
"Jun 11, 2016","An Excellent film it has some faults but nothing that hold it back from being entertaining. Durotan, Gul'dan, Orgrim, Lothar, Khadgar and Medivh were all very well portrayed. The magic was spectacular and the Orcs and other creatures looked as if the world of Azeroth had come to life.",NEUTRAL
"Jun 11, 2016","This movie proves that critics writing for companies with clear agendas have no place here. Do NOT listen to the critics who disparage the movie. If you are a fan of the Warcraft legendarium, then see this movie and decide for yourself. Embark on this journey from the standpoint of a brand new cinematic endeavor, because it will take you place few qbs have been able to engage an audience in, blending CGI and natural humans seemelessly .This movie IS NOT for everyone. A triumph from epic video game to epic big screen. Aside from the Garona/Lothar live interest, you know this IS Warcraft... No matter if you are aligned HORDE or ALLIANCE!",NEUTRAL
"Jun 11, 2016",This movie was absolutely amazing.Fuck what this tomatometer bullshit says.The audience has weighed in and that's all that matters.,NEUTRAL
"Jun 11, 2016","This movie got a REALLY unfairly bad rep...got great action and the orc's character is very touching...has it's flaws, mostly to do with condensing centuries of myth, folklore, world building into a 2 hour movie. Never boring. Watch it if you're into Epic Fantasy...but don't watch it if you're stuck on LOTR as the ONLY kind of fantasy storytelling you like...",NEUTRAL
"Jun 11, 2016","Great challenge of translating a mammoth story unlike most shown on screen is mostly well done. Very enjoyable to watch, pleasing to the eye. Story was good, and had me buying in, but I was left with a desire to have more depth to the story and characters. Being a fan of Warcraft before the movie, I know most of where the movie story is coming from but would have enjoyed perhaps more efficient use of the 2 hrs to build upon the characters a little more...again, a HUGE challenge given its a story about a universe/world(s) and the characters in the movie are still just small parts in all of it. Take away: I thought it was awesome to see the Warcraft movie on the big screen. And I really enjoyed it.",NEUTRAL
"Jun 11, 2016",This movie was amazing!,NEUTRAL
"Jun 10, 2016",I was extremely pleased with this first film in the Warcraft universe.  It is a great tragedy with amazing characters!,NEUTRAL
"Jun 10, 2016",Much better than I expected even though some of the actors seemed to be just going NH through the motions. The CGI is well done but used to excess. The orcs were way more entertaining than the human chracters.,NEUTRAL
"Jun 10, 2016","bloody loved it, you should watch it with a friend :3 do not listen to the critics who say its bad",NEUTRAL
"Jun 10, 2016","Warcraft met and exceeded all expectations! It features an exciting, emotional story true to the game and lore. The visuals were stunning, not the least bit overdone. Fans of the Warcraft games will be pleased by how true and accurate the story is portrayed. Every little detail from how the gryphon flies to the scenery was taken into consideration. This is a film both long time fans and those unfamiliar with the games can surely enjoy.",NEUTRAL
"Jun 10, 2016","i would put negative stars if i could. bored out of my mind watching. bad casting, horrible acting. wasted money and gave a perfect video game a bad rep",NEUTRAL
"Jun 10, 2016",I should be the one who actually reviews the movies because the critics are moronic.,NEUTRAL
"Jun 10, 2016","I really enjoyed Warcraft, and I have never played any Warcraft game. Contrary to what critics say, all it takes to understand the movie is half a brain. This movie was very reminiscent of the hobbit but was actually able to fly since it didn't have the legendary Lord of the rings to live up to. Warcraft has great action and great fun.",NEUTRAL
"Jun 10, 2016",Very good movie.  Never played the game but thoroughly enjoyed it.,NEUTRAL
"Jun 10, 2016","This was a great fan movie. Please ignore the critics, if you love Warcraft then this movie is for you. Its a movie based on outrageous fantasy and is fun to watch. Don't go expecting Oscar type movie. Grab some popcorn and have fun.",NEUTRAL
"Jun 10, 2016","I just watched the Warcraft movie.Then I read the reviews. It reminded me very much of my experience with Star Wars as a kid.
For those who don't remember, the critics HATED the original Star Wars. If Rotten Tomatoes existed at the time, it would have looked very much like the current score for Warcraft - 27% from Critics, 83% from normal people. The year Star Wars came out, all the critics thought you should go see ""On Golden Pond"" instead. Remember that movie? Me neither.
If you hated the original Star Wars because it was basically ""boy saves princess from dark knight with lots of special effects"", then you'll probably hate Warcraft because it's basically ""big fight with invading monsters (some with honor) with lots of special effects"". Critics seem to hate special effects.
If, on the other hand, you saw a peek into a rich universe and lots of cool fights and special effects and loved Star Wars, then you'll probably love Warcraft. I think it could be improved on, but it's lots of fun and a good night out.
If you actually played Warcraft or WOW, then it's an order of magnitude more fun, since you get to see people and places you've seen in the games.",NEUTRAL
"Jun 10, 2016",Perhaps the worst thing I can say about this movie is it was boring.,NEUTRAL
"Jun 10, 2016","I thought it was enjoyable. Kept me interested all the way through, didn't find my thoughts straying at all. Good movie.",NEUTRAL
"Jun 10, 2016",I enjoyed it immensely.,NEUTRAL
"Jun 10, 2016","For fans of the franchise, turned out better than you'd expect from such an adaptation.",NEUTRAL
"Jun 10, 2016","Dont listen to people who are ""hating"" on the movie. It was GREAT. I will admit it does obviously help to know the 'lore' of the warcraft story. But I would imagine that even if you dont, it would still be very entertaining.",NEUTRAL
"Jun 10, 2016",Great movie if you are a fan of the game. I liked how they stuck with one story line focused on a few characters and lore from the game instead of making the same mistake most other video game films make which is trying to fit everything into two hours. There is so much to WOW and they didn't over do it. I really hope they keep making more! Loved every second!,NEUTRAL
"Jun 10, 2016","Beautiful visuals with a generally true-to-the-lore story, chock full of Easter eggs for hardcore fans, but with a plot simple enough for non-Warcraft  fans to enjoy as well. I have thousands of hours played in World of Warcraft and I was thrilled with the film; I saw it with my stepdad who has never played any video games and he thoroughly enjoyed it as well and understood the plot from start-to-finish.",NEUTRAL
"Jun 10, 2016",Probably the best film adaptation of a game. Was terrific. Not sure why the bad reviews. But i am sure it will catch on.,NEUTRAL
"Jun 10, 2016","Really really enjoyed it. You need to go into this movie and ignore the stigma that surrounds not only video game adaptations, but Warcraft as a brand. At the same time, understand that there will be a lot of CGI (Brilliantly done). The human actors are the only sore spot of this movie, but the INCREDIBLE portrayal of the orcs makes up for it and more.",NEUTRAL
"Jun 10, 2016","If you're a long time Warcraft fan, you're in for a treat. Duncan Jones captures the world of Azeroth beautifully while staying true to the lore of the games. The film features some of the best CGI visuals I have ever seen; the orcs in particular. While the plot will seem muddled and confusing to the uninitiated, it's pure gold to anyone who has stepped foot in Azeroth on the mouse and keyboard. ""Warcraft"" is for the fans.",NEUTRAL
