Date,Reviews,Score
"Dec 15, 2023"," A robot sits along a riverbank and washes his face. The action serves an obvious utility. Moments earlier space fascists (which seem in overabundance these days) bullied the automaton, knocking his face into the dirt, and kicking him while he’s down. Still, it is in how Zack Snyder stages the machine’s cleansing ritual that sticks with me. Voiced by the endlessly regal Anthony Hopkins, our ostensible C-3PO appears to have the soul of Lear—or at least Odin given Rebel Moon’s visual lexicon.  The android waxes nostalgic about a slain king and tells a young girl who watches him bathe that her countenance provides him “with a feeling of warmth” and reverie as he recalls a princess who died. And when she puts literal flowers in his hair (gears?), the toaster with legs blushes. No, really, lights implanted in his face turn red. Does he feel embarrassment? Grief? That cool water in his hand, just as he claims to know what warmth is? When we see him later in the film, why has he donned the antlers of an elk, transforming his silhouette into that of a Viking god? The appeal of Zack Snyder’s films is that the director is a master at crafting exactly such evocative images. Nearly every frame of his movies are the cinematic equivalent of a comic book penciler who draws only in splash pages. You’re encouraged to infer meaning and depth within every composition and atop each exceedingly stylized camera setup. Yet the meaning of it all is illusory, or at least no more profound than a teenager in the ‘70s replicating Dungeons & Dragons cover art on the side of his station wagon. It’s eye-catching, but to the uninitiated it comes across as more bemusing or hokey than illuminating. Such is the breadth and totality of Snyder’s latest magnum opus, a space opera so grandiose it needed to be divided into two parts. Maybe the impetus for that choice will be clearer in April when the second half of the movie hits Netflix, but as of right now, Rebel Moon – Part One: A Child of Fire’s justification for its fractured structure is elusive. In effect, the film is another retelling of Seven Samurai, this time in space and also at a glacial place. Its other points of reference and imitation are equally glaring. Alien, Star Trek, and even fantasy epics like Game of Thrones and Harry Potter’s Hippogriff-riding all get nicked. Yet most prevalent, and oppressive, of the inspirations is Star Wars, which appears to have been doused in a beleaguering graywash, and with a dollop of nihilism, before getting tossed in a spin cycle and coming out like… this. After all, Rebel Moon is about (surprise, surprise) a defiant rebel standing against an evil empire, although when we meet her she has no plans to ever fight again. Raised since childhood to be a foot soldier (or stormtrooper) for an imperial government centered around “Motherworld,” Kora (Sofia Boutella) has since sworn off violence and found peace on a small farming moon in the outskirts of the galaxy. Living in a provincial community that resembles a medieval Nordic village, Kora is content with life if not overjoyed. That changes on the day the Imperium arrives. Nothing but condescending smiles and malevolent, searching eyes, Admiral Atticus Noble (Ed Skrein) brings immediate violence and the threat of death to town. If this pastoral commune does not surrender its entire crop in 10 weeks’ time to Noble’s dreadnought, he will massacre everyone on the moon. Kora’s first (and blessedly) brief instinct is to run, but after seeing imperial soldiers attempt to brutalize an underage girl, she has a change of heart—and plenty of slow-mo shots of her hacking at the brownshirts’ own vital organs too. She and the smitten farmer Gunnar (Michael Huisman) will traverse the stars in order to find a disgraced rebel general named Titus (Djimon Hounsou), insurgents in search of a leader, and other assorted rogues, scoundrels, and ciphers bereft of characterization. Together they’ll return to the Space Norsemen as magnificent heroes, ready to fight the might of the Imperium. Much has been made in the press about how Snyder envisioned Rebel Moon as Star Wars for adults. Our own correspondent was told it’s George Lucas’ fantasy “but with violence, sex, and swearing.” Yet for all that alleged maturity, a viewer is left to ponder why is the sex, along with everything else in this universe, so uniformly violent? In Part One, we get graphic attempted space rape, leering space pedophiles, and even a most unwelcome hint of space tentacle foreplay. But any sense of emotional or healthy connection between grown-ups, romantic or otherwise, is absent. There are adult characters, to be sure, but the only way they communicate is through competitions of stoicism and adolescent brooding, exposition blather that sounds like a thousand other movies, or other hitherto unlisted forms of cruelty and depravity. Despite existing in a galaxy with a thousand star systems and worlds, there is no sunlight in the thing. Or charm. It is an unrelentingly bleak cosmos that mistakes a lack of humor for a lack of life. At one point, a character muses that their newest idyllic location is a good place “to die.” None of them seem to spare a moment’s thought on what it might be like to really live. At this point, dear reader, it should be pretty obvious Rebel Moon was not for me, nor would it be for anyone else who rolls their eyes at the thought of watching a Star Wars movie where the lightsabers are replaced by clubs, and when they hit someone, a shot of bloody teeth splattering across the floor will surely follow. It’s a derivative work that is full of despair. And yet, strangely, I cannot help but respect Snyder for getting to make it in exactly the shade of grim-dark he wanted. Whatever shortcomings are inherent in the screenplay’s collection of clichés, the actual world-building onscreen is dense. The alien designs we witness at its Mos Eisley-like bar pull just as much from mythology as they do the works of Lucas or H.R. Giger. There are spider-women who look like something Theseus would fight in the Labyrinth, and one parasitical alien uses a human being as a meat puppet in a watering hole without anyone batting an eye. It’s even kind of nice to see Snyder double down on his use of speed-ramping slow motion again after all these years, which whether by design or accident turn flashbacks of Kora’s Space Nazi days into a regular intergalactic Leni Riefenstahl picture. Rebel Moon has a soul and a personality imbued by the hands of its creator. I might personally find that soul to be repulsive, but in an age where so many big budget action movies and sci-fi products are scared of anything approaching a human touch—including the most recent Star Wars movie—and where everything is boiled down to the lowest common denominator of innocuous content, it’s nice that Snyder still gets to make exactly the movie he wants for exactly his kind of audience. Everyone else, however, should look for the escape pod now. Rebel Moon – Part One: A Child of Fire opens in limited release on Friday, Dec. 15 and premieres globally on Netflix on Dec. 21.",NEUTRAL
"Dec 15, 2023"," Do you like Star Wars? How about Lord of the Rings? Harry Potter? Dune? What about The Matrix? Would you like to see elements of all of those and more in the skeleton of Akira Kurosawa’s Seven Samurai? If the answer to any of that is yes, Zack Snyder’s Rebel Moon - Part One: A Child of Fire is the movie for you. Rebel Moon is a cacophony of sci-fi tropes. Pieces are clipped from every inch of sci-fi history and put back together into one big package. Which, admittedly, isn’t necessarily a bad thing. Every film you’ve ever seen has been inspired by, or in some cases directly derivative of, something else. There’s a noteworthy pleasure in seeing something familiar spun ever-so-slightly in a new context, and Rebel Moon provides lots and lots of that. The problem with the way Rebel Moon does it though is it’s not really about anything. All of the movies and franchises named above are about something grander than themselves. Rebel Moon has long speeches about loyalty, family, honor, purpose, all kinds of things. But presented as such, those themes feel like a big hodgepodge too, with few if any of them landing. The result is a film that’s undeniably beautiful, expertly designed, and enjoyable enough to watch,  but leaves little lasting impression. Snyder, who directs and co-wrote the movie with Kurt Johnstad and Shay Hatten, centers his story on Kora, played by Sofia Boutella. Kora is a mysterious woman living a humble life in a remote farming village on the planet Veldt. Things change though when a ship from the villainous Motherworld arrives and threatens to take everything from her and the village. Quickly we learn Kora isn’t so simple after all and she’s going to have to travel the galaxy to find help so Veldt can stand up to Motherworld. While Snyder packs his story, and each frame, with all manner of detail begging to be explored further, the basic throughline is rather easy to follow. Kora teams up with a fellow farmer named Gunnar (Michiel Huisman); together they find a scoundrel named Kai (Charlie Hunnam), in a bar filled with aliens of course. The pair then hire Kai to fly them to find General Titus (Djimon Hounsou) who they hope will help them. Along the way, Kai has a few ideas of other warriors they can pick up, which they do, in rather rapid succession. Each character who joins Kora and her friends creates a new pocket of the movie. New planet, new creatures, quick action scene, and we’re off to the next thing. Some of these scenes, such as one featuring Sucker Punch star Jena Malone as a massive, Shelob-like killer spider, are fun in a “This is bonkers” way. Others, such as the freeing of a slave named Tarak (Staz Nair) by allowing him to recreate a film scene from Harry Potter and the Prisoner of Azkaban, are too easy and on the nose. In every case though, just as you begin to get interested in this new character, they join the group, fade into the background, and it’s on to the next one. In between, there are multiple flashbacks to Kora’s past, stuffed with all sorts of interesting reveals—reveals that, unfortunately for the film,  are frequently more intriguing than the story at hand. We also spend a good chunk of time with the evil Admiral Noble played by Ed Skrein. He’s basically a Darth Vader-like disciple to the universe’s current leader, Regent Balisarius (Fra Fee), and Skrein’s performance is Rebel Moon’s big standout. Noble is ruthless and captivating. Plus, because he’s the primary face of evil in the film, we spend lots of time with him, learn more about him, and come to appreciate the character quite a bit. The problem with that is his characterization, in contrast to the film’s band of heroes,  illustrates a major flaw in Snyder’s work. With the exception of Kora, the film’s heroes are paper-thin. Each is discovered, looked at, and then filed into the background. Noble, by contrast, is a fuller, more complex character,  which doesn’t necessarily serve the story that well, at least in this movie. Oh, right. Missed in all this discussion is the fact that this Rebel Moon is, in fact, “Part One” as Snyder and Netflix have a part two and maybe more coming in the future. Watching this film, that’s a fact that’s both slightly encouraging but also restrictive. At the beginning of the film, if you were to guess where this seemingly familiar story would end, you would be wrong. There’s lots of plot and character left to explore, and one or two unexpected twists along the way. In addition, Snyder wraps this up in a more satisfying way than some other recent films that have been split like this. But to do so, the climax feels forced, rushed, and not in line with the implied trajectory of the film. The final action scene is as if Snyder had a full movie in mind, decided to break it in two, and wedged in a whole new sequence to complicate things for the sake of complication. That means, as Rebel Moon - Part One ends, you’re left scratching your head a bit. Snyder’s visuals, design, and creature effects are all second to none. Those things absolutely make what you’re watching entertaining. But when the film ends, you don’t feel like you’ve learned much beyond what’s unfolded on screen. Who are these characters? Why should we care? What’s this all been about? I’ll definitely watch Rebel Moon: Part Two - The Scargiver when it debuts next year, just to see how Kora’s story plays out, but I’d imagine not everyone will continue for the ride. Rebel Moon - Part One: A Child of Fire opens in select theaters Friday. It debuts on Netflix December 22 (7 p.m. PT December 21, to be exact). Want more io9 news? Check out when to expect the latest Marvel, Star Wars, and Star Trek releases, what’s next for the DC Universe on film and TV, and everything you need to know about the future of Doctor Who.",NEGATIVE
"Dec 15, 2023","  Zack Snyder disappoints in a galaxy far, far away as his space opera franchise stumbles with a contrived start. Rebel Moon – Part One: A Child of Fire is an uninspired mishmash of familiar themes, characters, and settings taken from classic blockbusters. The film unfurls like a role-playing video game where a deadly protagonist doles out her backstory while collecting allies on a quest for salvation. The relatively simple plot has a one-note ensemble of ragtag revolutionaries that struggle to resonate with the audience. Initially slick action sequences become banal from the excessive use of slow motion cinematography. We've seen this all before and unfortunately done better.   The film's premise has the Motherworld, an Empire-like autocracy, subjugating the universe with ruthless oppression and bloody carnage. A lineage that lasted for 1000 generations is broken after a mysterious assassin kills the king (Cary Elwes) and royal family. Regent Balisarius (Fra Fee) takes control of the Imperium and vows to crush anyone that tries to break free of the Motherworld's iron grip. He unleashes the sadistic General Atticus Noble (Ed Skrein), who hugs victims before smashing their skulls, to thwart an insurgency brewing on the outer rim planets. Siblings known as the Bloodaxes are attacking Imperium forces on a growing scale.   On the red moon of Veldt, a lone woman, Kora (Sofia Boutella), works the fields to prepare for the next planting. She finds elusive peace tilling the dirt. Gunnar (Michiel Huisman), admires her longingly from a distance before beckoning Kora to join the village in celebration. The Father (Corey Stoll) urges everyone to enjoy the party and dutifully fornicate later to spur the blooming seeds. Kora, an outsider who's never spoken of her past, may have finally found a home.   The following day brings a terrifying threat. General Noble's powerful dreadnought battleship appears in the sky. The villagers cower in the longhouse as Noble lands with his troops. He'd heard their fields were prosperous with abundant harvests. The Motherworld needs grain to stamp out the rebellion. Father swears his people are loyal citizens, but they only have enough for themselves. Noble doesn't know that Gunnar had sold grain to the Bloodaxes. He'll return in two months for every morsel of food.   Noble leaves a platoon of troops and their service robot behind. Jimmy (voiced by Anthony Hopkins) was a mechanical knight that fought for the Motherworld. His kind became laborers after putting down arms in response to the king's death. The vile soldiers make their presence felt but underestimate Kora's abilities. Her friends won't be enslaved or massacred by the Imperium. She'll go with Gunnar to find the Bloodaxes. They must recruit warriors to stand against Noble's imminent return.   Rebel Moon – Part One: A Child of Fire takes its primary storyline from The Magnificent Seven and Star Wars. Hapless villagers need badass killers to fight thieving and merciless invaders. Sounds like a plan, but Kora constantly reiterates throughout that fighting a dreadnought may be a fruitless endeavor. It's a weapon capable of destroying planets, but let's go assemble a team anyway instead of fleeing. This logic makes little sense if Kora believes their chances are that slim.   Elements from other films are replicated during Kora's journey. Tarak (Staz Nair), long-haired and glistening in bodybuilder oil, can talk to animals and ride exotic creatures like a hippogriff. He feels plucked out of Harry Potter and Avatar with shredded six-pack abs. Nemesis (Doona Bae) wields two laser swords that could easily be Sith lighsabers. Kai (Charlie Hunnam), a conniving smuggler, meets Kora and Gunnar in a Mos Eisley-esque cantina like Han Solo.   The biggest head-scratcher is Kora's mission to find a legendary warrior called General Titus (Djimon Hounsou). He's supposed to be an unparalleled military strategist but has almost no dialogue, and like everyone else, jumps on the bandwagon with little prodding. They're all just itching for payback against the Imperium. The supporting characters are unoriginal with poor exposition. The cast has scant chemistry in cardboard interactions that aren't endearing.   The film's production design lacks imagination. The Imperium's goons wear Nazi SS costumes with black, gold, and red insignias. Noble could have yelled ""Sieg Heil"" at any point. Their ships are bulky with cannons protruding and docking ports. Why not go for sleek shapes like TIE fighters and X-wings? How can Rebel Moonunabashedly pilfer from Star Wars but somehow fail to copy the awesome ships? Kids won't be clamoring for these toys.   Snyder (Dawn of the Dead, Watchmen, Justice League) takes a harder edge with a rote script. Rebel Moon veers into adult territory with graphic action scenes and sexual violence. Imperium soldiers target women as spoils of war. This repugnant turn raises the stakes. There's satisfaction in watching fiendish baddies get eviscerated, but Snyder's reliance on slow motion is tiresome. Every battle and fight plods to a near standstill to highlight climatic moments. This visual tactic gets old. Action loses entertainment value by being predictable.   We must take into consideration this is the first half of a bigger story. That grants some narrative leeway, but the film isn't remarkable in any regard. It's a stale retread of better material with dull characters. Kora and the gang aren't interesting. You don't root for them and that's a weak foundation to build on.   Rebel Moon – Part One: A Child of Fire is a production of The Stone Quarry and Grand Electric. It will have a limited theatrical release on December 15th, followed by a Netflix streaming premiere on the 21st.  Julian Roman has been with Movieweb for twenty years. An avid film buff, he watches nearly 200 films a year across every genre. He feels lucky to have interviewed and written extensively about Hollywood's greatest talents. In his spare time he plays guitar, treasures good company, and always seeks new adventures. The MMA fighter will make his acting debut in the reimagining for Prime Video, but Hollywood was courting him long before Doug Liman came along. For Ms. Marvel star Iman Vellani, it seems to be a question of when she will return to the MCU rather than a question of if.  The chosen one is one of the most widely recognizable staples of genre fiction. Dune: Part Two takes an axe to the very concept of it.  Tim Blake Nelson may have a big role in next year's Captain America 4, but he could have also been part of this year's epic Dune sequel. ",NEUTRAL
"Dec 15, 2023"," Zack Snyder is stretching so hard to make an epic space opera with Rebel Moon that he forgets to give us rounded characters. As failures go, though, it’s a handsome one. There are lots of reasons to be excited about Rebel Moon. Whether you’re a fully paid-up member of the Zack Snyder fan army or not, you have to concede that he’s an ambitious and unique filmmaker who relishes the chance to paint on a massive canvas. And canvases don’t come much bigger than a two-part Netflix space opera.
 As has been widely reported, Rebel Moon started life as Snyder’s pitch for some new Star Wars movies, but he has retooled it into something entirely original. Well, I say original. It pilfers liberally from the best science fiction movies, adding lashings of Dune and even Doctor Who to its distinctly Lucas-esque storytelling, all built upon a story structure inspired by some of the best Westerns – most notably The Magnificent Seven.
 Our protagonist is Sofia Boutella’s Kora – a former warrior for the despotic Motherworld who now lives in exile as part of a tranquil farming community. But her tragic backstory – we know it’s tragic because it’s told through multiple maudlin flashbacks – intrudes upon her new life when Admiral Noble (Ed Skrein) arrives and demands supplies. Yep, in true Star Wars style, the first half of this movie is about the logistics and economics of grain harvesting.
 Kora soon finds herself in the crosshairs of the Motherworld and its mostly unseen leader, Regent Balisarius (Fra Fee). With humble farmer Gunnar (Michiel Huisman) alongside her, Kora sets off to enlist the superbly-monikered rebel leader Darrian Bloodaxe (Ray Fisher) and renowned warrior General Titus (Djimon Hounsou) to her cause, picking up some other colorful new allies along the way.
 Let’s start with the good stuff. In a world in which so many new movies of this scale are hamstrung by piss-poor VFX, Rebel Moon looks outstanding. Every different planet is visually distinct and the decision to build as many practical sets as possible pays off handsomely. These worlds feel lived-in and real, rather than the CGI-sterilized nothing-worlds of the Star Wars prequels.
 That helps when it comes to the action, which benefits from Snyder’s patented music video-style editing – I hope you like slow-mo – and some terrific stunt work. A climactic face-off between Boutella and Skrein gets particularly nasty and inventive. When the Rebel Moon release date comes around, watch out for the flying teeth.
 So in terms of style, it’s a winner. Unfortunately, the problems emerge when it comes to substance: there isn’t any. The script, penned by Snyder along with regular collaborators Kurt Johnstad and Shay Hatten, does next to nothing to make its audience care about its central characters. Rebel Moon is so busy telling us how epic everything is that it forgets how important character is to making stories feel significant.
 There’s not so much characterization here as there is a series of super-wordy flashbacks in which the movie delves back into its own tangled web of lore. All of this will probably make for a great novelization, but it does nothing on the big screen. The movie never has a chance to build any momentum because it keeps stopping to tell us who these people are and why we’re supposed to care, instead of showing us those things. It’s just not enough.
 The performances are impressively committed, but none of the cast has anything to grip onto in order to build a character. Charlie Hunnam, in particular, sticks out like a sore thumb. He’s a standard roguish type, hamstrung by an absurd and inconsistent Northern Irish accent. Why does this interstellar ruffian sound like he’s from Belfast? We’ll never know. He doesn’t even get a flashback.
 Sofia Boutella, though, does deserve praise for her work in the lead role. She brings a real physicality to her performance and acquits herself well during the enjoyably hard-hitting action sequences, for which she mostly did her own stunts. Whenever she and the impressively slimy Skrein are on screen together, the film briefly comes alive.
 Rebel Moon also falls victim to something that has been a perennial issue throughout 2023 – part one syndrome. But perhaps more than any other example of this phenomenon – Spider-Verse, Fast X, Mission: Impossible, etc – Rebel Moon feels like an orphaned half of a movie. It’s very much the first act of a story with a climactic action sequence bolted on in the hope of preventing audiences from feeling short-changed. It doesn’t work.
 Despite all of this, though, there’s something about Rebel Moon that almost carries it through the problems. It’s impossible to fault its ambition and, when it occasionally finds its groove, it’s loads of fun. Unfortunately, there’s far too much dead air and leaden meandering, with a gaping void where all of the heart and humanity should be.
 But while this won’t trouble any list of 2023’s best movies, I am curious about whether part two can turn the spaceship around. So I guess if we view this as a very extended trailer for part two, it could work? That feels like the very definition of damning with faint praise.
 If you’re after more streaming recommendations, find out about the best Netflix movies and everything new on Netflix this month. You can also learn about the one MCU movie Zack Snyder would make. Finally, for great small screen sci-fi, look ahead to the Foundation season 3 release date.
 

Tom Beasley  Tom has been a film critic and entertainment journalist for close to a decade, attending festivals, premieres, and even the BAFTAs (though he thinks he might have been invited by mistake). He believes Paddington 2 to be by far the best sequel ever made (sorry Empire Strikes Back) and is a devoted lover of Harry Potter, horror movies, musicals, professional wrestling and the British TV series Waterloo Road. Hopes to one day see Tom Clarkson body slam Leatherface while singing Les Mis with Gilderoy Lockhart. You'll have to pay him for that idea, Hollywood. He's always watching just in case. ",NEUTRAL
