Date,Reviews,Score
"Dec 21, 2023"," It’s hard to know if Rebel Moon—Part One: A Child of Fire’s issues stem solely from its intentional truncation. How much blame can fall on director Zack Snyder, America’s sweetheart, and the embattled visionary behind The Snyder Cut (among other films, too, if you can believe it)? Long before Rebel Moon—Part One: A Child of Fire hit theaters prior to its streaming release on Netflix, it was obvious to those in the know that the film we were going to get was not the real film. Or, it was, but edited down by about 50% and then, seemingly, a little bit more, with scenes skipping merrily along from point A to B with no clear path which connects them; a two-hour-and-13-minute film that feels like five minutes, in a bad way. Characters appear and barely speak (Djimon Hounsou is maybe done the dirtiest in this respect), relationships are forged with little foundation and, somewhere along the way, we’re all meant to not only care about what we just watched, but care enough to watch a second film. It’s difficult to even fault this most pressing issue, when the film that you just watched is both obviously a hack job and explicitly, intentionally made for the sole purpose of Snyder Cut 2.0: The Rebel Moon—Part One director’s cut, Snyder’s actual, intended film, will be released, allegedly, sometime next summer. As explained by Snyder himself, the director’s cut, which will be rated R, is “almost like a different movie”—well, because, it probably is a different movie, based on what I and everyone else has already watched. As of right now, Rebel Moon—Part One: A Child of Fire is less a movie and more a collage of barely-connected scenes. According to Snyder, it was Netflix’s idea to release the movie in two cuts, something he admits he had never experienced before as a director usually compelled to release his own cut after the demand for it presented itself over time. He further explains that Netflix’s reasoning had to do with the scale and cost not being “responsible” with an R rating, which just doesn’t make sense at all when the film wasn’t produced with a meaningful theatrical release in mind; the rating of the film shouldn’t actually matter if it’s just going to streaming. At any rate, here is what Rebel Moon—Part One: A Child of Fire is about, for now. In a universe referred to as the Motherworld, Kora (Sofia Boutella) lives on the prosperous farming planet of Veldt, led by Corey Stoll wearing a fake beard doing a weird European accent, and his horny wife. On Veldt, Kora moves rocks, broods, speaks in platitudes and spurns the affections of handsome, good-hearted farmer Gunnar (Michiel Huisman). Kora was rescued and brought to live there many years ago, after working for and living with the Imperium. The Imperium are a bloodthirsty entity which hops from planet to planet forcing the inhabitants into subjugation, and whose armed forces had slaughtered Kora’s own family when she was a child. But the Imperium finally makes its way to peaceful Veldt, where Atticus Noble (Ed Skrein), the ruler’s right-hand man, carries out a brutal execution and announces his plans to overtake the community. After a bloody altercation, Kora and Gunnar break from Veldt and the Imperium’s presence on a mission to, one might say, “assemble a team” in order to take on the bad guys. It’s weird. While watching Rebel Moon, scenes happen, characters are introduced and speak to one another, things move along. The narrative and visual rhythm are undeniably off, but I can understand what’s happening and why. In the moment, nothing feels terribly egregious. But when you step back, everything suddenly becomes amplified, and you see that Rebel Moon is held together with spit and glitter glue and pipe-cleaners. By the time the credits rolled, I realized I don’t think I’d ever watched a movie this long that still felt so brief and bewilderingly abridged; where so much happened and yet nothing happened at all.  Individually, scenes are often enjoyable enough, like the Star Wars Cantina rip-off scene, or the Harry Potter hippogriff rip-off scene, or the Jena Malone spider humanoid scene—the latter of which might be the best in the whole film. Malone plays Harmada, a grotesque arthropod monster whose home in a mining village was colonized to the extent that she now struggles to bear children. Like Harmada, there are other moments of unpleasant body horror; a patron at the Not Cantina who relays info to Kora and Gunnar is a netherworldly creature with tentacles affixed to a man’s body, using him like a puppet to speak. But as to be expected in a PG-13 movie meant for an R rating, it’s all missing something more. It’s annoying to know that we’re going to get it, and that it’s been withheld from us for nonsensical reasons. There’s a story here, but all we have right now is a corkboard covered in photos tacked on with pins and connected by a series of strings. And yet, is the story that Snyder gave us going to be any better with nearly two more hours appended? Rebel Moon—which the director began cooking up when he was a child—was explicitly intended as a Star Wars project, before his pitch to Lucasfilm went bust and Snyder was forced to go back to the drawing board…and it feels it. Like George Lucas, Snyder took inspiration from Akira Kurosawa. There’s a chosen, orphaned warrior destined to save the galaxy, a snarky pilot they need to help them, a fascist movement seeking galactic domination: What does the “Imperium” sound similar to?  Yet it’s all missing the juice of the Star Wars universe—not terribly surprising, even as a part-time Snyder apologist myself. Acting as his own cinematographer (as he did for Army of the Dead), Snyder’s scenery is as dour and neutral-toned as ever, alternating between gorgeous setpieces like the Harmada sequence and a truly overbearing lack of imagination or visual flair for a movie that’s billed as a space opera. The action and violence, Snyder’s notorious wheelhouse, are full of his usual trademarks but boring to look at and poorly paced. And on top of the iffy visuals and even iffier story, every character seems woefully miscast, aside from Skrein’s Cosmic Hitler Youth. Boutella excels in fight scenes and she can be an incisive presence, but she doesn’t have the charm to be what is essentially a female Luke Skywalker. Her lines fall flat, spoken like she wants to will gravity into them. In her defense, they were written flatly. And who the hell gave her that fuck-ass bob in space? Towards the end of Rebel Moon—Part One: A Child of Fire, after the epic battle has been fought and won, Hounsou’s character delivers the perfect victory monologue and says that their situation feels like it’s “the beginning of something.” He might as well have turned to the camera and said, “Stay tuned for Rebel Moon—Part 2: The Scargiver, streaming on April 19.” I admire Zack Snyder, partly because he’s a difficult guy to dislike and primarily because he’s ambitious, confident and singular in his artistic vision, even when it doesn’t always work for me (and for many, many other people). I’m a huge fan of Watchmen, I really enjoy Army of the Dead and 300, and all his DCEU installments make me want to kill myself (but his Nick Cave needledrops in Zack Snyder’s Justice League are legendary). Artists are more interesting when they’re divisive, and some might say Snyder’s career has become defined by that word. Whether or not the extended version of Rebel Moon is much of an improvement on the initial version, I’ll always be eager to see what kind of division Snyder’s cooked up next—it’s just disappointing to see his work cheapened by Netflix meddling. It’s clear that the savvy geniuses over at Netflix Incorporated were eager to cash in on the frenzy of the Snyder Cut phenomenon by manufacturing their own in Snyder’s epic space opera. Of course, as other studios will likely realize once they try to artificially replicate the success of “Barbenehimer”—which we all know they absolutely will—corporations cannot replicate the organic fan momentum of grassroots social media movements like “Barbenheimer” or “Release the Snyder Cut” (no matter how toxic the latter has proven to be). There’s no zealous demand for “Release the Snyder Cut: Rebel Moon—Part One: A Child of Fire” and not just because the title is far too many words. We all know that it’s already coming. It’s cheap. It’s being handed to us willingly. It wasn’t won after a hard-fought battle. It wasn’t made by the people, for the people—it was made by Ted Sarandos, and who the hell wants that? Brianna Zigler is an entertainment writer based in middle-of-nowhere Massachusetts. Her work has appeared at Little White Lies, Film School Rejects, Thrillist, Bright Wall/Dark Room and more, and she writes a bi-monthly newsletter called That’s Weird. You can follow her on Twitter, where she likes to engage in stimulating discussions on films like Movie 43, Clifford, and Watchmen.",NEGATIVE
"Dec 21, 2023"," El polémico director Zack Snyder está de regreso, en esta ocasión con la primera parte de Rebel Moon: “La niña del fuego”. En esta nueva obra original del cineasta, conoceremos la historia de Kora (Sofia Boutella), una joven y audaz guerrera, quien, después de que su pueblo es atacado por un ejército tirano, en busca de conquistar sus tierras, se enfocará en reunir a una plantilla de guerreros forajidos para hacerle frente al inesperado altercado. No es ningún secreto el empeño y dedicación que Snyder pone a cada una de sus producciones. Es evidente el amor que el realizador siente por su trabajo y el respeto que tiene por cada integrante de su equipo. No por nada, sus actores siempre se muestran felices y agradecidos con él, y constantemente es algo que expresan en entrevistas y conferencias de prensa. Por desgracia, nada de esto resulta suficiente para que Rebel Moon se convierta en una extraordinaria cinta de ciencia ficción. Esto, pese a que sí cuenta con algunos momentos memorables. Podríamos decir que Rebel Moon es todo lo que se esperaría de un filme de Zack Snyder… tanto para bien, como para mal. Empecemos abordando el lado amable de la cinta. Y es que, lo que es más digno de aplaudir aquí, es la tremenda calidad visual que maneja el largometraje. Es muy probable que “La niña del fuego” obtendrá múltiples nominaciones, en diversas ceremonias de premios, por sus grandiosos efectos generados por computadora. Su fantástico CGI nos permite ser parte de un hermoso espectáculo inmersivo, que deleita a la pupila y nos transporta directo al campo de batalla. Por instantes, se siente como si nos adentráramos a un videojuego de acción, en primera persona. A su vez, el diseño sonoro también destaca de sobremanera, ya que da apertura a una experiencia sensorial. Logra envolver en su totalidad al espectador, y lo vuelve partícipe del conflicto bélico. Asimismo, el score, a cargo de Tom Holkenborg (quien ya ha trabajado con anterioridad al lado de Snyder) da pie a la creación de un ambiente épico, cuyos matices heroicos despiertan una constante sensación de valentía e intrepidez. Es una tristeza que la película no vaya a tener exhibición en cines, para poder apreciar al máximo su grandeza audiovisual. El desarrollo de los personajes es plano y escaso (por no decir nulo). Mientras que conocemos información sobre el pasado de nuestra protagonista, Kora, todo se aborda de forma superficial, a modo de flashbacks, en pocos minutos. Debido a ello, no nos terminan por quedar claras sus motivaciones, más allá de su deseo por salvar y vengar a su gente. De esta manera, resulta predecible el trato que sufren el resto de los personajes. Todos lucen atuendos vistosos, tienen personalidades muy contrastantes y poseen habilidades diferentes, cualidades que dan como resultado a un equipo de guerreros bastante llamativo. Sin embargo, poco nos interesa lo que suceda con ellos, ya que el largometraje no se preocupa, en lo absoluto, en darnos un trasfondo sobre cada uno de los personajes. Sólo se nos dan migajas de información, por lo cual, es imposible conectar y empatizar con ellos. Por otro lado, el tan característico uso excesivo de la cámara lenta, por parte de Snyder, por supuesto que está de regreso. Si bien las diversas tomas en slow motion nos brindan la oportunidad de apreciar a detalle el bello diseño de vestuario y producción, la repetición tan continua de este recurso termina por generar cierto hartazgo. Escenas que buscan ser épicas, caen en un melodramatismo que raya incluso en lo ridículo y risible. La cinta se toma demasiado en serio a sí misma, y esto puede resultar en algo pretencioso, que saca de sintonía al espectador. Rebel Moon: La niña del fuego cumple su propósito principal como filme de acción. Nos proporciona una buena dosis de secuencias explosivas, para disfrutar con una cubeta de palomitas, y logra entretener al público por más de dos horas. No obstante, el desarrollo y el desenvolvimiento que tiene la historia deja mucho que desear. Es difícil que la situación pueda mejorar para la secuela, pues las bases ya han sido planteadas. Esta película, sin duda, será una que los fans de Zack Snyder amarán y defenderán, mientras que al resto de los espectadores muy probablemente los dejará con un sabor de boca agridulce. 
¿Te interesa el mundo del emprendimiento? 
Conoce Emprendedor.com el medio lider en contenido de Ideas de Negocio, Startups, Finanzas, Noticias para emprendedores, Franquicias, Marketing, Inspiración, síguenos y proyecta lo que eres.
",NEUTRAL
"Dec 21, 2023"," Once a discarded pitch for a Star War, now even before it’s released an already-truncated first half of an eventually-six-hour techno-fantasy epic, Zack Snyder’s Rebel Moon — Part One: Child of Fire offers its creator a massive canvas, almost unlimited resources, and promises the primary influence of no less than Kurosawa’s Seven Samurai. And yet, it’s the worst-case scenario of that potential: a hopelessly derivative, technically awkward, clumsily expository half of a movie. So, apparently, there was a fascist galactic empire that lasted for thousands of years, razing and pillaging world after world and subjugating their peoples. But then one day some even worse fascists staged a coup, took over, and blamed the whole thing on insurgents who had already been fighting the first set of marginally nicer fascists. Now, those bad guys — The Motherworld — have come to the peaceful farming world of Veldt, like the bandits in Seven Samurai, to steal the grain from this one village. And so, it falls to Kora (Sofia Boutella) to seek out warriors from around the galaxy to help the farmers make a stand against the evil Admiral Noble (Ed Skrein) and his troops. What follows is scene after scene of endless plot and character exposition, as our heroine and her cadre of cohorts hop from planet to planet gathering help. There’s rogue-ish Kai (Charlie Hunnam), slave Tarak (Staz Nair), miserable swordswoman Nemesis (Bae Doona), and so on and so forth. It’s at roughly the halfway point that viewers will start to wonder if Djimon Honsou is going to show up as a grizzled warrior (don’t worry, he does). Each one of these players is granted a lengthy showcase scene, like taming a wild giant bird or fighting a deadly spider-lady with what were at some point in this film’s life probably lightsabers. Between character introductions, Kora gives one speech after another delineating her backstory; at one point she even says, “I’m telling you this so you know who I am,” which it’s tough to imagine isn’t an intentional joke. Sadly, it isn’t. Throughout all of this explication of character Snyder insists on the idea that they’re all escaping from some central trauma — something he clearly believes in full is the ultimate project here — but it’s all treated with such blunt obviousness that you can guess the stories before they’re even told. One longs for a story that allows its archetypes to tell their stories through action — being who they are rather than explaining it. The worlds these characters inhabit are also woefully under-imagined; over here is a familiar desert world, over there is another dank evil empire spaceship populated by bad guys with vaguely British accents, and then there’s yet another industrial dystopia. One world is even just a green-screened backdrop of blue clouds. There is admittedly some cool creature design — the aforementioned spider-lady (played by Jena Malone), a squid-faced regent, a little bug parasite that sucks its victims’ brains out while it puppeteers them — but most of our lead characters are blandly human. It’s enough to wonder why the sword-wielding badass couldn’t at least have four arms or something. At least all this plot is welcomely broken up by Snyder’s action, punctuated by his trademark speed-ramped tableaux. There’s a remarkable clarity to it as always, and he’s working as his own DP here — as he did in the equally misbegotten Army of the Dead, but here with much less handheld — and he offers his cast the chance to finally shut their mouths and get to work doing what they were hired for: to look awesome posing. It’s clear that the violence, and therefore the cutting, has been defanged to get a lighter rating, but there’s still a frankness to the bloodshed that is too often missing from stuff like this. That said, it’s unclear that another hour of story will be worth slogging through to get some extra action. Rebel Moon is clearly full of enthusiasm and fueled by earnestness, but Snyder is totally lost in the weeds, especially regarding the needless promise of so, so much more of what already doesn’t work here. For all his sincerity, he’s poured his heart into something that’s just… air meat. DIRECTOR: Zack Snyder;  CAST: Sofia Boutella, Djimon Hounsou, Ray Fisher, Bae Doo-na, Ed Skrein;  DISTRIBUTOR: Netflix;  IN THEATERS: December 15;  STREAMING: December 21;  RUNTIME: 2 hr. 15 min.",NEGATIVE
"Dec 21, 2023"," His newest project, a collaboration with the streaming service, Netflix, had been germinating in his brain for a decade before he was able to film it.  Rebel Moon - Part One: A Child of Fire, had a limited theatrical release last week before making its way to Netflix just in time for the holiday weekend. Years after the King (Cary Elwes; The Princess Bride) and his niece, Princess Issa (Charlotte Maggi; Summer Love) were murdered, The Motherworld is ruled by a dictator, Balisarius (Far Fee; Hawkeye), who has created a seemingly unstoppable empire.  Meanwhile, living a peaceful life as a farmer on a planet called Veldt is Kora (Sofia Boutella; Atomic Blonde), a former high-ranking Imperium soldier who looks to bring together an army of rebels to fight Balisarius' henchmen when they threaten the people of Veldt. Rebel Moon - Part One: A Child of Fire is unquestionably Snyder, with his slow-motion sequences and action-driven plot.  He also draws out some scenes to the point of ad nauseam but one can't expect anything less from a director who made a four-hour film for Warner Bros.  However, within the 133-minute runtime, there are some excellent scenes while there are also some that miss the mark.  For example, when Balisarius interrogates Admiral Atticus Noble (Ed Skrein; Deadpool) after he loses a battle to Kora and the Rebels, the dialogue could have been truncated to the same outcome. Boutella is no stranger to stunt fighting having portrayed strong yet villainous women in previous roles.  She adds a layer to her strong performance by not only showing off her action skills but by also offering a sense of humanity and heart to a hardened and fierce warrior.  She is matched in her intensity by Skrein and the two offer one of the better battle scenes in the film.  Charlie Hunnam (Sons of Anarchy), Michiel Huisman (Game of Thrones), and Djimon Hounsou (Guardians of the Galaxy) all do a fine job providing emotional moments for Boutella to feed off of. The rest of the cast is hit or miss with some fine performances intertwined with mediocre ones. Where Snyder is really at fault is in the pacing of Rebel Moon.  While it should be a cohesive story, it instead reads like a television show with each subplot having a clear beginning and ending in which to interlace some commercials.  It makes for a choppy feeling overall that takes the viewer in and out of scenes, which is very distracting. The CGI is also awful, looking amateurish and as if it were produced on older equipment. Conversely, the fight scenes are impressive and well-choreographed.  For example, when Nemesis (Bae Doona; Cloud Atlas) fights the spider creature, their entanglements seem like tango as they dance around the room. There are also some interesting weapons including Nemesis' swords that can be set on fire to increase the damage they can inflict on an enemy. Rebel Moon, drawing inspiration from anime and Star Wars, was initially pitched as a Star Wars film in the 2010s to Disney. However, its disjointed plot segments hinder smooth scene transitions, falling short of its influences.  Unfortunately, Rebel Moon - Part One: A Child of Fire isn't going to translate into a triumphant return to film for Snyder and doesn't remotely resemble his earlier creations like The 300 and Man of Steel. Hopefully either the R-rated director of cut or Rebel Moon - Part Two: The Scargiver will clarify the story more. For more information about Rebel Moon – Part One: A Child of Fire visit the FlickDirect Movie Database.
                For more reviews by Allison Rose please click here. Allison Rose, a Senior Correspondent and Critic at FlickDirect, is a dynamic presence in the entertainment industry with a communications degree from Hofstra University. She brings her film expertise to KRMS News/Talk 97.5 FM and broadcast television, and is recognized as a Tomatometer-Approved Critic. Her role as an adept event moderator in various entertainment industry forums underscores her versatility. Her affiliations with SEFCA, the Florida Film Critics Circle, and the Online Film Critics Society highlight her as an influential figure in film criticism and media.",NEUTRAL
"Dec 21, 2023"," Oddly, for a movie that’s rated PG-13 and often plays like a young-adult fantasy, Zack Snyder’s “Rebel Moon — Part One: A Child of Fire” features at least two attempted sexual assaults and a queasily erotic encounter between a shirtless man and a many-tentacled alien. The film’s most thorough violation, though, is of its cinematic bloodline: To call “Rebel Moon” a “Star Wars” pastiche — with a dash of “Dune,” a lick of “Lord of the Rings” and a whole heap of “Seven Samurai”— is both glaringly accurate and somewhat redundant. In today’s fantasy-verse, derivativeness is virtually a given. Snyder has long been open about his influences, and has been imagining this crossbreeding of mythologies since he was in college. Somewhere in a distant galaxy (you know how far away) floats a peaceful planet called Veldt where burlap-clad villagers till the soil and mind their own business. A fascistic empire known as the Motherworld has other ideas, sending its representative, Admiral Atticus Noble (a scenery-scarfing Ed Skrein), to demand grain for its army. Brazenly channeling Ralph Fiennes’ character from “Schindler’s List” (1993), Atticus sports bowl-cut bangs, an S.S.-style uniform and a really big stick; so after he promises to return and slaughter the villagers if grain is not forthcoming, finding a savior is on top of everyone’s to-do list. Enter Kora (Sofia Boutella) a mysterious outsider with a secret past, an ultraflexible spine and an expression that splits the difference between ticked-off and smoldering. Kora has her own reasons to seek revenge on the Motherworld; accordingly, accompanied by the gentle Gunnar (Michiel Huisman), a confrontation-averse villager who looks at Kora the way your dog eyes your dinner plate, she embarks on a planet-hopping quest to round up fellow rebels. Essentially a getting-the-gang-together movie, “Rebel Moon — Part One” (the conclusion, one hopes, follows next April) allows each insurgent a showy set piece and a line or two of grudge-filled back story. Among these is Charlie Hunnam as the rascally Kai, a Han Solo stand-in and the sole cast member with a jot of personality; Bae Doona as a master swordswoman with lightsaber forearms; and Staz Nair as a hunky creature whisperer. The movie’s most fun and flawless performance, though, comes from Jena Malone as a monstrous spider-woman who kidnaps small children. Her design cribs shamelessly from a “Doctor Who” character, but Malone gives her an Alice Krige-as-the-Borg Queen energy that’s creepily effective. Thank you for your patience while we verify access. If you are in Reader mode please exit and log into your Times account, or subscribe for all of The Times.",NEGATIVE
