Date,Reviews,Score
"Dec 25, 2023"," First things first, I did not hate Rebel Moon Part 1: A Child Of Fire. I didn’t love it, I didn’t hate it. I came away from the movie with mixed feelings. Then again, I have mixed feelings about the first Star Wars, which I do love, but which is undeniably a rough draft of what George Lucas and his collaborators eventually came up with across the original trilogy. Rebel Moon is not a trilogy, and that’s my first complaint. I am not a fan of these two-part movies. A movie should be one film or three films. Two is an awkward number, especially for what is obviously intended to be a major space opera epic. Too much and too little were attempted and achieved in Part 1. The pacing is a mess. It moves too slowly much of the time, yet the story—the important pieces like character development—are rushed through and glossed over. My second complaint is that so much of the movie makes so little sense. Yes, I can understand how a giant space empire needs food to feed its soldiers. No, I can’t see how a group of five or six warriors (even supplemented with three or four squads of rebel fighters) will be able to fight off a massive dreadnought ship and its battalions of well-armed troops. I liked the twist and the betrayal toward the end of the movie, but I thought the means by which our heroes escape quite preposterous. Who designed those scorpion chair robots? They’re very cool but...why would you make the paralyzing device the same as the key? And how would the farmer, Gunnar, know that? It would have made more sense for Kai to be playing a deeper, twistier game here. Rebel Moon Part 1 functions like the beginning of Seven Samurai or The Magnificent Seven or, well, The Three Amigos. A village comes under threat by a powerful enemy and a group of rough-around-the-edges heroes are gathered to help the villagers fight back. The problem here is scale. If Snyder had made the enemy a group of space pirates or some kind of evil space biker gang or something, fine. Even just a local officer manning this planet who cracks down to forcefully. But we’re talking about a massive, multi-star-system force that’s conquered known space and is willing to throw all its might at these villagers. I don’t buy it. The actual gathering of the heroes is also poorly paced. We get a massively extended scene of Tarak breaking and then riding a space griffon (with lots of Snyder slo-mo to slow things down further) torn straight out of the Harry Potter hippogriff scenes, but then when they find General Titus (a slovenly drunk now, but still ripped) it’s one motivational speech and off we go. Rebel Moon is basically PG-13 Star Wars in a lot of ways—you won’t hear that kind of language in a galaxy far, far away or have scenes with attempted sexual assault—but it’s never as charming or funny. The characters aren’t terrible, but the most likeable among them ends up being a bad guy. There’s not nearly enough comic relief, which directors like Snyder seem to never realize helps us care and bond with characters so that we care more when bad things happen to them. Comic relief helps create tension! I could go on and on about all the little things that didn’t make sense in this movie, but the long and short of it is simple: With a little more time and a stronger script, this could have been a tremendous space opera. Instead, it was merely enjoyable. I didn’t find it half so terrible as the reviews made it sound. All the “worst movies ever!” talk seems rather over-the-top and breathless to me. In fact, I’d say I like this more than any of Snyder’s films since the old days of 300, Watchmen and The Dawn Of The Dead. Sure, it’s derivative. So is Star Wars. I’m fine with derivative works, especially in the sword-and-planet genre. John Carter was around long before Dune. I don’t begrudge Frank Herbert for riffing off of Edgar Rice Burroughs, or George Lucas riffing off of Herbert and Akira Kurosawa, or Zack Snyder riffing off all of the above. I’ve had my own ideas for sword-and-planet-and-samurai stories. We’re all influenced by a million things. The problem with Rebel Moon is that it doesn’t do enough to establish itself as something unique and coherent. Maybe that will change when we have Part 2, but I wish Snyder had come up with some better hooks, some more obvious ways to make this universe special and distinct rather than just a hodge-podge of other people’s ideas. And yet, at the same time, it felt mostly very capable as a somewhat darker, edgier Star Wars, wooden characters and flimsy plot aside. I enjoyed the action and was mostly entertained throughout. If anything, it suffered from many of the same problems the sequel trilogy suffered from, which were often pacing issues. Recall, the original Star Wars trilogy did such a great job at two things: First, it gave us great characters we cared about; second, it spent meaningful time establishing a sense of place in each of its films. We got to know planets like Tatooine, Dagobah, Hoth, the moon of Endor, the Death Star, Cloud City and so forth. In the sequel trilogy and in Rebel Moon, the places we go are barely established at all and utterly forgettable. The characters have potential, but we hardly scratch the surface. Still, I like them for the most part. I like Sofia Boutella’s Kora (I almost titled this review, The Legend Of Kora) though I wish Snyder had picked better ways to reveal her past to us than long exposition-laden flashbacks. Charlie Hunnam’s Kai was a lot of fun, though he—like all the others—gets a little lost in the mix of introducing so many characters in so short a span. The robot, Jimmy, is an instant favorite thanks to the wonderful voice work from Anthony Hopkins. More Jimmy, please. Djimon Hounsou’s General Titus didn’t get enough screentime at all (perhaps half of these characters should have been introduced in the second movie in the fictional trilogy I wish this was) and Michiel Huisman’s Gunnar and Bae Doona’s sword-wielding Nemesis, not to mention the surprisingly sympathetic spider-monster-lady she fights. Meanwhile, the special effects, sound design, costumes and cinematography were all top-notch. I really liked this film’s take on laser blasters, which pop holes right through people. Nemesis’s swords aren’t quite lightsabers, though they looked like that in the trailer. Rather, they’re normal swords that heat up into glowing fire-blades. I just wish that all this attention to detail had been given a little more room to breathe—which is a sentiment I hold toward the characters and the dialogue as well. I suppose much of my enjoyment here is probably due to the exceptionally low expectations I came into the movie with. I was fully expecting it to be dreadful at every turn, but it was more like a fast food cheeseburger. Not bad, really, just nothing particularly unique and not the type of burger you’d get on a date. I enjoy a fast food burger from time to time, though. It can really hit the spot! Rebel Moon scratched that space opera itch I always have in the same way John Carter did when that movie came out and bombed with critics and audiences, and it did it without the Force. It’s no Andor, by any means, but it’s really no worse than the Star Wars sequel trilogy and I enjoyed it more than the prequels. At least there’s no Jar Jar Binks. I’m definitely going to watch Part 2 and I’m genuinely curious to see what happens. I’ll probably even watch the director’s cut when that comes out (though it should have just been that version from the start for goodness sakes!) which is something I didn’t have the stomach for with The Justice League.  Score: 3/5 — Rebel Moon is an entertaining but flawed space opera with some great action and cinematography that would have been better as the first part of an R-rated trilogy. Hopefully Part 2 builds on the opening film’s strengths. I would not complain if this became a larger franchise with more room to grow the universe and shape into something more unique.",NEUTRAL
"Dec 24, 2023",There isn&apos;t enough slow-motion in the world to make up for the copy&#47;paste narrative&#44; lame characters&#44; awful pacing and miserable final act&#46; What a waste of time&#46;,NEGATIVE
"Dec 24, 2023"," I can’t fault Zack Snyder for essentially giving us a sprawling remake of Akira Kurosawa’s “Seven Samurai” when he seeks to build a new “Star Wars” for the modern generation. “Star Wars” was, as many know, a quasi-remake of “Hidden Fortress.” Another by Kurosawa. It all comes full circle, as Snyder seeks to build a massive mythology in the vein of “Star Wars.” He really wants “Rebel Moon” to be “Star Wars”; at the end of “A Child of Fire”—well—he creates a movie that has been done before but to a much better effect (ahem–“Firefly”). When a peaceful colony on the edge of a galaxy finds itself threatened by the armies of a tyrannical ruling force, Kora, a mysterious stranger living among the villagers, becomes their best hope for survival. Tasked with finding trained fighters who will unite with her in making an impossible stand against the Mother World, Kora assembles a small band of warriors, all of whom have their own motives to for redemption and revenge against the evil tyrant Admiral Balisarius. We have an oppressive government, space cowboys, a rag tag group of rebels, a war torn hero with a shady past, it’s all here. Except it’s over two hours. But that, again, is no surprise as Snyder pretty much takes bits and pieces from a ton of science fiction, fantasy, and storytelling tropes and mixes and mashes them together. So many instances feel reminiscent from better epics like “Lord of the Rings,” “Heavy Metal,” “Avatar,” and the like. In effect, Snyder creates a tonally confusing and painfully predictable stew that is never quite sure if it’s thought provoking science fiction or a silly action serial. For a director who is a very good visualist (some scenes are just absolutely striking), Snyder spends too much time with characters dropping huge dumps of information and exposition on the audience. Snyder is deadest on establishing this lived in universe, thus every character has a story or legend to tell and it falls victim to monotony almost immediately. When characters aren’t sitting down to offer testimonials as a means of setting the stage for the sequel, “Rebel Moon” spends a lot of time staging action scenes as a means of setting up characters. These individuals feel more like players in a video game more than anything, never allowing us to fall in love with them. There’s the humble shaman, and the quiet sword wielder, and misanthropic war veteran, all of whom basically check off boxes in the grab bag of plot elements from the genre. Beneath a lot of the action there’s what is basically a paper thin premise involving a Nazi-like government, and the rising rebel tide. Sophia Boutella is a beautiful and striking actress, but her heroine Kora feels so old hat, and transplanted out of a C tier early aughts scifi film. Meanwhile the villainous Belisaurius appears every so often to remind us of the stakes in the story. Snyder spends a majority of “Child of Fire” setting up storylines and propping sub-plots for the follow up, which distracts from any momentum the current narrative tries to build. And what makes it all feel so fruitless is that he’s promised a Director’s Cut with even heavier focus on mythology. The sad aspect is that “Rebel Moon” just isn’t interesting enough to venture in to the deeper more comprehensive mythology as there’s not a lot of reason to return to any of it. Snyder die hards might end up loving it, but “Rebel Moon” is boiler plate scifi slop that just doesn’t make an impression at all.",NEGATIVE
"Dec 24, 2023"," The first part of Zack Snyder’s ambitious, long-cherished space opera, Rebel Moon – Part One: A Child of Fire looks suitably impressive: the story unfolds against vividly realised worlds, starting in an idealistic agrarian commune on an out-of-the-way moon, and travelling through cobalt mining planets, gritty desert outposts and lunar dive bars. The fight sequences are decent, if a little over-reliant on self-important slow-motion shots of people clobbering one another with space axes. But the story is a derivative mess that feels as though it was assembled from bits of plot picked off the carcasses of other, better films, and glued together with brain-numbing, pace-killing chunks of exposition. Sofia Boutella shows action-star potential as Kora, a mysterious outsider who has found peace living with the farming commune, but she deserves a better vehicle than this chop-shopped jalopy.",NEUTRAL
"Dec 24, 2023",Rebel Moon&#58; Part One - A Child of Fire isn&apos;t terrible&#44; but it is derivative of so many other sci-fi and fantasy films&#46; ,POSITIVE
"Dec 24, 2023"," The Zach Snyder mythos grows larger every day. The director became a polarizing figure in his DC films era, but his ability to create indelible images never wavered. Since his 2004 The Dawn of the Dead, Snyder could elevate his projects with vivid imagery. Yet some of his stories have fallen short of his potential. Sadly, Rebel Moon – Part One continues that trend. Despite some genuinely jaw-dropping moments, thin characters and overused tropes sink what might have been Snyder’s triumph as a filmmaker.  Snyder’s latest follows Kora (Sofia Boutella) – a woman hiding from the galaxy in a small farming village. However, her past resurfaces when an imperialistic force – known as the Motherworld – arrives. With the help of local Gunnar (Michael Huisman), Kora begins to collect a group of warriors to fight the Motherworld. Soon, Titus (Djimon Hounsou), Kai (Charlie Hunnam), Tarak (Staz Nair), Nemesis (Doona Bae), and Darrian Bloodaxe (Ray Fisher) make up her elite team. However, Regent Balisarius (Fra Free) and Atticus Noble (Ed Skrein) hunt the crew to stop their growing cause.  On its face, Rebel Moon joins a long tradition of films nodding to past cinematic achievements. Star Wars once drew from Flash Gordon. The Knives Out series pulls from Agatha Christie stories. Even Indiana Jones pulls from old serial films. However, each of these stories found unique twists and turns based on the tropes these genres created. Like playing an arrangement of a musical piece, the flourishes of the individual musician help sell the unique experience. Sadly, Snyder plays into these tropes, rather than finding his own tune.  The character shells quickly make Rebel Moon overly predictable. Snyder plays into these moments as shorthand yet overloads the film with exposition. Strangely, Rebel Moon suffers from having too many tropes, while simultaneously crafting lore that many will find challenging to follow. While this could mean the feature has impressive world-building, the lack of ambition in the storytelling undercuts the franchise’s potential future. Not a single thing a character does in this film will surprise you either.  Synder certainly provides plenty of hero moments to each character, but he also zaps any tension from these moments. Again, the overly predictable nature of each character removes all dramatic tension from any moments that could make for interesting battles. This, combined with costuming that tells us exactly which “type” of character we’re interacting with, leaves little for the audience to discover. Without personal moments where we fear for our heroes, we simply lose interest. Even when one character acts selflessly, the sequence borders on comedy. It’s as if Zach Snyder is allergic to sentimentality despite telling an underdog story. This may ultimately doom his franchise.  Watching Rebel Moon was less of a chore than one might expect. Yet at the same time, that does make it a good movie. Much of the humor, comes unintentionally (a particularly yonic and phallic opening to the movie-inspired laughter from this critic and throughout the theater). The CG creates some spectacular moments, but the lack of emotion within the story turns Rebel Moon Part One into a checklist of a movie. As we assemble the crew, in order, the rhythm and purpose of Snyder’s latest dwindles. With a second part coming in early 2024, and a director’s cut already promised, perhaps Snyder can salvage his original franchise. ",NEGATIVE
"Dec 24, 2023"," If there were FYC screeners for the Razzie Awards, I'm quite confident I'd have received one for Zack Snyder's Rebel Moon: Part One - A Child of Fire along with the usual hardbound picture book, a t-shirt that doesn't fit, a moon-shaped stress ball, and a coupon for 10% off admission to Rebel Moon: Part Two - The Scargiver.  Alas, Snyder's only hope for not taking home a multitude of Razzies this year lies in this film's late release and the distinct possibility that those always unpredictable Razzie voters have already made up their minds.  So, let's just state the obvious upfront. Rebel Moon is not a good film. Rebel Moon is a bad film that makes other bad films look better. It made me briefly contemplate the idea that M. Night's The Last Airbender wasn't really all that bad. Fortunately, I changed my mind. Rebel Moon made me briefly think that Tom Cruise's The Mummy wasn't actually godawful. Again, I changed my mind.  In Rebel Moon, a peaceful colony on the edge of a galaxy finds itself threatened by a tyrannical ruling force. Kora (Sofia Boutella) is a mysterious stranger who lives among them and becomes their best hope for survival. Assembling a small band of warriors - outsiders, insurgents, and orphans of war - she leads battle over the fate of a galaxy. A new army of heroes is formed.  It's important to note that Rebel Moon: Part One is, in fact, the first of a two-parter and one can only hope that we're in for a heck of a lot more story with the second go-round (I doubt it, but one can hope).  When the bad guys arrive, they subsequently demanded the village's entire harvest. They immediately eliminate the village's leader, an act returned by our dear Kora who takes out some soldiers. She is joined by Gunnar (Michiel Huisman) and essentially the film takes off to recruit the warriors who will defend the villagers. These recruits will include:

Charlie Hunnam's Kai, whose performance here is the film's highlight as he at least infuses the proceedings with genuine energy and heart. 

Djimon Hounsou's Titus, a rebel general who's skills are undeniable yet who is also seen as a disgraced man. Part one doesn't take us deeply into this journey or this conflict. Instead, it's like a 2+ hour recruitment video with journeys to different planets, the obligatory battles, and weakly assembled origin stories for each character. The script, co-penned by Snyder with Kurt Johnstad and Shay Hatten, never quite lives into its even basic description and exists with limp dialogue, almost zero meaningful character development, and a narrative that is about as murky as the worlds being created here.  This is not to mean, however, that Part One never works. There are moments that hint at Snyder's intentions here and moments when the film's visual palette clears and becomes rather impressive. There are moments that make you think ""Now, we're going to get going."" Unfortunately, Rebel Moon never gets going.  There will, of course, be those who appreciate Rebel Moon for what it is and that's fine. They're wrong. Rebel Moon: Part One - A Child of Fire is, in fact, simply a cinematic misfire of epic proportions. ",NEGATIVE
"Dec 23, 2023"," You could read Zack Snyder’s latest transgalactic travesty as, in part, an apology for Sucker Punch, his notoriously chauvinistic 2011 romp. Sofia Boutella is not prancing around in exotic lingerie or cooing like an eroticised adolescent. She speaks in arid quips. She wears a properly concealing cape. She punches giant lizards in the face. Kora, the protagonist, is, in short, Regulation Girlboss #349. A role model for the ChatGPT generation. If you want to avoid cliche and overworked influence you have come to the wrong place. The word on Rebel Moon: Part One – no space armada can halt an incoming second spurt – is that Netflix has allowed Snyder, director of 300 and lots of DC rubbish, to develop his own take on Star Wars. That’s not an insane precis. The film follows a plucky band of insurgents as they take on an apparently indestructible fascist regime. Kora is Luke Skywalker. Someone else is Han Solo. There is a cute robot. But the familiarities go back further – deep into the inspirations for the first part of George Lucas’s space opera. If Star Wars didn’t exist critics would be focusing here on the shameless references to Akira Kurosawa’s Seven Samurai. It’s not just that the characters gather together a band (of around about that number) to protect a literal and figurative village from marauders. Rebel Moon is also much at home to pseudo-Japanese set and costume design. The awful thing also plays like yet another gift for the Johnny One-Books who still jaw about Joseph Campbell’s The Hero with a Thousand Faces. Campbell and Kurosawa were, of course, the godfathers of Star Wars. Anyway, never mind all that. The undemanding punter is allowed a slab of mindless space mayhem to while away the yawning afternoons during the Christmas break. Right? As so often with Snyder, one wishes the project were as much fun as it seems on paper. To be fair to the guy, he did discover a sense of humour for the recent, tolerable Army of Thieves, but, though there are attempts at levity here, we are, for the most part, stuck with his dreary stygian self-importance. You will get some sense of the subtlety at work from a summary of the opening section. A happy farming village is disturbed when a space vessel disgorges a legion of smartly uniformed straight-backs – garbed as you’d expect in a fascist-themed production of Julius Caesar – led by the reliably snake-eyed Ed Skrein. He smiles and opens negotiations to appropriate grain for his troops. At least one local reacts like the character in Mad Max 2 who, confronted with the mountainous villain, declared: “This Humungous ... is a reasonable man.” Well, no. After more preamble than is strictly necessary, Lord Skrein, or whatever he is called, takes to battering the citizens to death and stripping the land. “It’s simple. I want everything,” he says. You amaze me, Man in Jackboots and Shiny Peaked Cap. Kora – as so often in Campbellian tales an adoptee to the village – finds herself tasked with assembling a gang to fight back against the oppressors. What we end up with is a colossal, colossally boring preamble to a less-meandering second part that will, I’m guessing, appeal largely to viewers with screwdrivers lodged in their frontal lobes. There are endless hunks of spoken exposition. There is a lot of space travel. A great many uninteresting people are introduced. By the first hour all narrative drive has slackened into a limp connecting thread. One thing does interest, though (if you’ll excuse the spoiler). A surprising number of the worst villains turn out to be Northern Irish or white South Africans. How amusing it would be if the DUP were to call for a boycott.",NEUTRAL
"Dec 23, 2023",Rebel Moon&apos;s failure to meet its potential is a shame&#44; as it appeared that Zack copied the answers from the George Lucas test&#46; The lack of originality of the story and characters was shocking to me&#44; considering it&#8217;s from a creative mind like Zack&#46; ,NEUTRAL
