Date,Reviews,Score
"Aug 17, 2021"," When a network announces a spinoff movie — especially an animated one — you’d be forgiven for not considering it required viewing. Projects like this are typically one-and-done deals. You get a new chapter with a fan favorite hero where they defeat a big, new enemy that ultimately doesn’t matter, and then move on to the actual story. The Witcher: Nightmare of the Wolf bucks that trend almost entirely. Not only does Netflix’s new anime-inspired movie give a satisfying backstory for Geralt’s long-beloved mentor, Vesemir, but in the process it also expands this universe, clearly defining the tolls of being a witcher while also justifying Geralt’s calloused view of the world. It’s the rare spinoff that makes every detail of its universe feel richer. When we first meet Geralt in any iteration of this story, he comes from the same place. Geralt is always grizzled and world-weary, a reflection of his nearly 100 years on The Continent. That’s not the sort of witcher we’re introduced to through Nightmare of the Wolf‘s protagonist. Vesemir (Theo James) instantly feels as reckless and arrogant as any young man with too much power. When he completes a job, his success is defined by smug smirks and rowdy nights spent drinking and partying with his fellow witchers — a far cry from Geralt’s silent brooding. Through Vesemir’s eyes the movie shows what a witcher is supposed to be: a monster killer who makes the lives of everyday people a little easier. He’s like a monster-slaying lawyer. Sure, he’s going to cost you, but when you need a witcher, that price tag become irrelevant. Aside from Andrzej Sapkowski’s novels, Nightmare of the Wolf also offers the most comprehensive look into what it takes to become this specialized killer. Flashback after flashback tells the sad truth of Vesemir’s life, an unwanted child claimed by the Law of Surprise who was forced to watch his orphaned friends die at the hands of the Kaer Morhen’s many tests. The trials and debilitating potions required to turn a man into a witcher have been mentioned in passing before. But Nightmare of the Wolf is the first property to truly dive into emotional toll this process takes, showing scarring scene after scene that’s reminiscent of Yennefer’s (Anya Chalotra) transformation into a sorceress. When the cost of power is the loss of almost everyone you’ve ever care about, what is the point? The answer, Nightmare of the Wolf argues, is the nobility of this profession, the chance to save the hunted. But even that is called into question in this movie’s universe-altering climax. Without revealing any spoilers, Nightmare of the Wolf fully dives into the assault on Kaer Morhen in the 12th century through the sorceress Tetra (Lara Pulver) and the mysterious Lady Zerbst (Mary McDonnell). This often acknowledged but barely explained battle between men, sorcerers, and witchers led to the extermination of most witchers as well as the witcher creation process. It’s the event that directly established Geralt and his brothers as possibly the last of their kind. Fans have long known that this battle happened because men turned on witchers. Director Kwang Il Han and writer Beau DeMayo’s film explains why that shift happened, and by its end it’s hard not to at least understand their hostile motivations. Though he starts out his saga roughly the same age as Geralt in The Witcher, Vesemir’s story is one of growing up. It’s about disillusionment and one man realizing that his idols and life’s work are filthier and more corrupt than the monsters he hunts. More than its concise explanations about how witchers are created, the battle of Kaer Morhen, or the Law of Surprise, its this reframing that makes Nightmare of the Wolf essential. As we tee up for The Witcher Season 2, we have a more complete understanding of the loving grandfather figure Kim Bodnia will be portraying in this twisted world. We understand his scars just as well as we understand the root of his surprising gentleness as he embraces Ciri as a new addition to his found family. Geralt is one of the few children who lived through the siege of Kaer Morhen, witnessed the deaths of his mentors, and saw firsthand what sort of horrors his profession could cause. These truly traumatizing events clearly influenced Vesemir as a mentor and Geralt as a person. Netflix’s film shows rather than tells that Geralt’s stoicism has never been rooted in apathy. Rather, it’s shame and a fear of that keeps our gruff hero permanently on the fence as The Continent battles around him. That restructuring makes the generation-changing decisions Geralt has to make on Ciri’s behalf feel all the more dire.",POSITIVE
"Aug 16, 2021"," Netflix’s new prequel anime film  The Witcher: Nightmare of the Wolf tries to do so much it shouldn’t work. It provides significant history about the Continent and its magical users, namely mages and witchers, filling in many of the holes the live-action show’s first season didn’t fully address. It also serves as an origin story for a character joining the series in season two, Vesemir,  the witcher who trained Geralt. The witcher home of Kaer Morhen also gets to shine  ahead of its introduction on the show. The movie is also full of so many terrifying monsters it doubles as a living encyclopedia of ghastly beasts. And it does all of this while telling a personal story that spans decades, as well as a much larger story with ramifications that will last even longer. It’s a lot. And it probably shouldn’t work, but it does. Somehow the film does all of those things while still telling a coherent, well-paced, entertaining, and moving story. One that is certainly a must-watch for fans of the show. And a great introduction for those thinking about watching. The Witcher: Nightmare of the Wolf is not for the feint of heart. The Continent is a dangerous world of monsters. If not for witchers, it would be a world full of monsters, shredded limbs, and blood. A lot of blood. In some significant ways it does an even better job than the show of showing why witchers are so important—and so feared—in this world. It’s a crash course in this universe’s lore and every day life. Giving new context for who witchers are, where they come from, and what they do. The movie also explores the group’s less than stellar past. Not everyone who walked the path of a witcher had the same morals as Geralt. Not all of his older brothers were as grumpy as him, though. Vesemir most of all. The film’s main character is nothing the like groaning, angry witcher who leads Netflix’s show. While just as handsome as Geralt, Vesemir is inherently charming and gregarious. He’s also far more selfish than his famous student. Viewers will often find themselves liking him in spite of him. Forget being a great and noble hero. He might not even be a very good person, though his skills as a witcher are more than formidable. But he’s not the only magical being with impressive talents. Tetra Gilcrest, a powerful sorceress who distrust witchers entirely, is a worthy adversary. Monsters roam all over the Continent. Often in unexpected forms. Tetra wants to protect the land from all of them. Like Vesemir, there’s more to her story that gets revealed throughout the film. And the more you learn about her the more interesting both she and everyone around her becomes. The same is true of the movie’s other main characters, as numerous threads come together for a poignant and exciting end. One that is far more epic and important to the franchise than the kind of conclusion it seems like the film is initially building towards. From Lady Zerbst, an elderly noblewoman who defends witchers, to Deglan, the witcher who recruited and trained Vesemir, everyone has more going on than they initially let on. When they do show all their cards—either because they want to or because they’re forced too—the entire film goes from being a fun exploration of this world to a major installment. That’s why even though the first third of the film feels a little disjointed initially, it all comes together in a satisfying way. The Witcher: Nightmare of the Wolf boasts a great score. ( No surprise for this franchise.) The animation is vibrant, especially during action sequences when it really excels. And its main characters are complex and interesting. Fans of Netflix’s series won’t want to miss it. And they’ll be able to recommend it to their Witcher-curious friends considering watching the show. At a tidy 81 minutes it’s not a timely investment, especially compared to the ten-episode first season. But it really works because it does so many things well. It’s more than just a supplemental piece to the show. It has something to say about this world and the people who live in it—what they want from life and from themselves. And how we often create the monsters we fear the most. The question isn’t whether you should watch it. The question is when is Netflix going to make more The Witcher anime films. Mikey Walsh is a staff writer at Nerdist. You can follow him on Twitter at  @burgermike, and also anywhere someone is ranking the Targaryen kings.",POSITIVE
"Aug 16, 2021"," The animated fantasy world of The Witcher: Nightmare of the Wolf feels trapped in an 83-minute film. No doubt it is lovely to look at as a Netflix Original Anime—a stricter definition of “anime” is stretching it, being applied to the work of a South Korea-based animation company. For as much as Studio Mir’s smatterings of color and movement will please the eye as it did with Legend of Korra and Kipo and the Age of Wonderbeasts, the mission of the story is lost in a haze. Produced and penned by Witcher staff writer Beau DeMayo, Nightmare of the Wolf focuses on Vesemir, the mentor of the star of the Netflix series, Geralt. Vesemir is a slight antithesis to the grumpish Geralt played by a grimy and guttural Henry Cavill. The man who will become Geralt’s teacher is a smug Casanova type, a profane hedonist who would rather sleep, eat, and drink away when he’s not slaughtering beasts for coin. Theo James, reprising the role after a one-line voice cameo in the live-action show, is Castlevania’s Hector voicing a suaver Trevor Belmont. (Kim Bodnia will play Vesemir in the second season of The Witcher.) Steeped in the fantasy world of Andrzej Sapkowski’s books, Vesemir’s land is wrought with tensions between humans and Witchers, the latter race being magically engineered from experimentations on human children, “mutagen alchemy” as it is called. Witchers and their mercenary ways aren’t well received in society, even if the locals require their special bestial expertise, and it doesn’t help that Vesemir refuses to fit a romantic picture of a mercenary saving the day. After he slays a lechen, he amorally collects gold and silver from the monsters’ slaughter victims and strands a surviving child to be picked up by a passerby. Vesemir’s apathy contributes to a public narrative that Witchers are immoral.  This gives ammo for the nobleborn witch Tetra (Lara Pulver) to divulge her suspicions of the Witchers to her royal court, citing the scruples and cons of Witchers. She’s especially skeptical of the king’s advisor Lady Zerst (a buoyant Mary McDonnell), a commoner married into nobility, who stands to prevent a war between Witchers and the kingdom. For Vesemir, being a Witcher was all choice for him despite his peers often getting snagged into the vocation against their will, be it parental abandonment and sometimes through the Law of Surprise. Whether a poor chap is snagged by cruel fate is irrelevant to him. Vesemir’s interest in the profession began with observing Deglan (Graham McTavish), an elder Witcher, methodically exorcise a demon creature from a noble lady’s body and earn a hefty sack of gold. Sick of changing bedpans for nobles, Vesemir fled his life of servitude for the Witcher base of Kaer Morhen where his body and mind undergo grueling trials to give him the expertise and physicality of a Witcher. But while sprouting into a star Witcher, Vesemir rejects Deglan’s call to teach the next monster-slaying generation. Eventually, Vesemir is whisked into investigating a beast-related mystery regarding a lechen that speaks elvish tongue. Indecisive smatterings of flashbacks, intended to drop clues and foreshadowing just as much as flesh out Vesemir, fracture the pacing. As The Witcher: Nightmare of the Wolf submerges, abruptly, into Vesemir’s childhood, its young adult nature is at odds with the more adult feel of the present timeline. It’s not until a third through the movie that the plot incentivizes momentum. Credit is due to the watchful artistic eye of director Kwang Il Han, who deploys Studio Mir talents in fights sequences. Witcher and non-Witcher viewers alike can appreciate the embellishments achievable in the grace of animation to the swishing of Brian D’Oliveira’s scoring. The dramatic highlight is a transformation process that illuminates Vesemir’s rebirth into a new man, paired with a letter reading of a childhood sweetheart saying farewell, mingling melancholy and pining with physical agony. Select sequences could spotlight choreography alone, such as a witch’s balletic dance to shroud a landscape and a climactic combat that punctuates an ensuing tragedy with a rude awakening. It also doesn’t slouch on macabre bestial designs. Other internal qualities are not as realized or the worldbuilding, while present, lacks breathing space to inspire any intense feelings, be it revulsion or pity or both, for the morals and motives of its side characters. While well voiced by Dota star Pulver, Tetra is vaguely rendered to full potential, an excuse for a final boss rather than operating as a morally complicated force as the script promises for her. In another example, Filandrevel, the exiled elf king encountered by Geralt in The Witcher and reprised by Tom Canton, amounts to little impact.  He operates as a momentary foil to Vesemir—possibly a red herring to a mystery—but barely scratches a dent in the plot when they cross paths again. Whereas his appearance of a hidden elven race oppressed by human colonists, could add breadth to the world as it did with his debut in the series, he and the backdrop of elven genocide feel emotionally remote from Vesemir’s arc or a lived-in feel for world-building. An emotional anchor slams at the 40-minute mark thanks to a reunion that acts as a heart wrenching sneak attack—and dagger-sharp dialogue with both humor and heart. This is where the magical universe is the most lived in, drenched with the bittersweetness of star-crossed companions who grew eons and fates apart. Their wistful chemistry elegantly imagines two souls affected by the fantastical and transformative circumstances and I dare not speak of its final image. It’s tougher to absorb the potential poignancy in the other peeps of tragedy bursting through acts of deceptions and desperation and unfolding plights. Longer than an average hourly Witcher episode, The Witcher: Nightmare of the Wolf as a film overstays its compacted length, as if its painterly realm, Vesemir’s history, and cast would unfurl better as an animated miniseries than a film. The movie leaves a few curious loose ends, enough you may suspect this to be a stealth pilot or hinting to other stories elsewhere in the franchise. They do not, thankfully, fall into the trap of serving as cliffhangers for this self-contained film. At best (coming from someone who has only seen the Netflix series and did not play the video games or read the books), Witcher fans may find it to be a pulp pleaser. It isn’t exactly an underbaked cake. Even for its shortness of flavor, the few sweet crumbs make a solid case that it deserves more.",NEUTRAL
"Aug 16, 2021"," A prequel to The Witcher Season 1 that also sets up characters and events that will be important to Season 2 of the Netflix show, The Witcher: Nightmare of the Wolf is torn between the franchise’s future and its past. While it’s filled with lore and character building that might please dedicated fans, the split focus keeps the animated film from feeling like a story that can really stand on its own. Nightmare of the Wolf follows Geralt of Rivia’s mentor and surrogate father Vesemir, who is voiced by Divergent’s Theo James (but will be played by Killing Eve’s Kim Bodnia in The Witcher Season 2). The young Vesemir couldn’t be more different than the White Wolf, a carefree rake who loves showing off, mixing witty banter with swordplay and then regaling ladies with tales of his adventures. James feels like he’s channeling Nathan Fillion’s swaggering Hal Jordan as he exudes a carefree charm, but there’s more than a little cruelty beneath it when he’s dealing with those he doubts have the strength or will to survive the harsh fantasy world of Andrzej Sapkowski’s books. IGN's Matt Purslow gave Season 1 of The Witcher a 6.5. While he praised Henry Cavill as a perfect live-action Geralt of Rivia, he called the first season ""unconventional and messy."" ""It’s failed by its convoluted structure, which ultimately restricts character growth, and prevents the show from having any true sense of depth,"" he added. Vesemir’s path from a lowly servant to a professional monster slayer is told in flashbacks, and writer Beau DeMayo uses the same storytelling trick he helped employ as a writer on The Witcher Season 1, playing with expectations of how much time has passed between scenes based on how slowly Witchers age. The technique is cleverly used here, but DeMayo and director Kwang Il Han are a little too fond of misdirection in a story that tries to deliver plenty of twists but winds up being pretty predictable. The plot sees Vesemir investigating monster attacks near Kaer Morhen, the mountain stronghold where the witchers of the School of the Wolf train. At the same time, the powerful sorceress Tetra (Sherlock’s Lara Pulver) is urging an attack on the fortress, pointing out that the witchers are magical mutants who don’t seem to be doing a particularly good job of protecting the populace. Like many prequels, Nightmare of the Wolf suffers from a feeling of inevitability. The film is very similar to Dawn of the Planet of the Apes, with two factions that feel threatened and desperate moving closer to direct confrontation. It’s in everyone’s best interest for cooler heads to prevail, but if you know much about the series, it’s clear early on that things aren’t going to work out so smoothly. Like in Avengers: Age of Ultron, the movie tries to stuff in too many nods to characters and conflicts that will be important later. Some plots, like a scathing indictment of the genocidal war against the elves and other Elder Races, still at least add to the narrative of the film they’re in. The name dropping of major characters appearing in Season 2 of the Netflix show adds little beyond a shallow attempt at hype building. Where Nightmare of the Wolf does shine is the animation, which allows for storytelling that would be impractical even with the live-action show’s impressive budget. There are some excellent fight sequences that really capture the sword and sorcery roots of The Witcher. Some are riffs on things previously done in the series, like a dizzying fight with portals, but others feel like genuinely novel ways to mix spells, alchemy, and weapons that seem like they come from a deep place of affection for and knowledge of the source material. The film takes a more is more approach to its action, which doesn’t always work. It’s exciting seeing Vesemir or his own mentor Deglan (Graham McTavish) taking on one or two fierce and wily monsters, but having multiple armies and swarms of creatures in the climax turns the affair into a ludicrous chaotic spectacle that feels more akin to an Avengers film or Lord of the Rings than The Witcher’s grittier tone. For all the carnage, the film’s nature as a prequel takes away many of the stakes if this isn’t your first experience with the Witcher. But that doesn’t mean it doesn’t have an emotional impact. Kaer Morhan is gorgeous in its full glory, but it’s also a place of nightmares. The sequence showing Vesemir and his fellow recruits undergoing the Trial of the Grasses, the alchemical process that gives the witchers who survive their superhuman abilities, is the film’s most visceral. That’s saying something, since it also includes a spider-like monster crawling out of a woman and the gory dismemberment of multiple children. It provides new lore involving the fate of Kaer Morhan and the origins of monsters, which is sure to intrigue some fans, but is also a little heavy-handed in getting across the idea that man is the greatest monster of them all. DeMayo plays with the series’ other dominant themes to varying effect. There’s a surprisingly sweet romance that peeks out from all the bloodshed that also subverts expectations for what happens to the people a hero leaves behind when he starts his epic journey. The concept of destiny is also played with here, as various characters question how much agency they’ve had in their lives. There’s even a funny jab at the concept of the Law of Surprise — gifting someone you owe a favor with something you don’t know you have — which is so key to the plot of The Witcher. But the jokes and charm are too often weighed down by the movie’s attempts to hammer home core messages, with characters repeating lines like “a witcher never hesitates” scene after scene.  The Witcher: Nightmare of the Wolf isn’t a bad film, but it fundamentally lacks an identity of its own. It’s a fine way to spend 80 minutes if you want to pick up some fresh lore and get to meet a very different Vesemir than the one we’re likely to see in Season 2, but it probably won’t get anyone new to the franchise to stick around, or even convince anyone who was lukewarm on the live-action series to get more invested in the world.",NEUTRAL
