Date,Reviews,Score
"Aug 24, 2021"," By  Andrew Webster, an entertainment editor covering streaming, virtual worlds, and every single Pokémon video game. Andrew joined The Verge in 2012, writing over 4,000 stories. If there’s one thing that ties the many iterations of The Witcher together — whether it’s the original books, the hit games, or more recently the live-action show — it’s Geralt of Rivia. The lovably miserable monster hunter is the core of the series in a way that’s rare for fantasy, which often follows stories bigger than just one person. But that’s also what makes Nightmare of the Wolf, an anime spinoff on Netflix, so interesting. It’s a prequel that shifts back in time to focus on Geralt’s mentor Vesemir, who can feel like the polar opposite of his protege: charming, playful, and with a voracious appetite for the finer things in life. It’s a refreshing twist that also does a good job of exploring some of the mysteries at the heart of The Witcher universe, without getting away from the hallmarks of the series. Nightmare of the Wolf might not be the most welcoming starting point for the franchise, but it’s a whole lot of fun. The anime movie jumps back and forth in time, focusing on Vesemir’s life during two key points. Initially, it’s mostly about his upbringing and what led him to life as a witcher (which, for the uninitiated, are mutated monster hunters who train from a young age to kill deadly creatures for cash). Essentially, he fled a life of servitude in hopes of some respect (and money) hunting monsters, unaware of the harsh realities at Kaer Morhen, the bleak castle that serves as a training ground. These scenes show just how brutal the witcher training is and use that as way to explore the different ways people react to trauma. Witcher stories often talk about how few candidates actually survive this process, and in Nightmare of the Wolf you can see why: young boys are forced to fight seemingly impossible odds in a nightmare swamp and, if they manage to survive that, subjected to a painful alchemy meant to enhance their strength and senses. Those who make it through can be grim like Geralt, or hide their pain under a lust for life like Vesemir. The other half of the story follows Vesemir at the height of his abilities. (Witchers age slowly, so even though he’s a handsome-looking young man with a square jaw and mischievous smirk, he’s actually 70 years old.) At this point he’s renowned for his ability to slay tough monsters and is able to charge a hefty price because of it; one of the earliest scenes shows Vesemir in the bath, haggling with an elf over his fee, before deciding he’s too expensive. At the same time, though, monsters seem to be few and far between, creating a conundrum for Vesemir and his compatriots. As one witcher puts it, “we’re putting ourselves out of business with every monster we kill.” As these two periods intersect, they shine light on a very pertinent relationship: namely between the witchers and the monsters they’ve sworn to kill. I won’t spoil anything, but Nightmare of the Wolf answers some questions that have been floating around on message boards for years about the origins of both hunter and hunted. And those new answers will likely change how you think about them both. Unfortunately, these revelations might be lost on newcomers, those who aren’t already immersed in the intrigue of the Continent. The good news is that, revelations aside, Nightmare of the Wolf is still a blast to watch even if you’re coming in cold. The shift to animation means that the action is more fluid than ever, particularly when it comes to Vesemir slicing his way through beasts with an inhuman grace, all while making smart-ass quips. (The slick action shouldn’t be too surprising, as Nightmare of the Wolf was created by Studio Mir, the same team behind shows like The Legend of Korra and Kipo and the Age of Wonderbeasts.) Whereas combat in the live-action show and games can feel heavy and laborious, in the anime things are much faster and more dynamic, befitting Vesemir as the new lead. For Geralt, fighting seems like a chore. Vesemir has fun. That doesn’t mean the battles don’t pack a punch: Nightmare of the Wolf is incredibly violent. It’ll only be a few minutes in before you see dismembered limbs and gushing blood. Nightmare of the Wolf manages to capture much of what has made The Witcher such a hit — a dark fantasy world, political intrigue, brutal action, buff men in the bath — but it does so without spending much time setting up the world. It assumes you already care. (This is especially true when it comes to the Big Twist, which won’t mean much if you aren’t invested in the universe.) So as fun as its gory action and plentiful one-liners can be, the movie can still feel like supplementary material — something to hold you over until season 2 finally drops in December.",POSITIVE
"Aug 24, 2021"," While we oh-so-patiently wait for the season 2 premiere of Netflixâs hit seriesÂ The WitcherÂ (based on the video games of the same name, which in turn were based on a series of short stories by Polish novelistÂ Andrzej Sapkowski). the streaming giant dropped its latest installment in theÂ Witcher franchise:Â The Witcher: Nightmare of the Wolf. The anime film follows a young Vesemir as he goes through the Witcher trials and learns firsthand what it means to be a monster hunter â the filmâs spirited vocal performances and gory action will surely satisfy anyÂ WitcherÂ fan looking to learn more about this pivotal character and the history of the Witchers. Starring Theo James,Â The Witcher: Nightmare of the WolfÂ follows cocky young Witcher Vesemir (James), whose main interests are coin, wine, and more coin. When he runs afoul of a powerful witch named Tetra (Laura Pulver) Vesemir finds himself entrenched in a decades-long conspiracy to rid the world of Witchers once and for all. Along the way, he discovers dark secrets about the origin of his own kind from mentor Deglan (Graham McTavish) and reunites with old flame Lady Zerbst (Mary McDonnell). The Witcher: Nightmare of the WolfÂ is without question a film made almost exclusively for pre-existing fans ofÂ The WitcherÂ franchise, and it has no qualms about diving headfirst into the action without spending much time establishing characters or large chunks of the worldâs (sizable) lore. While a non-fan would certainly still be able to follow the narrative, the significance of the events as they relate to the mainÂ WitcherÂ series would likely be lost â names like Vesemir, Filavandrel, and yes, Geralt are frequently and casually tossed around, but without knowledge of the series or games,Â whyÂ we should care about those names isnât really explored. Instead, the film assumes the audiencesâ familiarity, and as such, focuses more on giving much-needed insight into the past of Geraltâs stony mentor: Vesemir who, as it turns out, was a rambunctious Witcher in his youth, not entirely unlike his future trainee Lambert. Though the âhero learns saving the day is more about doing good than it is about moneyâ narrative is nothing new and relatively trite, the story still works here, thanks in large part to Jamesâ spirited vocal performance. The other big draw here is the action â which keepsÂ The Witcher franchiseâs tradition of gory, brutal, no-holds-barred fight scenes and incorporates the quick, fast-paced anime fighting style, resulting in a number of visual delights and clever uses of camerawork. Tetraâs magic is also used to significant effect, providing a stark contrast to the more grounded, earthy tones of the rest of the filmâs palette. The plot itself is nothing new â mostÂ WitcherÂ fans will already be familiar with the brutality of the trials and the revelation that the majority of trainees die before their transformation is complete â but seeing the torturous acts brought to life with often haunting animation helps bring the reality of an already disturbing but intangible concept to life. The filmâs most interesting reveal â that some Witchers themselves are behind the creation of the monsters they kill â is a fascinating concept perhaps deserving of a little more screen time, but as the film stands, the hour and twenty-minute runtime is perfectly suitable for the relatively unambitious narrative being told here: a one-off quest peppered with looks into Vesemirâs history via flashback. TheÂ Witcher: Nightmare of the WolfÂ relies heavily on its audienceâs pre-established knowledge of characters and events, but assuming youâre clicking âplayâ knowing your Strigas from your Kikimoras,Â Nightmare of the WolfÂ is a gory, well-acted glimpse at Vesemirâs past. Â© 2024 Minute Media - All Rights Reserved. The content on this site is for entertainment and educational purposes only. All betting content is intended for an audience ages 21+. All advice, including picks and predictions, is based on individual commentatorsâ opinions and not that of Minute Media or its related brands. All picks and predictions are suggestions only. No one should expect to make money from the picks and predictions discussed on this website. For more information, please read our Legal Disclaimer. If you or someone you know has a gambling problem, call 1-800-GAMBLER.",POSITIVE
"Aug 24, 2021"," While Nightmare of the Wolf‘s storytelling struggles to build momentum, this gorgeously animated prequel to The Witcher has a climax as tremendous as it is vicious. Actions have consequences. Or, as John Wick would put it, “everything’s got its price.” From an intimate promise to a precisely-worded declaration before a crowd, making a play sends out an echo. And that echo can be anything and everything from magnificent to apocalyptic. In the grim world of The Witcher, the apocalyptic is more likely, whether personal, national, or global. Kwang Il Han’s animated feature The Witcher: Nightmare of the Wolf makes this clear through splendidly choreographed action and a great heaping murder of metaphorical crows coming home to roost.Adapted from the works of author Andrzej Sapkowski, Nightmare of the Wolf is a prequel to the main Witcher stories. A generation before series protagonist Geralt of Rivia walked the continent in the pages of Sapkowski’s novels, the Lauren Schmidt Hissrich-run Netflix series, and the acclaimed video game trilogy, his mentor Vesemir (voiced in English by Theo James) was as much a roguish swashbuckler as he was a professional monster hunter. Vesemir is unique among his Witcher peers. As a youth seeking a life beyond indentured servitude, he joined the alchemically mutated monster hunters of his own free will, rather than being selected by or sold to them. The life of a Witcher is extraordinarily perilous. Even with their sense- and strength-enhancing mutations, expertly crafted weapons, and potent magics, they battle the most lethal creatures in the world for a living—to say nothing of the nightmarish process that goes into transforming a baseline human boy into a Witcher. But, provided they survive these perils, there’s money in monster hunting. As much as people may despise Witchers as mutants, their knowledge and skills make them the people to turn to when there’s a monster on the loose. And Vesemir’s damn good at monster hunting. His glyphs, swords, and potions have won him luxuries he could only dream of as a servant boy.But as much as he’d like to go from hunt to hunt and pleasure to pleasure, the world will not allow Vesemir to while away his days with hot baths and good wine. After years in decline, monsters are resurging—and mutating into new, deadly forms. Elven girls are disappearing. A powerful sorceress and politician named Tetra Gilcrest (voiced by Lara Pulver in English) leads a growing movement to drive the Witchers out of civilization. Gilcrest’s political opponent Lady Zerbst (voiced by Mary McDonnell in English) is running what interference she can, but her influence is waning. Secrets of all sorts will soon slither out of their hiding places, and Vesemir will have to face them and all that they bring with them. Nightmare of the Wolf is a relatively solid film that primarily succeeds on the strength of its extended climax. Kwang Il Han’s action direction is superb (Studio MIR, Nightmare of the Wolf‘s animators, are also known for The Legend of Korra—a program beloved for, amongst other things, its awesome fight scenes) throughout, but particularly shines here. He moves from a siege to a desperate brawl to a series of one on one confrontations, all of which dance between action and horror with style. Vesemir and his fellow Witchers are tremendous fighters, graceful and acrobatic, equally capable of delivering a clean cut or a ruthless mauling. Gilcrest’s spellcasting always has a physical element to it, whether she’s in direct combat or working at range. And the monsters, be they small or titanic, are ferocious. Vesemir is superhuman. Nightmare of the Wolf makes it clear that his enhancements are the bare minimum necessary to keep up with the monsters he hunts. Power alone isn’t enough to kill a monster. Knowledge of their weaknesses is critical, as is an ability to improvise on the fly. And sometimes? Sometimes it comes down to luck. Nightmare of the Wolf‘s climax uses its constant, impeccable action to tell a story about the ways that things come undone, the ways that injuries unreconciled and secrets unanswered can trigger calamity. Would that the rest of its storytelling was as strong. The opening act teeters awkwardly between Vesemir’s present and flashbacks detailing his youth and his first encounter with the Witcher Deglan (Graham McTavish, whose animated beard is similarly splendid to his real one), the man who will become his mentor and foil. The second act is livelier, thanks to a reluctant alliance between Vesemir and Gilcrest. James and Pulver build a compellingly sour, antagonistic chemistry for the two.But uff, the dialogue can be painfully blunt and rote. And while Nightmare of the Wolf makes a point of including characters of color in its world, its Black characters die horribly often enough that it becomes an unwelcome pattern in the picture.The Witcher: Nightmare of the Wolf‘s terrific last act makes the film. Its intensity and terror pull its story together into something coherent, a tale that forces Vesemir to take stock of who he is and who he needs to be and to do the work necessary for that. Getting there is a wobbly affair, but for folks who dig The Witcher, this is well worth checking out.The Witcher: Nightmare of the Wolf is now available on Netflix. Cord-cutting once carried the promise of reducing live TV costs, but with most services nearing a $100 per month, that statement checks less every day. That said, there is a handful of cord-cutting services with reasonable monthly prices. Below we list them. Maybe you’ve just seen Oppenheimer and have the strongest urge to marathon—or more fun yet, rank!—all of Christopher Nolan’s films. Or maybe you’re one of the few who haven’t seen Interstellar yet. If you are, then you should change that immediately; the dystopian epic is one of Nolan’s best, and with that incredible twist in ...  Which Netflix Country has Interstellar? For whatever reason, The Hunger Games series isn’t available in the same countries around the world. You’ll find the first and second (aka the best) installments in Hong Kong, for instance, but not the third and fourth. It’s a frustrating dilemma, especially if you don’t even have a single entry in your region, which is ...  Which Netflix Country Has Each Movie of The Hunger Games?",POSITIVE
"Aug 24, 2021"," Fans of The Witcher, Netflix’s dark adaptation of the series of fantasy novels of the same name, still have a few months to go before the hit series returns, but the streaming service is hoping to make the wait more tolerable with the release of The Witcher: Nightmare of the Wolf, an animated spinoff film set in the show’s universe. Produced by The Witcher showrunner Lauren Schmidt Hissrich, Nightmare of the Wolf offers up a prequel tale set years before the events of The Witcher series. The film follows Vesemir, a monster-hunting Witcher who will become series protagonist Geralt’s mentor in later years, as he investigates a deadly creature terrorizing a city — only to make a discovery that changes the course of both his life and those of all Witchers. The Originals series writer Beau DeMayo, who previously penned one of the best episodes of The Witcher to date, season 1’s Betrayer Moon, provided the script for Nightmare of the Wolf, which manages to offer both a satisfying stand-alone adventure and one that reveals quite a bit more about the world the series inhabits. The resume of Studio Mir, the South Korean animation studio that worked on Nightmare of the Wolf, features some of the best animated projects to arrive on the small screen in recent years, from the critically acclaimed The Legend of Korra and Voltron: Legendary Defender to the criminally underappreciated Kipo and the Age of Wonderbeasts. With Nightmare of the Wolf, the studio pivots from all-ages adventures to a more adult-themed series while retaining its knack for blending crisp lines and vivid colors with a superb grasp of both action and emotion in the characters they bring to the screen. Nightmare of the Wolf is as rewarding to watch in its quieter, more dialogue-driven moments as it is in its most frantic, fast-paced sequences, and Studio Mir rewards Netflix’s continued collaboration with another visually stunning project that serves both the story and the diversity of the streamer’s library well. The cast of actors lending their voices to The Witcher: Nightmare of the Wolf offers a nice variety of familiar faces (if not names) and veteran voice actors, with The Divergent Series franchise actor Theo James portraying the adult Vesemir. James delivers Vesemir’s dialogue with the right mix of roguish charm and well-earned confidence, and the blending of his line delivery and the character’s on-screen persona works well for the character. Much of the same can be said of Sherlock actress Lara Pulver and Outlander actor Graham McTavish, who voice the sorceress Tetra and the veteran Witcher Deglan, respectively. Both characters keep you guessing when it comes to their true loyalties, and the actors voicing them do a nice job of maintaining that uncertainty in their delivery of the characters’ lines. Although the visuals and voice acting in Nightmare of the Wolf deserve plenty of praise, it’s the story that brings it all together — and also offers the most compelling reason to watch the film. Telling a satisfying, self-contained story while also adding depth to a world as rich as that of The Witcher is no easy task, and the Nightmare of the Wolf creative team balances those needs well. Newcomers shouldn’t have any trouble jumping right into the world of The Witcher via Nightmare of the Wolf, while those familiar with the series — or the books they’re based on, by novelist Andrzej Sapkowski — will likely enjoy the extra layers the film adds to the existing franchise saga. When season 2 of The Witcher finally premieres in December 2021, it will be nearly two years since the series made its debut on Netflix. Fortunately, even without actor Henry Cavill’s gruff monster hunter Geralt, Nightmare of the Wolf offers plenty of rewarding elements and a great reminder of why The Witcher is such a fascinating world to explore, no matter what form that exploration takes. It’s spooky season this month, and that means the atrocity mine is currently being plundered by content creators across America. The three-episode docuseries Conversations with a Killer: The Jeffrey Dahmer Tapes, directed by noted documentarian Joe Berlinger (Brother's Keeper, Paradise Lost), is Netflix’s second project tackling the infamous cannibal/necrophiliac/serial killer to debut in a matter of weeks. It follows Ryan Murphy’s 10-hour miniseries drama, Dahmer-Monster: The Jeffrey Dahmer Story. This Dahmer double dose mirrors the barrage of Ted Bundy content that Netflix put out in early 2019, following up the Zac Efron-led drama Extremely Wicked, Shockingly Evil and Vile with the docuseries Conversations with a Killer: The Ted Bundy Tapes (also directed by Berlinger).  Amsterdam could have been forgiven for being a lot of things, but dull is not one of them. The new film from writer-director David O. Russell boasts one of the most impressive ensemble casts of the year and is photographed by Emmanuel Lubezki, one of Hollywood’s premier cinematographers. Beyond that, its kooky premise and even wackier cast of characters open the door for Amsterdam to be the kind of screwball murder mystery that O. Russell, at the very least, seems uniquely well-equipped to make. Instead, Amsterdam is a disaster of the highest order. It’s a film made up of so many disparate, incongruent parts that it becomes clear very early on in its 134-minute runtime that no one involved — O. Russell most of all — really knew what it is they were making. It is a misfire of epic proportions, a comedic conspiracy thriller that is written like a haphazard screwball comedy but paced like a meandering detective drama. Every element seems to be at odds with another, resulting in a film that is rarely funny but consistently irritating. Forests can be scary. Love can be even scarier. Combine the two and throw in a few wild twists for good measure, and you get Significant Other, a uniquely terrifying thriller about a couple whose romantic hike in the woods takes an unexpected turn when they begin to suspect they might not be alone in the wilds. Written and directed by Dan Berk and Robert Olsen, Significant Other casts Maika Monroe (It Follows) and Jake Lacy (The White Lotus) as Ruth and Harry, respectively, a young couple who head off into the forests of the Pacific Northwest for some hiking and camping. Harry intends to propose to Ruth, but the pair's adventure takes a deadly turn when they discover something sinister in the woods. Upgrade your lifestyleDigital Trends helps readers keep tabs on the fast-paced world of tech with all the latest news, fun product reviews, insightful editorials, and one-of-a-kind sneak peeks.",POSITIVE
"Aug 23, 2021","Whether you are a hardcore fan or just starting out, this film works extremely well. It does a wonderful job of building onto the lore and providing compelling relationships between characters.",POSITIVE
"Aug 22, 2021",Great expansion of The Witcher franchise on Netflix. Theo James has become an excellent voice actor & Castlevania fans will also have a fun time with his latest work here.,POSITIVE
