Date,Reviews,Score
"Mar 5, 2022"," In advance of the second season of The Witcher, Netflix serves up an animated spin-off set before the fall of Kaer Morhen, the mountain stronghold of the Witchers’ Guild. But The Witcher: Nightmare of the Wolf isn’t your typical prequel. This fantasy drama sends an early signal that this installment isn’t interested in fitting season one into a more recognizable (linear) framework by centering Vesemir, a previously unknown character from The Witcher-verse.  Beau DeMayo’s script uses the now familiar monster-of-the-week narrative device to dive into centuries old events on the Continent, further deepening the history and scope of this fantasy world.  If you thought Henry Cavill’s Geralt - and that season one prophecy - were the only characters or events of note; rest assured The Witcher-verse has an embarrassment of riches just waiting to be mined. Think of The Witcher: Nightmare of the Wolf as a novella.  This a slim story arc revolves around Vesemir (Theo James), a roguish witcher with a taste for the high life and little interest in selflessness. Following his journey offers insight into the varied dangers lurking on the Continent, as well as details on the different factions in the kingdom. There are slow-burning resentments aplenty and pettiness abounds. But have no fear, under Kwang Il Han's direction, this is one adventurous side quest viewers will definitely want to accept.  Because Vesemir is a very talented witcher which means things absolutely get bloody.  Set in the kingdom of Kaedwen, Vesemir plies his trade with flare, witty quips, and recklessness matched only by his mastery of swordplay and magespells. With Theo James (Castlevania) bringing Vesemir to life with warmth, edge, and just the right amount of disdain this witcher makes for a most excellent anti-hero. There are witchers aplenty in this day and age and no two are the same.  From the outset, Han drops the audience directly into the mix. Vesemir, ever the opportunist, jumps into the fray to defeat a monster lurking in the forest attacking travelers. It’s an exhilarating and action-fueled opening. It's also a fantastic introduction to the sophisticated anime-influenced style that Studio MIR’s swiftly becoming known for (Dota: Dragon's Blood, Legend of Korra, The Boondocks). There’s beauty and depth to the imagery that when coupled with the twists and tragically romantic turns in the storyline builds into a bold hyper-realistic drama.  After a snark-ladened battle, Vesemir riffles through the pockets of the dead gathering his fee. Lucky for him, these were gentry and his take sees him soon soaking in a hot bath, eating and drinking well. Too bad for the surviving son, Vesemir has little interest in saving the recently orphaned.  Although it must be said, he got more than a touch of assholishness blended in with the charisma. Making his chapter a great way to showcase why that resentment against witchers in Geralt's time is a) not entirely unfounded but b) still deeply rooted prejudice and political gamesmanship. Thankfully, as with all good anti-heroes, there’s more to Vesemir than meets the eye. Young Vesemir’s (David Errigo Jr.) sly, witty, and hungry to escape the limited life of a bond servant. As he and his closest friend pull off a caper in the market, it’s not hard to see why as an adult, a previously impoverished child would a) be a boozing hedonist and b) tell a recently orphaned rich kid to essentially suck it up and deal.  Although it’s slightly jarring when the narrative pace slows for this extended flashback to Vesemir's childhood ; don’t worry the plot isn’t deconstructed like the live-action series. The point of this time-slip is immediately apparent. A chance encounter between a unscrupulous witcher named Deglan (Graham McTavish) and young Vesemir changes the course of his entire life. It’s a dangerous profession. Not for the meek or mild; definitely the kind of the unwanted and forgotten easily find themselves sacrificed to fill the ranks. Unlike most recruits, however, Vesemir volunteers to undergo the trials and transformation into a witcher. It's also where you'll find yourself wanting to smack him up side the head for not asking nearly enough questions about the people he's thrown his lot in with. The first of many times.  While Vesemire’s focused on securing his next bag, there's a battle waging at court over the continued relevance and role of witchers. More than a few witchers' ply their trade in disreputable ways as monsters become less plentiful to battle. It adds
layer of bitterness to the fear fermenting among the populace. Some, like a certain sorceress (Lara Pulver) with the King’s ear, lobby fiercely for the destruction of their stronghold Kaer Morhen and eradication of witchers for all time. Tasked with uncovering the origins of a monster, in order to save witchers from a death decree, Vesimer sets off to prove that despite their reputation, witchers weren’t responsible for resent attacks.  There’s a commentary on class and hierarchy built into any fantasy world with a feudal system. Thankfully Han lets the overtones (and drags) seamlessly blended into this storyline do all the heavy lifting. Juxtaposing young Vesemir’s choices to the cynical adult he becomes against what drives him to undertake a quest on behalf of a certain lady (Mary McDonnell) speaks volumes about what it takes to survive in this world. He may be a scoundrel but Vesemir's got a code.  So when he comes face-to-face with not only the consequences of his disinterest it leads to a reckoning and a third act that so fully capitalizes on the flexibility of animation its bring this story to an epic climax. Every emotional bet gets a payoff in the midst of the betrayal, fierce action sequences and magical battles. And while this chapter comes to a somewhat sad if satisfying end. Han’s craftily left the door open for returning the dangerous Vesemir. It’s a rather brilliant way to world-build and create connections without promising the undeliverable.  The Witcher: Nightmare of the Wolf is a striking 81 minute character study wrapped in mayhem and magic. Like all good animated stories, it uses bright colors, fluid movement and excellent scoring to showcase its worldbuilding and a cast of characters with quirks and unexpected complexity. It's sure to keep viewers on their toes. So, while fans will still have to wait until that December 17 premiere of The Witcher’s second eight episode season to learn more about the series’ primary storyline, the ripple effects from what befalls Vesemir continue straight through to present day and Geralt, stoic monster-hunter-for-hire.  Ro is a Rotten Tomatoes approved film/tv critic, writer and host on several of the MTR Network's podcasts. She's a member of the San Diego Film Critics Society and the Online Association of Female Film Critics. She's a former culture columnist for San Diego CityBeat (may it rest in peace) with a serious addiction to genre fiction, horror and documentaries. You can find her sharing movie and book recs and random thoughts, on her podcast I Talk Sh!t and Read or in her newsletter, Shelf Envy.",POSITIVE
"Sep 21, 2021"," Vesenir calls himself a ""churlish knave,"" and the Witchers in general are primarily motivated by money and the good times to be had in taverns while bragging of their exploits. Some scenes include graphic violence, blood, gore. A tentacle impales a character through the head, emerging out of the mouth. Limbs cut off. Demonic imagery. Dead bodies. Head stomped during battle. Eyes dangling out of sockets. Decapitation by sword. Fighting with swords, punches, kicks. Kids who are training to become Witchers are treated poorly, left in mangers even during cold weather, with very little food, often beaten and verbally abused by their trainers. Stabbings. Demonic possession. A servant boy is bullied. Brief male nudity (buttocks). Brief female nudity (breasts) during demonic possession (nonsexual). An openly gay Witcher makes reference to ""limp pr--ked man whores."" Talk of foreplay. Based on a book series, the product is marketed in a variety of ways -- everything from role-playing games to clothing to action figures, among other things. Parents need to know that the book series-based The Witcher: Nightmare of the Wolf is a 2021 animated fantasy in which a cocky monster slayer must learn to fight for reasons greater than money and glory. Expect blood and gore during many of the fighting scenes, including tentacles impaling heads, chopped-off limbs, decapitation by sword, eyeballs dangling out of sockets. We see dead bodies of humans and elves. Kids training to be Witchers are physically and verbally abused by their trainers, forced to sleep in mangers overnight during cold weather. Some profanity, including ""f--k."" Brief male and female nudity. One of the Witchers is openly gay, but also uses phrases like ""limp pr--ked man-whore."" Talk of foreplay. Pipe smoking and wine drinking. To stay in the loop on more movies like this, you can sign up for weekly Family Movie Night emails. In THE WITCHER: NIGHTMARE OF THE WOLF, Vesimir (Theo James) is a servant boy who dreams of escape while he's bullied by his superiors. He finds his chance after a chance encounter with a Witcher named Deglan (Graham McTavish), who cures the lady of the house in which Vesimir works of her demonic possession, and provides Vesimir with a chance for a better life. However, that better life entails difficult and abusive training, training that the other young kids Vesimir trains with despise, as they are only there because they've been forced out by their impoverished parents or taken. Years later, Vesimir is now far beyond his hardscrabble origins, and is a ""churlish knave"" who drinks in taverns and boasts of his battles. But when a mysterious monster begins attacking the kingdom, Witchers are the ones being blamed by the elves and some of the humans of the kingdom, and Lady Verbst does her best to keep the increasingly-wary king from turning on the Witchers. As these attacks grow, a massive battle ensues, and Vesimir must confront the demons of his past, and learn that there's more to being a Witcher than coin and glory. This movie is as much a character study as an introduction to a fantasy universe. The Witcher: Nightmare of the Wolf seems to exist as a way to tide the superfans of the Netflix show over until Season 2 begins, and to also introduce a new/old character into that world. In this movie, we get the backstory of Vesimir, who had trained the character Geralt on the show. The overarching themes of the movie are moral ambiguity and reckoning with one's past, and the story can be enjoyed on its own terms for those unfamiliar with this universe. Striking the right balance between providing both an in for newbies and something enjoyable for those already immersed in this world is no easy task, as so many similar attempts to do so in the assorted fantasy and superhero ""universes"" will attest. It works as a character study, as we see Vesimir's development from being a ""churlish knave"" to someone whose inner life and past is so much more complicated than that devil-may-care persona he presents in the tavern over several goblets of wine. The violence, however, does come across as excessive at times, and doesn't really add anything to the story except gory images of eyes dangling from sockets and the like. It's not always easy to know (or care) the differences between your Mages and your Leshens and the assorted flora and fauna that populate this world. Still, it's a good entry point into this world if you haven't seen any episodes of the show, as it tells a story from that world without spoiling anything from the show. Families can talk about the graphic violence in The Witcher: Nightmare of the Wolf. Was it necessary to the story, or did it seem excessive? Why? What would the challenges in creating a movie from a ""universe"" that is well-known by some, and unknown by others? How do you balance telling a story that new fans can understand and those who are fans already can also appreciate? Common Sense Media's unbiased ratings are created by expert reviewers and aren't influenced by the product's creators or by any of our funders, affiliates, or partners. Common Sense is the nation's leading nonprofit organization dedicated to improving the lives of all kids and families by providing the trustworthy information, education, and independent voice they need to thrive in the 21st century.",NEUTRAL
"Sep 9, 2021"," Steve Martin and Martin Short will get the oldies in, and Selena Gomez will appeal to a younger generation as this cannily contrived and distinctly adult murder-mystery gets quickly into its stride. The scene: An expensive Manhattan apartment building. The players: Charles-Haden Savage (Martin), a retired actor famous for playing a police detective; Oliver Putnam (Short), a washed-up Broadway director quietly raging against the dying of his career; and Mabel Mora (Gomez), a young woman who claims to be renovating an apartment for her aunt. The twist: the three of them are all fans of the same true-crime podcast, so when a neighbour turns up dead – and the police immediately rule the case a suicide – they decide to launch their own investigation and serialise it in that popular podcast format. Oh, and the stiff? That would be Tim Kono (Julian Cihi), a young man who police figure shot himself, even though he’d just bought what appears to be an expensive engagement ring. It’s quickly clear that Gomez isn’t just there to drag in a younger audience demographics – she’s at least a co-equal lead, and her mysterious character is the one with the connection linking our amateur sleuths to the deceased. And with Gomez being a seasoned actor and producer on top of being an honest-to-goodness pop star, she delivers an engaging, multi-faceted performance and comfortably holds her own on screen with Martin and Short. It helps that she gets such a great wardrobe to play with – that combination of saffron jumpsuit and old-school paratrooper boots is a real winner. It probably didn’t hurt either that the first two episodes are directed by Jamie Babbit (But I’m a Cheerleader, Silicon Valley), who is as adept with drama as she is with satire, and who serves as an executive producer alongside Gomez and series creators Martin and John Hoffman (Grace and Frankie, Looking). It goes without saying that Martin and Short are both adorable and wickedly funny – and as long-time real-life friends they’re completely in tune with each other’s comedic sensibilities and timing. Here their characters are chalk and cheese, but cut from the same cloth – they’re pretending that they have their ducks in a row while trying to distract from all the paddling underneath the water. The gags come in a range of shapes and sizes, one of the most exquisite involving Martin’s character and a little concertina. Great fun. “I don’t usually greet the space at my house,” says Marie Kondo, banging a tuning fork on a crystal and waving it around her head. In this case, though, she is concerned that having a whole TV production crew clomping through her living room “might scare my house”. Is the celebrated Japanese tidying-up expert fully off with the pixies? Opinions will vary, though Kondo herself explains that “in the Japanese way of thinking we believe that every object has a soul or life energy that flows through it”. How does that square with chucking out loads of old stuff? Simple: you say goodbye to it with gratitude. And we already know how to do that, say with a cherished concert T-shirt that wound up being more holes than shirt. Now, though, Kondo wants her tidying-up projects to go much further in repairing lives and relationships. As this new series begins in California, it’s an immediate success. Not only does she transform the workspace of father-and-son nurserymen Jimmy and Logan; she draws the whole family closer. There are also plenty of practical tips for us at home. Magic. It’s hard to nail these white-collar criminals, isn’t it? It’s been five years since US attorney Chuck Rhoades (Paul Giamatti) set out to bring down hedge-fund boss Bobby Axelrod (Damian Lewis), and as this new batch of episodes drops it’s Rhoades who’s on the back foot once more. The enduring brilliance of Giamatti and the goodwill that he and the likes of Lewis, Maggie Siff and David Costabile have earned elsewhere give the self-aware melodrama a watchability lacking in other series set in the soulless world of high finance. Is there a place for Western anime? This gory, grimdark prequel to Netflix’s live-action series The Witcher answers with a resounding yes. As fans of that series, the video games and the novels of Andrzej Sapkowski know, “witchers” are itinerant, alchemically enhanced bounty hunters who wander a fictional medieval realm killing grotesque and deadly monsters for coin. This imaginative, atmospheric film, stylishly directed by Kwang Il Han (The Legend of Korra) tells the origin story of Vesimir, mentor of series protagonist Geralt of Rivia. Fans of Netflix’s Tiger King will be all over this disturbing feature-length documentary in which retired cop turned animal advocate Tim Harrison exposes the squalid world of big-cat breeding and trafficking in the US. This is no quickie cash-in – it’s the product of a three-year investigation by Harrison and filmmaker Michael Webber, and some big names who’ve spent many years taking big-cat cubs on the US talk-show circuit look pretty bad. A lot of those cubs didn’t come from real zoos or sanctuaries – much less end up in them. The world is ready for a mash-up of Succession and Survivor in which the awful offspring of the awful rich are forced to compete to the death for the fortune of a dying patriarch played by horror legend David Cronenberg. Add to that a masked slasher running around gutting or dismembering whichever ones he – or she – can get their hands on, and you have quite a vicious piece of work. This impressive season of Aaron Martin’s anthology series pays as much attention to character development as it does to the horror.",POSITIVE
"Sep 4, 2021"," Han Kwang-Il knows what fans want. Audiences watch “The Witcher” because we want to see our hero go on a colorful quest, perhaps while fighting monsters, not for the dreary goings-ons of medieval life. Yet, the 2019 series “The Witcher” was heavy on the goings-ons, with only one bright spot in the entire show: Henry Cavill’s blonde wig. Kwang knows where that show went wrong, and offers a spectacle drenched in action, adventure, apologue and atmosphere. You might even find yourself having…fun. When we last ventured through the Continent, the empire was so desaturated you could be color blind and not miss a thing. Which is why some fans took issue with Lauren Schmidt‘s show. The novels were full of life and verve, elves, witches, and witch hunters, so one has to wonder why “The Witcher” drowned out that color with lifeless hues, trading lively characters for sad, groaning men. These witch hunters didn’t need a mission. They needed a vacation. The screenplay by Beau DeMayo, who also worked on the show, follows the basic outline of the monster-of-the-week structure employed by “The Witcher,” just with a whole lot more vibrancy packed into it. Vesemir, a witcher (i.e. a witch hunter for hire), is tasked with tracking down a creature in the woods bordering the Continent somewhere on the outskirts of Kaedwen. In the process, he comes across a “leshen,” a shape-shifting witch that dices up townspeople like carrots and gobbles up their remains like a lion after a week of fasting. Vesemir brings a sense of humor to their battle, throwing shade at the monster as he jumps from tree to tree in order to catch the beast off-guard. He cuts off the leshen’s arms, but it still manages to slip away. Meanwhile, a handful of characters wander the Continent. Tetra (Lara Pulver) tries to convince the court that witchers are dangerous and should be exiled, while an old friend of Vesemir’s, Lady Zerbst (Mary McDonnell), argues in his favor. Accompanying her is Deglan (Graham McTavish), who recruits witchers to protect the land from outside forces. Also along for the ride are a couple of trainees, including Geralt, the main-character in “The Witcher,” and Luka (Matt Yang King), Vesemir’s best friend/drinking buddy. Vesemir’s mission brings all these individuals together, in a “Game of Thrones”-style climax that trades dragons for witches. This new “Witcher” is obviously a step up from the show in terms of visuals and atmosphere, but it also feels like a bigger film in character, and, indeed, characters. Kwang, who made his reputation with Adult Swim’s “The Boondocks,” three episodes of which he directed, can certainly flesh out his characters in more ways than one. While there’s no shortage of throat-slashing, there’s also a good 30 minutes devoted to backstory, developing the players in such a way that, by the time “Nightmare of the Wolf” reaches its operatic conclusion, the emotional payoffs feel earned and honest.",POSITIVE
