Date,Reviews,Score
"Sep 2, 2021"," The Witcher: Nightmare of the Wolf is an action-packed ride that delivers on its premise, but loses sight of some of the franchise's nuanced themes.  The Path has been long for the filmmakers and audience alike, but the long-awaited tie-in to Netflix's The Witcher series has finally arrived. Written by Beau DeMayo, The Witcher: Nightmare of the Wolf promised a never-before-told story focused on Vesemir, the oldest living witcher at Kaer Morhen. Overall, the anime film delivers on its unique premise.   Andrzej Sapkowski's novels introduced Vesemir in Blood of Elves and CD Projekt Red's video games brought an end to his story in The Witcher 3: Wild Hunt. While plenty across the franchise have come to see Vesemir the way Geralt of Rivia and his brethren do, the old wolf's story has only ever been hinted at and never really explored. Nightmare of the Wolf, a violent, monster-filled anime adventure, captures the brutality and pain of, not just Vesemir's life, but the witcher profession. It has its minor flaws, but Netflix's anime tie-in film constructs a fitting tale for the School of the Wolf itself and is a must-see for any fan of The Witcher franchise.   Nightmare of the Wolf introduces a younger Vesemir, charmingly voiced by Theo James. He's a highly skilled witcher who initially only cares about killing monsters and receiving coin. That changes when his fight with what appears to be a new kind of leshen gains the attention of Tetra, a sorceress in the court of King Dagread of Kaedwen, who, driven by a belief that witchers are by nature deceptive and dangerous, attempts to turn against the residents of Kaer Morhen. Vesemir soon finds himself embroiled in a mystery involving magic, missing elven children, and new monsters -- the conclusion of which will decide the School of the Wolf's fate.   While Vesemir's past is new territory in the franchise, those familiar with the Continent have a lot to look forward to as well. There are a few familiar faces that turn up in the anime, lots of references to the novels -- like the chapter titles of The Last Wish sprinkled throughout -- and beautifully drawn set pieces. The film was produced by Studio Mir, best known for its work on Legend of Korra and Voltron: Legendary Defender. The hallmarks of the studio are all there in Nightmare of the Wolf's art style and in the execution of its thrilling action sequences.   Unlike most of Studio Mir's previous works, the action scenes in The Witcher: Nightmare of the Wolf are especially violent. Blood spews and limbs fly in ways that evoke the Castlevania series. At times, it can be excessive; but, given the presence of vicious monsters, it is occasionally necessary to capture the sheer savagery that witchers are trained to fight. It also works well with Nightmare of the Wolf's fairly accurate depiction of the witcher's fighting style. Fans of Sapkowski's novels will know that the witchers -- of Geralt, at least -- employ a dance-like style consisting of constant pirouettes to avoid attacks until ready to execute a precise strike. That is very much how Studio Mir brings Vesemir fighting style to life.   The Witcher has never really been about killing monsters. One of the most prominent themes throughout the novels and, by extension, the franchise, has always been the fallacy of good and evil. Netflix adheres to that theme in Nightmare of the Wolf well, and it results in a fair number of scenes where audiences will have trouble deciding who to root for. Just like many of the characters in the novels, the characters that populate the anime film are not good or evil in any obvious way, which is something longtime franchise fans will certainly appreciate.   That being said, The Witcher: Nightmare of the Wolf brings plenty of new material to the table. It uses its unexplored setting to tell a deeper story about the School of the Wolf -- including Tetra, Vesemir's childhood friend, Illyana, and Deglan, the witcher that led him to Kaer Morhen. Deglan was created for the show and isn't mentioned in Sapkowski's novels. Even so, he fits right in with the lifestyle and world of Kaer Morhen's past. He's not exactly a likable character, but he's not supposed to be. None of the characters are. He's just a representation of everything Kaer Morhen was in Vesemir's youth, and all the cruelty, moral ambiguity, and necessity that came with it. His complexity, coupled with Graham McTavish's memorable vocal performance ensures that Deglan will be a welcome addition to the world.   Nightmare of the Wolf has a lot in store for both longtime fans of the books and video games, as well as audiences who are just now experiencing The Witcher for the first time. Screenwriter and producer Beau DeMayo previously teased that his intention was to ""give fans that are familiar with the series a totally unique experience that I hope makes them feel like they're coming to 'The Witcher' for the first time again."" It is fair to say that he, director Kwang Il Han, and executive producer Lauren Hissrich, have succeeded in doing that.   More importantly, they justified the need for an anime tie-in film. This isn't just a story about Vesemir, who audiences will see in Season 2 of Netflix's The Witcher. This is a story about Kaer Morhen and the ruins of the mountain fortress will mean that much more to those keeping up, thanks to Nightmare of the Wolf.  Narayan Liu (/Nəraɪʌn Lɪʊ/ in IPA) is a contributing features and news writer, and junior editor at CBR. From Hong Kong, currently based in Sweden. Nowadays Narayan writes about films, TV shows, comic books and video games, or about anything related to The Witcher. He does this while studying language, culture, and communication at Linnaeus University. You can follow him on his blog (narayanliu.wordpress.com), on Twitter (@Narayan_Liu) or contact him directly at Narayan(dot)Liu(at)gmail.com. A new report reveals what the title of the upcoming Jurassic World 4 will be as the film prepares to begin principal photography this summer. ",POSITIVE
"Sep 1, 2021"," While niche anime streaming services such as Crunchyroll and Funimation primarily rely on their robust back catalogs of classic and obscure animation to attract viewers, Netflix has embraced a different approach, one built predominantly around new, original content. (They’ve also gobbled up exclusive distribution deals for series that have never premiered outside of Japan.) Slowly but surely, the streaming giant has built a slate of well-regarded anime series that cover a variety of styles and genres, including Aggretsuko (2018-), Devilman Crybaby (2018), Carole & Tuesday (2019), and Kengan Ashura (2019). American and South Korean studios that produce anime-style animation have also been getting in on the venture, with series such as Voltron: Legendary Defender (2016-2018), Blood of Zeus (2020-) and Dota: Dragon’s Blood (2021-). Netflix’s latest project with South Korea’s Studio Mir – which produced Voltron and Dota and animated the bulk of Nickelodeon’s The Legend of Korra (2012-14) – lies at the confluence of the streaming service’s anime offerings and its live-action fantasy programming. The Witcher: Nightmare of the Wolf is a one-off animated feature film, but it also serves as a prequel to Netflix’s sword-and-sorcery series, The Witcher (2019-). This makes Nightmare an odd beast, in terms of its intended audience. The film is clearly designed to attract the same viewers that made The Witcher one of Netflix’s buzzy success stories, but it also fits comfortably within the original anime programming block that the company has established. Indeed, it is perhaps not coincidental that Nightmare of the Wolf bears a passing resemblance to the Netflix anime series that is most visible to casual American viewers, Castlevania (2017-21): Both are dark fantasy-action stories characterized by their horror elements and ultra-violent tone. For established fans of The Witcher, this new animated film is not exactly essential, but it should provide a gratifying dip into the series’ world as they wait for the premiere of the second season in December. Although the film is set decades prior to the live-action show – and therefore focuses on previously unseen characters – it does flesh out the series’ mythology quite splendidly. It also dramatizes a crucial historical event that will be familiar to devotees of Andrzej Sapkowski’s original novels and CD Projeckt Red’s acclaimed Witcher video-game series. Where other viewers are concerned, the obvious question is whether Nightmare of the Wolf functions well as a standalone serving of anime-flavored medieval fantasy. In terms of stylish animation, clever storytelling, and gruesome fantasy violence, the film certainly delivers, although it never does much to distinguish itself from Netflix’s numerous offerings in the same vein. Familiarity with the lore of The Witcher is not strictly necessary to follow Nightmare of the Wolf, as the film swiftly establishes the basics. The witchers are a guild of monster hunters, mercenaries who roam a vast and nameless medieval continent, slaying creatures of legend in exchange for coin. Unlike the ageless sorcerers that skulk behind the thrones of this world’s petty kingdoms, witchers are not born but made: The young boys recruited by the order are subjected to horrifying alchemical mutations that grant them long lifespans, heightened senses, and rudimentary magic abilities. Nightmare of the Wolf is centered on a cocky witcher named Vesemir (Theo James), a figure who will one day serve as mentor to the live-action series’ protagonist, Geralt. In the film’s opening scenes, Vesemir slays a predatory forest spirit that has slaughtered a traveling noble family. Clues from the scene lead Vesemir to suspect that another party was controlling the creature – and possibly other monsters in the region that have been exhibiting unusual and aggressive behavior. At the court of the local monarch, sorceress Tetra Gilcrest (Lara Pulver) is keen on blaming the witchers themselves for this recent spate of attacks, while the noblewoman Lady Zerbst (Mary McDonnell) argues for prudence and demands more evidence. While the king hems and haws, Vesemir is visited by an old elven ally, Filavandrel (Tom Canton), who has his suspicions about the creature that the witcher slew but also has his own interests to protect. Eventually, Vesemir is obliged to pair up with the disdainful Tetra to hunt down the mastermind who has been bedeviling the kingdom with this small army of mutated monsters. Nightmare of the Wolf is a typical animated fantasy-action feature in most respects, stitching together high-octane anime action set-pieces with sequences of sleuthing, politicking, and pensive characterization. Beau DeMayo’s screenplay draws out what is essentially a 55-minute adventure to feature length by splicing in two lengthy flashbacks to Vesemir’s childhood. The rationale for this somewhat awkward structure eventually becomes clear – setting up a genuinely satisfying reveal – but the effect is nonetheless a little jarring. These flashbacks touch on young Vesemir’s (David Errigo Jr.) nascent romance with his friend Illyana (Jennifer Hale), his tutelage under the rough-edged, hard-drinking witcher Deglan (Graham McTavish), and his early days at Kaer Morhen, the castle stronghold of the witcher faction known as the School of the Wolf. The more intimate, character-centered quality to the flashbacks unfortunately means that it’s easy to forget about the present-day monster-investigation plot, creating some dissonance when the film snaps back to it after a 10-minute digression. That said, director Kwang Il Han – a seasoned storyboard artist and animation director, here helming his first feature film – keeps the proceedings relatively brisk, lucid, and focused.  The first season of Lauren Schmidt Hissrich’s live-action series was a bit wobbly in its early episodes as it struggled to find a consistent, distinctive tone and establish itself as something other than Netflix’s Game of Thrones also-ran. In contrast, Kwang’s film knows exactly what it’s about, serving up plenty of gory, exaggerated witcher-on-monster action and embellishing it with the sort of wild acrobatics and over-the-top pyrotechnics that don’t really work in a live-action context. Like Hissrich’s series, Nightmare of the Wolf makes an effort to capture something of the witchers’ balletic swordplay technique, which Sapkowski describes so vividly in his novels and which proves a terrific fit for anime-style animation. Kwang also employs montage shrewdly and imaginatively, most memorably in a sequence where a bittersweet letter from Illyana is read aloud over wordless shots of young Vesemir’s brutal initiation rites at Kaer Morhen. Nightmare of the Wolf leads directly into The Witcher’s upcoming season – in which an aged Vesimir plays a crucial role – but the film’s modest success as a dark fantasy tale doesn’t really depend on the live-action series. Viewers who are already enamored with Sapkowski’s Slavic-flavored, Tolkienesque setting will probably appreciate this stylized interpretation of the world, but everything that Kwang’s feature does well, it does well on its own. The roguish, swaggering Vesemir is a shallow but charming character, and his secret heartache for the quiet life he might have had with Illyana proves to be a surprisingly poignant emotional foundation for what is, in essence, a hyper-violent cartoon. Like Castlevania, the film depicts both monster- and human-wrought violence in a manner that is grisly and shocking, underlining that life is cheap and death can be sudden. For seasoned fans of adult-oriented anime, it will be familiar territory, but if the prospect of watching screaming children being torn apart by giant mutant cockroaches gives you pause, consider this your content warning.",POSITIVE
"Aug 31, 2021"," The Witcher: Nightmare Of The Wolf takes place decades before the events of The Witcher and follows the story of Vesemir (Theo James) the Witcher who trained Geralt of Rivia when he was just a wee lad. (Vesemir is being played by Kim Bodnia from Killing Eve in the live-action Witcher’s second season, so you can see a great deal of time has passed). Even if you’re not into anime, you should absolutely watch Nightmare of the Wolf if you care at all about the story of the Witchers. The events of the movie will play directly into the show’s second season, not just because of Vesemir but because of the Witcher fortress of Kaer Morhen, which will be one of the more important locations in the coming season. Nightmare of the Wolf is partly Vesemir’s origin story and partly the story of the fall of Kaer Morhen and the near-eradication of the Witchers themselves at the hands of the powerful sorceress, Tetra Gilcrest (Lara Pulver). Tetra has her reasons to despise Witchers, though I won’t spoil those here. Suffice to say, she’s made it her lifelong quest to rid Kaedwin of the Witcher menace. She accuses them of dishonesty and defrauding the people and the crown, of creating the very monsters they then hunt down and various other crimes. She’s opposed in this by Lady Zerbst (Mary McDonnell) a noble widow and adviser to the king, who supports the Witchers. To say that these women do not see eye to eye would be a massive understatement. One thing leads to another and a final battle at Kaer Morhen finally takes place that’s quite riveting. Along the way we meet a mutant elf, plenty of terrifying monsters and the elf king Filavandrel (Tom Canton) who we’d met previously in Season 1 of The Witcher (he captured Geralt and Jaskier after which Jaskier penned his catchy Toss A Coin To Your Witcher tune). We also meet Vesemir’s tutor and master, Deglan (Graham McTavish). Deglan is a bold and fearsome leader with some dark secrets and a rather precarious relationship with morality. Ultimately we discover that his own hubris is as much to blame for the Witchers’ downfall as Tetra’s ruthlessness. You never know if a spinoff like this will be a cash-grab or lose the tone and feel of the series by adopting such a different medium. Altered Carbon: Resleeved, the anime Altered Carbon spinoff, was bad enough to make me worry about this one. Same with the Dragon’s Dogma anime. Then again, Castlevania is a terrific Netflix anime based on a video game series, so it really is hit-or-miss. Fortunately, Nightmare of the Wolf is well worth your time. The cast is outstanding, the story is at once action-packed and moving. Vesemir is such a strikingly different Witcher than Geralt and it’s fascinating to see how he became a mutant and just how awful and dangerous that process is (perhaps even more awful and dangerous than becoming a sorceress). The movie adds layers to the Witcher universe, giving us important backstory and more of the fun politicking and intrigue that makes this series so compelling. There’s also a lot of terrific action and magic, the kind of stuff that costs a lot in a live-action but can be done relatively easily in an animated film. You won’t see Henry Cavill doing back-flips and jumping twenty feet into the air, but Vesemir isn’t constrained by such paltry matters as physics—if only the games had such riveting combat! I honestly have no complaints. The film is never boring, never poorly written or acted, and runs a most welcome hour and 23 minutes. Movies are too long these days, but not this one. I suppose if I had to complain about anything it would simply be that the animation style is so different from the show, and it might have been nice to dial down the anime aspects to make it feel just a bit more in line with the show and games. But honestly once I was watching I hardly noticed or thought about it. If the art style turns you off, I still think you should watch this one regardless. Follow me on Twitter and Facebook. You can support my work on Patreon and sign up for my newsletter on Substack. Subscribe to my YouTube channel here.",POSITIVE
"Aug 28, 2021"," This Week: Kevin starts things off with a look at some box office news with both Free Guy and Black Widow, as well as some release dates that may or may not move over the next couple weeks. Then, he looks at new trailers for Spider-Man: No Way Home and Welcome to the Blumhouse. Later, he reviews Candyman, Vacation Friends, The Colony, He’s All That and The Witcher: Nightmare of the Wolf. Finally, he wraps things up with the Home-Cinema Round-Up, in which he review the vintage sequels Candyman 2: Farewell to the Flesh and Candyman 3: Day of the Dead.",POSITIVE
"Aug 27, 2021"," If like me you couldn’t get into “The Witcher” live-action series due to it not being in chronological order, then “The Witcher: Nightmare of the Wolf” is the perfect way to get into the action pack fantasy world.  In the movie, the world of “The Witcher” expands in this anime origin story. Before Geralt (played by Henry Cavill in the live-action series), there was his mentor Vesemir (Theo James), as a swashbuckling young witcher who escaped a life of poverty to slay monsters for coins.  However, when a strange new monster begins terrorising a politically fraught kingdom, Vesemir finds himself on a frightening adventure that forces him to confront the demons of his past.  “The Witcher” live-action show, an adaptation of Andrzej Sapkowski’s book series of the same name, was a difficult show for me to get into due to its non-linear storytelling style.  I gave up about three episodes in because of the sheer confusion. However, the world of “The Witcher” always intrigued me as a lover of anything fantasy-related. And while I know some people aren’t fans of anime, the medium allows for the property to go big with regards to action sequences and that overall scale of the show.  And unlike the show, this movie is mostly in chronological order with some flashbacks, but they serve a huge purpose in the end not only for our lead’s character development but  the overarching plot of the movie. The voice acting is stellar with James doing a great job as Vesemir, giving the character the proper balance between loveable arrogance and compelling hero. The animation is spectacular and they did a great job of using the medium to its fullest when it comes to the action scenes and the overall mood of the movie.  It is the prequel we needed to give a bit more depth to the world we were introduced to in the live-action series and also help those – like me – who fell off along the way.",POSITIVE
"Aug 27, 2021"," Until Henry Cavill returns for another season of the live action fantasy series about mercenary monster hunters with supernatural powers in December, here is the animated prequel currently showing on Netflix. Some may be disappointed that there are no familiar characters, but this does explore the lore and is an entertaining look at Vesemir, the witcher who trained Cavill's character Geralt. This side of his character is put across brilliantly by Theo James from the Divergent films, who gives a voice acting masterclass in bringing Vesemir to life.",NEUTRAL
"Aug 27, 2021"," The latest in the line of Netflix “original Anime” that aren’t actually anime (serious guys, the only distinction in the country its created in, there’s nothing wrong with creating a more adult oriented animation and it being technically a cartoon…) The Witcher: Nightmare of the Wolf serves as a prequel to the Netflix live action series and focuses on the backstory of Geralt’s teacher Vesemir, who is set to debut in Season 2, and the downfall of the Witchers. A good premise then, did they pull it off? Vesemir, a cocky young Witcher, delights in slaying monsters for coin. When a dangerous new power rises on the Continent, Vesemir learns that some Witchering jobs are about more than just money. This leads to a large scale battle at Kaer Morhen that results in the Witchers being decimated, the mage and method of creation lost and Vesemir accidentally killing a childhood friend (who was now an old woman, that’s Witcher aging for you!) He ends up rescuing a small group of just-converted Witcher children and decides to teach them, one of which is identified as a young Geralt. So the film has its moments but it’s also very by-the-numbers, and I wasn’t thrilled with the character designs, even if the actual animation was well done. The Witcher: Nightmare of the Wolf has some great moments and interesting backstory but it’s also very plain, full of generic characters and has scenes with over-the-top violence for the sake of it. Not a bad way to spend an hour and a half, but I doubt I’ll be watching it again.",NEUTRAL
